title,year,conf,conf_long
Biomedical Document Retrieval for Clinical Decision Support System,2018,ACL,the Association for Computational Linguistics
Graph-based Filtering of Out-of-Vocabulary Words for Encoder-Decoder Models,2018,ACL,the Association for Computational Linguistics
Automatic Spelling Correction for Resource-Scarce Languages using Deep Learning,2018,ACL,the Association for Computational Linguistics
Recognizing Complex Entity Mentions: A Review and Future Directions,2018,ACL,the Association for Computational Linguistics
Exploring Chunk Based Templates for Generating a subset of English Text,2018,ACL,the Association for Computational Linguistics
Learning-based Composite Metrics for Improved Caption Evaluation,2018,ACL,the Association for Computational Linguistics
Pushing the Limits of Radiology with Joint Modeling of Visual and Textual Information,2018,ACL,the Association for Computational Linguistics
SuperNMT: Neural Machine Translation with Semantic Supersenses and Syntactic Supertags,2018,ACL,the Association for Computational Linguistics
Automatic Detection of Cross-Disciplinary Knowledge Associations,2018,ACL,the Association for Computational Linguistics
German and French Neural Supertagging Experiments for LTAG Parsing,2018,ACL,the Association for Computational Linguistics
"Mixed Feelings: Natural Text Generation with Variable, Coexistent Affective Categories",2018,ACL,the Association for Computational Linguistics
Alignment Analysis of Sequential Segmentation of Lexicons to Improve Automatic Cognate Detection,2018,ACL,the Association for Computational Linguistics
Unsupervised Semantic Abstractive Summarization,2018,ACL,the Association for Computational Linguistics
Recursive Neural Network Based Preordering for English-to-Japanese Machine Translation,2018,ACL,the Association for Computational Linguistics
Automatic Question Generation using Relative Pronouns and Adverbs,2018,ACL,the Association for Computational Linguistics
