title,year,conf,conf_long
Knowledge Diffusion for Neural Dialogue Generation,2018,ACL,the Association for Computational Linguistics
Neural Factor Graph Models for Cross-lingual Morphological Tagging,2018,ACL,the Association for Computational Linguistics
Sequicity: Simplifying Task-oriented Dialogue Systems with Single Sequence-to-Sequence Architectures,2018,ACL,the Association for Computational Linguistics
Gaussian Mixture Latent Vector Grammars,2018,ACL,the Association for Computational Linguistics
Extending a Parser to Distant Domains Using a Few Dozen Partially Annotated Examples,2018,ACL,the Association for Computational Linguistics
"Event2Mind: Commonsense Inference on Events, Intents, and Reactions",2018,ACL,the Association for Computational Linguistics
A Helping Hand: Transfer Learning for Deep Sentiment Analysis,2018,ACL,the Association for Computational Linguistics
NASH: Toward End-to-End Neural Architecture for Generative Semantic Hashing,2018,ACL,the Association for Computational Linguistics
Exemplar Encoder-Decoder for Neural Conversation Generation,2018,ACL,the Association for Computational Linguistics
Neural Models for Documents with Metadata,2018,ACL,the Association for Computational Linguistics
Improving Entity Linking by Modeling Latent Relations between Mentions,2018,ACL,the Association for Computational Linguistics
Probabilistic Embedding of Knowledge Graphs with Box Lattice Measures,2018,ACL,the Association for Computational Linguistics
Cross-Domain Sentiment Classification with Target Domain Specific Information,2018,ACL,the Association for Computational Linguistics
Incorporating Latent Meanings of Morphological Compositions to Enhance Word Embeddings,2018,ACL,the Association for Computational Linguistics
Interactive Language Acquisition with One-shot Visual Concept Learning through a Conversational Game,2018,ACL,the Association for Computational Linguistics
The Hitchhiker’s Guide to Testing Statistical Significance in Natural Language Processing,2018,ACL,the Association for Computational Linguistics
Strong Baselines for Neural Semi-Supervised Learning under Domain Shift,2018,ACL,the Association for Computational Linguistics
NeuralREG: An end-to-end approach to referring expression generation,2018,ACL,the Association for Computational Linguistics
Subword-level Word Vector Representations for Korean,2018,ACL,the Association for Computational Linguistics
Visual Attention Model for Name Tagging in Multimodal Social Media,2018,ACL,the Association for Computational Linguistics
"LSTMs Can Learn Syntax-Sensitive Dependencies Well, But Modeling Structure Makes Them Better",2018,ACL,the Association for Computational Linguistics
A Graph-to-Sequence Model for AMR-to-Text Generation,2018,ACL,the Association for Computational Linguistics
Identifying Transferable Information Across Domains for Cross-domain Sentiment Classification,2018,ACL,the Association for Computational Linguistics
Backpropagating through Structured Argmax using a SPIGOT,2018,ACL,the Association for Computational Linguistics
A Stylometric Inquiry into Hyperpartisan and Fake News,2018,ACL,the Association for Computational Linguistics
Numeracy for Language Models: Evaluating and Improving their Ability to Predict Numbers,2018,ACL,the Association for Computational Linguistics
What you can cram into a single \$\&!#* vector: Probing sentence embeddings for linguistic properties,2018,ACL,the Association for Computational Linguistics
Language Generation via DAG Transduction,2018,ACL,the Association for Computational Linguistics
Building Language Models for Text with Named Entities,2018,ACL,the Association for Computational Linguistics
Reliability and Learnability of Human Bandit Feedback for Sequence-to-Sequence Reinforcement Learning,2018,ACL,the Association for Computational Linguistics
To Attend or not to Attend: A Case Study on Syntactic Structures for Semantic Relatedness,2018,ACL,the Association for Computational Linguistics
Straight to the Tree: Constituency Parsing with Neural Syntactic Distance,2018,ACL,the Association for Computational Linguistics
Deep Dyna-Q: Integrating Planning for Task-Completion Dialogue Policy Learning,2018,ACL,the Association for Computational Linguistics
Rumor Detection on Twitter with Tree-structured Recursive Neural Networks,2018,ACL,the Association for Computational Linguistics
Improving Event Coreference Resolution by Modeling Correlations between Event Coreference Chains and Document Topic Structures,2018,ACL,the Association for Computational Linguistics
Aspect Based Sentiment Analysis with Gated Convolutional Networks,2018,ACL,the Association for Computational Linguistics
Modeling Deliberative Argumentation Strategies on Wikipedia,2018,ACL,the Association for Computational Linguistics
Attention Focusing for Neural Machine Translation by Bridging Source and Target Embeddings,2018,ACL,the Association for Computational Linguistics
Illustrative Language Understanding: Large-Scale Visual Grounding with Image Search,2018,ACL,the Association for Computational Linguistics
Universal Language Model Fine-tuning for Text Classification,2018,ACL,the Association for Computational Linguistics
A Structured Variational Autoencoder for Contextual Morphological Inflection,2018,ACL,the Association for Computational Linguistics
Working Memory Networks: Augmenting Memory Networks with a Relational Reasoning Module,2018,ACL,the Association for Computational Linguistics
Sentiment Adaptive End-to-End Dialog Systems,2018,ACL,the Association for Computational Linguistics
On the Limitations of Unsupervised Bilingual Dictionary Induction,2018,ACL,the Association for Computational Linguistics
A Spatial Model for Extracting and Visualizing Latent Discourse Structure in Text,2018,ACL,the Association for Computational Linguistics
What Action Causes This? Towards Naive Physical Action-Effect Prediction,2018,ACL,the Association for Computational Linguistics
"Personalizing Dialogue Agents: I have a dog, do you have pets too?",2018,ACL,the Association for Computational Linguistics
Extractive Summarization with SWAP-NET: Sentences and Words from Alternating Pointer Networks,2018,ACL,the Association for Computational Linguistics
A Unified Model for Extractive and Abstractive Summarization using Inconsistency Loss,2018,ACL,the Association for Computational Linguistics
Graph-to-Sequence Learning using Gated Graph Neural Networks,2018,ACL,the Association for Computational Linguistics
Incorporating Glosses into Neural Word Sense Disambiguation,2018,ACL,the Association for Computational Linguistics
Deep Reinforcement Learning for Chinese Zero Pronoun Resolution,2018,ACL,the Association for Computational Linguistics
Dating Documents using Graph Convolution Networks,2018,ACL,the Association for Computational Linguistics
Question Condensing Networks for Answer Selection in Community Question Answering,2018,ACL,the Association for Computational Linguistics
AdvEntuRe: Adversarial Training for Textual Entailment with Knowledge-Guided Examples,2018,ACL,the Association for Computational Linguistics
Discourse Representation Structure Parsing,2018,ACL,the Association for Computational Linguistics
Retrieval of the Best Counterargument without Prior Topic Knowledge,2018,ACL,the Association for Computational Linguistics
Entity-Centric Joint Modeling of Japanese Coreference Resolution and Predicate Argument Structure Analysis,2018,ACL,the Association for Computational Linguistics
Sequence-to-sequence Models for Cache Transition Systems,2018,ACL,the Association for Computational Linguistics
Improving Text-to-SQL Evaluation Methodology,2018,ACL,the Association for Computational Linguistics
"Retrieve, Rerank and Rewrite: Soft Template Based Neural Summarization",2018,ACL,the Association for Computational Linguistics
Language Modeling for Code-Mixing: The Role of Linguistic Theory based Synthetic Data,2018,ACL,the Association for Computational Linguistics
A Purely End-to-End System for Multi-speaker Speech Recognition,2018,ACL,the Association for Computational Linguistics
Fluency Boost Learning and Inference for Neural Grammatical Error Correction,2018,ACL,the Association for Computational Linguistics
Chinese NER Using Lattice LSTM,2018,ACL,the Association for Computational Linguistics
Efficient Low-rank Multimodal Fusion With Modality-Specific Factors,2018,ACL,the Association for Computational Linguistics
A Stochastic Decoder for Neural Machine Translation,2018,ACL,the Association for Computational Linguistics
"Deep-speare: A joint neural model of poetic language, meter and rhyme",2018,ACL,the Association for Computational Linguistics
Sentence-State LSTM for Text Representation,2018,ACL,the Association for Computational Linguistics
Multi-Turn Response Selection for Chatbots with Deep Attention Matching Network,2018,ACL,the Association for Computational Linguistics
Interpretable and Compositional Relation Learning by Joint Training with an Autoencoder,2018,ACL,the Association for Computational Linguistics
Constituency Parsing with a Self-Attentive Encoder,2018,ACL,the Association for Computational Linguistics
Think Visually: Question Answering through Virtual Imagery,2018,ACL,the Association for Computational Linguistics
Towards Robust Neural Machine Translation,2018,ACL,the Association for Computational Linguistics
Distilling Knowledge for Search-based Structured Prediction,2018,ACL,the Association for Computational Linguistics
Fast Abstractive Summarization with Reinforce-Selected Sentence Rewriting,2018,ACL,the Association for Computational Linguistics
Accurate SHRG-Based Semantic Parsing,2018,ACL,the Association for Computational Linguistics
Triangular Architecture for Rare Language Translation,2018,ACL,the Association for Computational Linguistics
Word Embedding and WordNet Based Metaphor Identification and Interpretation,2018,ACL,the Association for Computational Linguistics
Coherence Modeling of Asynchronous Conversations: A Neural Entity Grid Approach,2018,ACL,the Association for Computational Linguistics
Stock Movement Prediction from Tweets and Historical Prices,2018,ACL,the Association for Computational Linguistics
The Best of Both Worlds: Combining Recent Advances in Neural Machine Translation,2018,ACL,the Association for Computational Linguistics
Neural Document Summarization by Jointly Learning to Score and Select Sentences,2018,ACL,the Association for Computational Linguistics
Probabilistic FastText for Multi-Sense Word Embeddings,2018,ACL,the Association for Computational Linguistics
Ultra-Fine Entity Typing,2018,ACL,the Association for Computational Linguistics
Incorporating Chinese Characters of Words for Lexical Sememe Prediction,2018,ACL,the Association for Computational Linguistics
Eyes are the Windows to the Soul: Predicting the Rating of Text Quality Using Gaze Behaviour,2018,ACL,the Association for Computational Linguistics
Neural Adversarial Training for Semi-supervised Japanese Predicate-argument Structure Analysis,2018,ACL,the Association for Computational Linguistics
Multi-Passage Machine Reading Comprehension with Cross-Passage Answer Verification,2018,ACL,the Association for Computational Linguistics
Higher-order Relation Schema Induction using Tensor Factorization with Back-off and Aggregation,2018,ACL,the Association for Computational Linguistics
Supervised Treebank Conversion: Data and Approaches,2018,ACL,the Association for Computational Linguistics
Context-Aware Neural Model for Temporal Information Extraction,2018,ACL,the Association for Computational Linguistics
Style Transfer Through Back-Translation,2018,ACL,the Association for Computational Linguistics
Prefix Lexicalization of Synchronous CFGs using Synchronous TAG,2018,ACL,the Association for Computational Linguistics
Zero-shot Learning of Classifiers from Natural Language Quantification,2018,ACL,the Association for Computational Linguistics
No Metrics Are Perfect: Adversarial Reward Learning for Visual Storytelling,2018,ACL,the Association for Computational Linguistics
Learning How to Actively Learn: A Deep Imitation Learning Approach,2018,ACL,the Association for Computational Linguistics
Multimodal Language Analysis in the Wild: CMU-MOSEI Dataset and Interpretable Dynamic Fusion Graph,2018,ACL,the Association for Computational Linguistics
Discourse Coherence: Concurrent Explicit and Implicit Relations,2018,ACL,the Association for Computational Linguistics
Evaluating neural network explanation methods using hybrid documents and morphosyntactic agreement,2018,ACL,the Association for Computational Linguistics
Learning to Generate Move-by-Move Commentary for Chess Games from Large-Scale Social Forum Data,2018,ACL,the Association for Computational Linguistics
Soft Layer-Specific Multi-Task Summarization with Entailment and Question Generation,2018,ACL,the Association for Computational Linguistics
A robust self-learning method for fully unsupervised cross-lingual mappings of word embeddings,2018,ACL,the Association for Computational Linguistics
A Framework for Representing Language Acquisition in a Population Setting,2018,ACL,the Association for Computational Linguistics
Hierarchical Neural Story Generation,2018,ACL,the Association for Computational Linguistics
Automatic Metric Validation for Grammatical Error Correction,2018,ACL,the Association for Computational Linguistics
Multi-Relational Question Answering from Narratives: Machine Reading and Reasoning in Simulated Worlds,2018,ACL,the Association for Computational Linguistics
LinkNBed: Multi-Graph Representation Learning with Entity Linkage,2018,ACL,the Association for Computational Linguistics
Adversarial Contrastive Estimation,2018,ACL,the Association for Computational Linguistics
Learning to Ask Questions in Open-domain Conversational Systems with Typed Decoders,2018,ACL,the Association for Computational Linguistics
Are BLEU and Meaning Representation in Opposition?,2018,ACL,the Association for Computational Linguistics
Hierarchical Losses and New Resources for Fine-grained Entity Typing and Linking,2018,ACL,the Association for Computational Linguistics
Robust Distant Supervision Relation Extraction via Deep Reinforcement Learning,2018,ACL,the Association for Computational Linguistics
"Constraining MGbank: Agreement, L-Selection and Supertagging in Minimalist Grammars",2018,ACL,the Association for Computational Linguistics
Confidence Modeling for Neural Semantic Parsing,2018,ACL,the Association for Computational Linguistics
Give Me More Feedback: Annotating Argument Persuasiveness and Related Attributes in Student Essays,2018,ACL,the Association for Computational Linguistics
Tailored Sequence to Sequence Models to Different Conversation Scenarios,2018,ACL,the Association for Computational Linguistics
Efficient and Robust Question Answering from Minimal Context over Documents,2018,ACL,the Association for Computational Linguistics
Document Similarity for Texts of Varying Lengths via Hidden Topics,2018,ACL,the Association for Computational Linguistics
Sequence-to-Action: End-to-End Semantic Graph Generation for Semantic Parsing,2018,ACL,the Association for Computational Linguistics
Adaptive Scaling for Sparse Detection in Information Extraction,2018,ACL,the Association for Computational Linguistics
A Deep Relevance Model for Zero-Shot Document Filtering,2018,ACL,the Association for Computational Linguistics
Neural Sparse Topical Coding,2018,ACL,the Association for Computational Linguistics
Object-oriented Neural Programming (OONP) for Document Understanding,2018,ACL,the Association for Computational Linguistics
Towards Understanding the Geometry of Knowledge Graph Embeddings,2018,ACL,the Association for Computational Linguistics
Semi-supervised User Geolocation via Graph Convolutional Networks,2018,ACL,the Association for Computational Linguistics
hyperdoc2vec: Distributed Representations of Hypertext Documents,2018,ACL,the Association for Computational Linguistics
Coarse-to-Fine Decoding for Neural Semantic Parsing,2018,ACL,the Association for Computational Linguistics
Efficient Online Scalar Annotation with Bounded Support,2018,ACL,the Association for Computational Linguistics
Conversations Gone Awry: Detecting Early Signs of Conversational Failure,2018,ACL,the Association for Computational Linguistics
Unsupervised Neural Machine Translation with Weight Sharing,2018,ACL,the Association for Computational Linguistics
Modeling and Prediction of Online Product Review Helpfulness: A Survey,2018,ACL,the Association for Computational Linguistics
Pre- and In-Parsing Models for Neural Empty Category Detection,2018,ACL,the Association for Computational Linguistics
Unpaired Sentiment-to-Sentiment Translation: A Cycled Reinforcement Learning Approach,2018,ACL,the Association for Computational Linguistics
"Syntax for Semantic Role Labeling, To Be, Or Not To Be",2018,ACL,the Association for Computational Linguistics
Stack-Pointer Networks for Dependency Parsing,2018,ACL,the Association for Computational Linguistics
Simple and Effective Multi-Paragraph Reading Comprehension,2018,ACL,the Association for Computational Linguistics
Mining Cross-Cultural Differences and Similarities in Social Media,2018,ACL,the Association for Computational Linguistics
From Credit Assignment to Entropy Regularization: Two New Algorithms for Neural Sequence Prediction,2018,ACL,the Association for Computational Linguistics
Temporal Event Knowledge Acquisition via Identifying Narratives,2018,ACL,the Association for Computational Linguistics
Simple and Effective Text Simplification Using Semantic and Neural Methods,2018,ACL,the Association for Computational Linguistics
ParaNMT-50M: Pushing the Limits of Paraphrastic Sentence Embeddings with Millions of Machine Translations,2018,ACL,the Association for Computational Linguistics
Neural Argument Generation Augmented with Externally Retrieved Evidence,2018,ACL,the Association for Computational Linguistics
Target-Sensitive Memory Networks for Aspect Sentiment Classification,2018,ACL,the Association for Computational Linguistics
Discovering Implicit Knowledge with Unary Relations,2018,ACL,the Association for Computational Linguistics
Baseline Needs More Love: On Simple Word-Embedding-Based Models and Associated Pooling Mechanisms,2018,ACL,the Association for Computational Linguistics
Token-level and sequence-level loss smoothing for RNN language models,2018,ACL,the Association for Computational Linguistics
Joint Training of Candidate Extraction and Answer Selection for Reading Comprehension,2018,ACL,the Association for Computational Linguistics
Generating Fine-Grained Open Vocabulary Entity Type Descriptions,2018,ACL,the Association for Computational Linguistics
Semantically Equivalent Adversarial Rules for Debugging NLP models,2018,ACL,the Association for Computational Linguistics
Joint Reasoning for Temporal and Causal Relations,2018,ACL,the Association for Computational Linguistics
Denoising Distantly Supervised Open-Domain Question Answering,2018,ACL,the Association for Computational Linguistics
Composing Finite State Transducers on GPUs,2018,ACL,the Association for Computational Linguistics
Subword Regularization: Improving Neural Network Translation Models with Multiple Subword Candidates,2018,ACL,the Association for Computational Linguistics
A Neural Approach to Pun Generation,2018,ACL,the Association for Computational Linguistics
Unsupervised Abstractive Meeting Summarization with Multi-Sentence Compression and Budgeted Submodular Maximization,2018,ACL,the Association for Computational Linguistics
Textual Deconvolution Saliency (TDS) : a deep tool box for linguistic analysis,2018,ACL,the Association for Computational Linguistics
Searching for the X-Factor: Exploring Corpus Subjectivity for Word Embeddings,2018,ACL,the Association for Computational Linguistics
Attacking Visual Language Grounding with Adversarial Examples: A Case Study on Neural Image Captioning,2018,ACL,the Association for Computational Linguistics
Which Melbourne? Augmenting Geocoding with Maps,2018,ACL,the Association for Computational Linguistics
Transformation Networks for Target-Oriented Sentiment Classification,2018,ACL,the Association for Computational Linguistics
Knowledgeable Reader: Enhancing Cloze-Style Reading Comprehension with External Commonsense Knowledge,2018,ACL,the Association for Computational Linguistics
Learning to Control the Specificity in Neural Response Generation,2018,ACL,the Association for Computational Linguistics
A Multi-lingual Multi-task Architecture for Low-resource Sequence Labeling,2018,ACL,the Association for Computational Linguistics
AMR dependency parsing with a typed semantic algebra,2018,ACL,the Association for Computational Linguistics
Bilingual Sentiment Embeddings: Joint Projection of Sentiment Across Languages,2018,ACL,the Association for Computational Linguistics
Learning to Write with Cooperative Discriminators,2018,ACL,the Association for Computational Linguistics
Guess Me if You Can: Acronym Disambiguation for Enterprises,2018,ACL,the Association for Computational Linguistics
A Neural Architecture for Automated ICD Coding,2018,ACL,the Association for Computational Linguistics
Cold-Start Aware User and Product Attention for Sentiment Classification,2018,ACL,the Association for Computational Linguistics
Extracting Relational Facts by an End-to-End Neural Model with Copy Mechanism,2018,ACL,the Association for Computational Linguistics
Unsupervised Learning of Distributional Relation Vectors,2018,ACL,the Association for Computational Linguistics
MojiTalk: Generating Emotional Responses at Scale,2018,ACL,the Association for Computational Linguistics
Two Methods for Domain Adaptation of Bilingual Tasks: Delightfully Simple and Broadly Applicable,2018,ACL,the Association for Computational Linguistics
A Multi-Axis Annotation Scheme for Event Temporal Relations,2018,ACL,the Association for Computational Linguistics
Nugget Proposal Networks for Chinese Event Detection,2018,ACL,the Association for Computational Linguistics
End-to-End Reinforcement Learning for Automatic Taxonomy Induction,2018,ACL,the Association for Computational Linguistics
Unsupervised Discrete Sentence Representation Learning for Interpretable Neural Dialog Generation,2018,ACL,the Association for Computational Linguistics
Twitter Universal Dependency Parsing for African-American and Mainstream American English,2018,ACL,the Association for Computational Linguistics
Not that much power: Linguistic alignment is influenced more by low-level linguistic features rather than social power,2018,ACL,the Association for Computational Linguistics
Weakly Supervised Semantic Parsing with Abstract Examples,2018,ACL,the Association for Computational Linguistics
Multi-Granularity Hierarchical Attention Fusion Networks for Reading Comprehension and Question Answering,2018,ACL,the Association for Computational Linguistics
Context-Aware Neural Machine Translation Learns Anaphora Resolution,2018,ACL,the Association for Computational Linguistics
Multi-Input Attention for Unsupervised OCR Correction,2018,ACL,the Association for Computational Linguistics
Forest-Based Neural Machine Translation,2018,ACL,the Association for Computational Linguistics
Domain Adaptation with Adversarial Training and Graph Embeddings,2018,ACL,the Association for Computational Linguistics
SemAxis: A Lightweight Framework to Characterize Domain-Specific Word Semantics Beyond Sentiment,2018,ACL,the Association for Computational Linguistics
Generating Informative Responses with Controlled Sentence Function,2018,ACL,the Association for Computational Linguistics
Training Classifiers with Natural Language Explanations,2018,ACL,the Association for Computational Linguistics
Did the Model Understand the Question?,2018,ACL,the Association for Computational Linguistics
StructVAE: Tree-structured Latent Variable Models for Semi-supervised Semantic Parsing,2018,ACL,the Association for Computational Linguistics
On the Automatic Generation of Medical Imaging Reports,2018,ACL,the Association for Computational Linguistics
Character-Level Models versus Morphology in Semantic Role Labeling,2018,ACL,the Association for Computational Linguistics
Embedding Learning Through Multilingual Concept Induction,2018,ACL,the Association for Computational Linguistics
TDNN: A Two-stage Deep Neural Network for Prompt-independent Automated Essay Scoring,2018,ACL,the Association for Computational Linguistics
AMR Parsing as Graph Prediction with Latent Alignment,2018,ACL,the Association for Computational Linguistics
Mem2Seq: Effectively Incorporating Knowledge Bases into End-to-End Task-Oriented Dialog Systems,2018,ACL,the Association for Computational Linguistics
Neural Natural Language Inference Models Enhanced with External Knowledge,2018,ACL,the Association for Computational Linguistics
Document Context Neural Machine Translation with Memory Networks,2018,ACL,the Association for Computational Linguistics
Learning to Ask Good Questions: Ranking Clarification Questions using Neural Expected Value of Perfect Information,2018,ACL,the Association for Computational Linguistics
DialSQL: Dialogue Based Structured Query Generation,2018,ACL,the Association for Computational Linguistics
Discourse Marker Augmented Network with Reinforcement Learning for Natural Language Inference,2018,ACL,the Association for Computational Linguistics
Global-Locally Self-Attentive Encoder for Dialogue State Tracking,2018,ACL,the Association for Computational Linguistics
Disconnected Recurrent Neural Networks for Text Categorization,2018,ACL,the Association for Computational Linguistics
How Much Attention Do You Need? A Granular Analysis of Neural Machine Translation Architectures,2018,ACL,the Association for Computational Linguistics
Modeling Naive Psychology of Characters in Simple Commonsense Stories,2018,ACL,the Association for Computational Linguistics
