title,year,conf,conf_long
Assembling Strategic Narratives: Information Operations as Collaborative Work within an Online Community,2018,CSCW,The ACM Conference on Computer Supported Cooperative Work
Participating Through Data: Charting Relational Tensions in Multiplatform Data Flows,2018,CSCW,The ACM Conference on Computer Supported Cooperative Work
Investigating Separation of Territories and Activity Roles in Children's Collaboration around Tabletops,2018,CSCW,The ACM Conference on Computer Supported Cooperative Work
"Soften the Pain, Increase the Gain: Enhancing Users' Resilience to Negative Valence Feedback",2018,CSCW,The ACM Conference on Computer Supported Cooperative Work
Mediating Color Filter Exploration with Color Theme Semantics Derived from Social Curation Data,2018,CSCW,The ACM Conference on Computer Supported Cooperative Work
Understanding Motivations behind Inaccurate Check-ins,2018,CSCW,The ACM Conference on Computer Supported Cooperative Work
Knowing That You Know What I Know Helps?: Understanding the Effects of Knowledge Transparency in Online Knowledge Transfer,2018,CSCW,The ACM Conference on Computer Supported Cooperative Work
Our House: Living Long Distance with a Telepresence Robot,2018,CSCW,The ACM Conference on Computer Supported Cooperative Work
Shopping Over Distance through a Telepresence Robot,2018,CSCW,The ACM Conference on Computer Supported Cooperative Work
"Joint Media Engagement between Parents and Preschoolers in the U.S., China, and Taiwan",2018,CSCW,The ACM Conference on Computer Supported Cooperative Work
Learning by Doing versus Learning by Viewing: An Empirical Study of Data Analyst Productivity on a Collaborative Platform at eBay,2018,CSCW,The ACM Conference on Computer Supported Cooperative Work
"Value-Sensitive Algorithm Design: Method, Case Study, and Lessons",2018,CSCW,The ACM Conference on Computer Supported Cooperative Work
From Situational Awareness to Actionability: Towards Improving the Utility of Social Media Data for Crisis Response,2018,CSCW,The ACM Conference on Computer Supported Cooperative Work
Making Sense of Group Chat through Collaborative Tagging and Summarization,2018,CSCW,The ACM Conference on Computer Supported Cooperative Work
"""This is why we play"": Characterizing Online Fan Communities of the NBA Teams",2018,CSCW,The ACM Conference on Computer Supported Cooperative Work
Characterizing Online Public Discussions through Patterns of Participant Interactions,2018,CSCW,The ACM Conference on Computer Supported Cooperative Work
Coordination Mechanisms for Self-Organized Work in an Emergency Communication Center,2018,CSCW,The ACM Conference on Computer Supported Cooperative Work
User Perceptions of Smart Home IoT Privacy,2018,CSCW,The ACM Conference on Computer Supported Cooperative Work
Applications of Social Identity Theory to Research and Design in Computer-Supported Cooperative Work,2018,CSCW,The ACM Conference on Computer Supported Cooperative Work
