title,year,conf,conf_long
Pose-Guided Photorealistic Face Rotation,2018,CVPR,The Conference on Computer Vision and Pattern Recognition
Learning Globally Optimized Object Detector via Policy Gradient,2018,CVPR,The Conference on Computer Vision and Pattern Recognition
Photographic Text-to-Image Synthesis With a Hierarchically-Nested Adversarial Network,2018,CVPR,The Conference on Computer Vision and Pattern Recognition
Illuminant Spectra-Based Source Separation Using Flash Photography,2018,CVPR,The Conference on Computer Vision and Pattern Recognition
Trapping Light for Time of Flight,2018,CVPR,The Conference on Computer Vision and Pattern Recognition
The Perception-Distortion Tradeoff,2018,CVPR,The Conference on Computer Vision and Pattern Recognition
Label Denoising Adversarial Network (LDAN) for Inverse Lighting of Faces,2018,CVPR,The Conference on Computer Vision and Pattern Recognition
Optimal Structured Light à La Carte,2018,CVPR,The Conference on Computer Vision and Pattern Recognition
Tracking Multiple Objects Outside the Line of Sight Using Speckle Imaging,2018,CVPR,The Conference on Computer Vision and Pattern Recognition
Inferring Light Fields From Shadows,2018,CVPR,The Conference on Computer Vision and Pattern Recognition
Modifying Non-Local Variations Across Multiple Views,2018,CVPR,The Conference on Computer Vision and Pattern Recognition
Robust Video Content Alignment and Compensation for Rain Removal in a CNN Framework,2018,CVPR,The Conference on Computer Vision and Pattern Recognition
"SfSNet: Learning Shape, Reflectance and Illuminance of Faces `in the Wild'",2018,CVPR,The Conference on Computer Vision and Pattern Recognition
Deep Photo Enhancer: Unpaired Learning for Image Enhancement From Photographs With GANs,2018,CVPR,The Conference on Computer Vision and Pattern Recognition
LIME: Live Intrinsic Material Estimation,2018,CVPR,The Conference on Computer Vision and Pattern Recognition
Learning to Detect Features in Texture Images,2018,CVPR,The Conference on Computer Vision and Pattern Recognition
Learning to Extract a Video Sequence From a Single Motion-Blurred Image,2018,CVPR,The Conference on Computer Vision and Pattern Recognition
Lose the Views: Limited Angle CT Reconstruction via Implicit Sinogram Completion,2018,CVPR,The Conference on Computer Vision and Pattern Recognition
A Common Framework for Interactive Texture Transfer,2018,CVPR,The Conference on Computer Vision and Pattern Recognition
Mesoscopic Facial Geometry Inference Using Deep Neural Networks,2018,CVPR,The Conference on Computer Vision and Pattern Recognition
Hand PointNet: 3D Hand Pose Estimation Using Point Sets,2018,CVPR,The Conference on Computer Vision and Pattern Recognition
Seeing Voices and Hearing Faces: Cross-Modal Biometric Matching,2018,CVPR,The Conference on Computer Vision and Pattern Recognition
Learning Monocular 3D Human Pose Estimation From Multi-View Images,2018,CVPR,The Conference on Computer Vision and Pattern Recognition
Separating Style and Content for Generalized Style Transfer,2018,CVPR,The Conference on Computer Vision and Pattern Recognition
TextureGAN: Controlling Deep Image Synthesis With Texture Patches,2018,CVPR,The Conference on Computer Vision and Pattern Recognition
Connecting Pixels to Privacy and Utility: Automatic Redaction of Private Information in Images,2018,CVPR,The Conference on Computer Vision and Pattern Recognition
MapNet: An Allocentric Spatial Memory for Mapping Environments,2018,CVPR,The Conference on Computer Vision and Pattern Recognition
Accurate and Diverse Sampling of Sequences Based on a “Best of Many” Sample Objective,2018,CVPR,The Conference on Computer Vision and Pattern Recognition
VirtualHome: Simulating Household Activities via Programs,2018,CVPR,The Conference on Computer Vision and Pattern Recognition
Generate to Adapt: Aligning Domains Using Generative Adversarial Networks,2018,CVPR,The Conference on Computer Vision and Pattern Recognition
Multi-Agent Diverse Generative Adversarial Networks,2018,CVPR,The Conference on Computer Vision and Pattern Recognition
A PID Controller Approach for Stochastic Optimization of Deep Networks,2018,CVPR,The Conference on Computer Vision and Pattern Recognition
“Learning-Compression” Algorithms for Neural Net Pruning,2018,CVPR,The Conference on Computer Vision and Pattern Recognition
Large-Scale Distance Metric Learning With Uncertainty,2018,CVPR,The Conference on Computer Vision and Pattern Recognition
Guide Me: Interacting With Deep Networks,2018,CVPR,The Conference on Computer Vision and Pattern Recognition
AMNet: Memorability Estimation With Attention,2018,CVPR,The Conference on Computer Vision and Pattern Recognition
Blind Predicting Similar Quality Map for Image Quality Assessment,2018,CVPR,The Conference on Computer Vision and Pattern Recognition
Deep End-to-End Time-of-Flight Imaging,2018,CVPR,The Conference on Computer Vision and Pattern Recognition
Aperture Supervision for Monocular Depth Estimation,2018,CVPR,The Conference on Computer Vision and Pattern Recognition
Seeing Temporal Modulation of Lights From Standard Cameras,2018,CVPR,The Conference on Computer Vision and Pattern Recognition
Statistical Tomography of Microscopic Life,2018,CVPR,The Conference on Computer Vision and Pattern Recognition
Divide and Conquer for Full-Resolution Light Field Deblurring,2018,CVPR,The Conference on Computer Vision and Pattern Recognition
Multispectral Image Intrinsic Decomposition via Subspace Constraint,2018,CVPR,The Conference on Computer Vision and Pattern Recognition
Improving Color Reproduction Accuracy on Cameras,2018,CVPR,The Conference on Computer Vision and Pattern Recognition
A Closer Look at Spatiotemporal Convolutions for Action Recognition,2018,CVPR,The Conference on Computer Vision and Pattern Recognition
Inferring Shared Attention in Social Scene Videos,2018,CVPR,The Conference on Computer Vision and Pattern Recognition
Making Convolutional Networks Recurrent for Visual Sequence Learning,2018,CVPR,The Conference on Computer Vision and Pattern Recognition
Real-World Anomaly Detection in Surveillance Videos,2018,CVPR,The Conference on Computer Vision and Pattern Recognition
Viewpoint-Aware Attentive Multi-View Inference for Vehicle Re-Identification,2018,CVPR,The Conference on Computer Vision and Pattern Recognition
Efficient Video Object Segmentation via Network Modulation,2018,CVPR,The Conference on Computer Vision and Pattern Recognition
Weakly-Supervised Action Segmentation With Iterative Soft Boundary Assignment,2018,CVPR,The Conference on Computer Vision and Pattern Recognition
Art of Singular Vectors and Universal Adversarial Perturbations,2018,CVPR,The Conference on Computer Vision and Pattern Recognition
Deflecting Adversarial Attacks With Pixel Deflection,2018,CVPR,The Conference on Computer Vision and Pattern Recognition
MovieGraphs: Towards Understanding Human-Centric Situations From Videos,2018,CVPR,The Conference on Computer Vision and Pattern Recognition
SemStyle: Learning to Generate Stylised Image Captions Using Unaligned Text,2018,CVPR,The Conference on Computer Vision and Pattern Recognition
Benchmarking 6DOF Outdoor Visual Localization in Changing Conditions,2018,CVPR,The Conference on Computer Vision and Pattern Recognition
IVQA: Inverse Visual Question Answering,2018,CVPR,The Conference on Computer Vision and Pattern Recognition
Unsupervised Person Image Synthesis in Arbitrary Poses,2018,CVPR,The Conference on Computer Vision and Pattern Recognition
Learning Descriptor Networks for 3D Shape Synthesis and Analysis,2018,CVPR,The Conference on Computer Vision and Pattern Recognition
Neural Kinematic Networks for Unsupervised Motion Retargetting,2018,CVPR,The Conference on Computer Vision and Pattern Recognition
Group Consistent Similarity Learning via Deep CRF for Person Re-Identification,2018,CVPR,The Conference on Computer Vision and Pattern Recognition
Learning Compositional Visual Concepts With Mutual Consistency,2018,CVPR,The Conference on Computer Vision and Pattern Recognition
NestedNet: Learning Nested Sparse Structures in Deep Neural Networks,2018,CVPR,The Conference on Computer Vision and Pattern Recognition
Context Embedding Networks,2018,CVPR,The Conference on Computer Vision and Pattern Recognition
Iterative Learning With Open-Set Noisy Labels,2018,CVPR,The Conference on Computer Vision and Pattern Recognition
Learning Transferable Architectures for Scalable Image Recognition,2018,CVPR,The Conference on Computer Vision and Pattern Recognition
SBNet: Sparse Blocks Network for Fast Inference,2018,CVPR,The Conference on Computer Vision and Pattern Recognition
Language-Based Image Editing With Recurrent Attentive Models,2018,CVPR,The Conference on Computer Vision and Pattern Recognition
Net2Vec: Quantifying and Explaining How Concepts Are Encoded by Filters in Deep Neural Networks,2018,CVPR,The Conference on Computer Vision and Pattern Recognition
Depth-Aware Stereo Video Retargeting,2018,CVPR,The Conference on Computer Vision and Pattern Recognition
Instance Embedding Transfer to Unsupervised Video Object Segmentation,2018,CVPR,The Conference on Computer Vision and Pattern Recognition
Future Frame Prediction for Anomaly Detection – A New Baseline,2018,CVPR,The Conference on Computer Vision and Pattern Recognition
Can Spatiotemporal 3D CNNs Retrace the History of 2D CNNs and ImageNet?,2018,CVPR,The Conference on Computer Vision and Pattern Recognition
Dynamic Video Segmentation Network,2018,CVPR,The Conference on Computer Vision and Pattern Recognition
Recognize Actions by Disentangling Components of Dynamics,2018,CVPR,The Conference on Computer Vision and Pattern Recognition
Motion-Appearance Co-Memory Networks for Video Question Answering,2018,CVPR,The Conference on Computer Vision and Pattern Recognition
Learning to Understand Image Blur,2018,CVPR,The Conference on Computer Vision and Pattern Recognition
Dense Decoder Shortcut Connections for Single-Pass Semantic Segmentation,2018,CVPR,The Conference on Computer Vision and Pattern Recognition
Generative Adversarial Image Synthesis With Decision Tree Latent Controller,2018,CVPR,The Conference on Computer Vision and Pattern Recognition
Learning a Discriminative Prior for Blind Image Deblurring,2018,CVPR,The Conference on Computer Vision and Pattern Recognition
Frame-Recurrent Video Super-Resolution,2018,CVPR,The Conference on Computer Vision and Pattern Recognition
Discovering Point Lights With Intensity Distance Fields,2018,CVPR,The Conference on Computer Vision and Pattern Recognition
Video Rain Streak Removal by Multiscale Convolutional Sparse Coding,2018,CVPR,The Conference on Computer Vision and Pattern Recognition
Stereoscopic Neural Style Transfer,2018,CVPR,The Conference on Computer Vision and Pattern Recognition
Multi-Frame Quality Enhancement for Compressed Video,2018,CVPR,The Conference on Computer Vision and Pattern Recognition
CNN Based Learning Using Reflection and Retinex Models for Intrinsic Image Decomposition,2018,CVPR,The Conference on Computer Vision and Pattern Recognition
End-to-End Dense Video Captioning With Masked Transformer,2018,CVPR,The Conference on Computer Vision and Pattern Recognition
A Neural Multi-Sequence Alignment TeCHnique (NeuMATCH),2018,CVPR,The Conference on Computer Vision and Pattern Recognition
Path Aggregation Network for Instance Segmentation,2018,CVPR,The Conference on Computer Vision and Pattern Recognition
The INaturalist Species Classification and Detection Dataset,2018,CVPR,The Conference on Computer Vision and Pattern Recognition
Multimodal Explanations: Justifying Decisions and Pointing to the Evidence,2018,CVPR,The Conference on Computer Vision and Pattern Recognition
StarGAN: Unified Generative Adversarial Networks for Multi-Domain Image-to-Image Translation,2018,CVPR,The Conference on Computer Vision and Pattern Recognition
High-Resolution Image Synthesis and Semantic Manipulation With Conditional GANs,2018,CVPR,The Conference on Computer Vision and Pattern Recognition
Semi-Parametric Image Synthesis,2018,CVPR,The Conference on Computer Vision and Pattern Recognition
BlockDrop: Dynamic Inference Paths in Residual Networks,2018,CVPR,The Conference on Computer Vision and Pattern Recognition
Interpretable Convolutional Neural Networks,2018,CVPR,The Conference on Computer Vision and Pattern Recognition
Deep Cross-Media Knowledge Transfer,2018,CVPR,The Conference on Computer Vision and Pattern Recognition
Interleaved Structured Sparse Convolutional Neural Networks,2018,CVPR,The Conference on Computer Vision and Pattern Recognition
A Variational U-Net for Conditional Appearance and Shape Generation,2018,CVPR,The Conference on Computer Vision and Pattern Recognition
Detach and Adapt: Learning Cross-Domain Disentangled Deep Representation,2018,CVPR,The Conference on Computer Vision and Pattern Recognition
Learning Deep Structured Active Contours End-to-End,2018,CVPR,The Conference on Computer Vision and Pattern Recognition
Deep Learning Under Privileged Information Using Heteroscedastic Dropout,2018,CVPR,The Conference on Computer Vision and Pattern Recognition
Smooth Neighbors on Teacher Graphs for Semi-Supervised Learning,2018,CVPR,The Conference on Computer Vision and Pattern Recognition
Image Restoration by Estimating Frequency Distribution of Local Patches,2018,CVPR,The Conference on Computer Vision and Pattern Recognition
Latent RANSAC,2018,CVPR,The Conference on Computer Vision and Pattern Recognition
Two-Stream Convolutional Networks for Dynamic Texture Synthesis,2018,CVPR,The Conference on Computer Vision and Pattern Recognition
Towards Open-Set Identity Preserving Face Synthesis,2018,CVPR,The Conference on Computer Vision and Pattern Recognition
A Revised Underwater Image Formation Model,2018,CVPR,The Conference on Computer Vision and Pattern Recognition
Graph-Cut RANSAC,2018,CVPR,The Conference on Computer Vision and Pattern Recognition
Temporal Deformable Residual Networks for Action Segmentation in Videos,2018,CVPR,The Conference on Computer Vision and Pattern Recognition
Weakly Supervised Action Localization by Sparse Temporal Pooling Network,2018,CVPR,The Conference on Computer Vision and Pattern Recognition
PoseFlow: A Deep Motion Representation for Understanding Human Behaviors in Videos,2018,CVPR,The Conference on Computer Vision and Pattern Recognition
FFNet: Video Fast-Forwarding via Reinforcement Learning,2018,CVPR,The Conference on Computer Vision and Pattern Recognition
Multi-Shot Pedestrian Re-Identification via Sequential Decision Making,2018,CVPR,The Conference on Computer Vision and Pattern Recognition
Attend and Interact: Higher-Order Object Interactions for Video Understanding,2018,CVPR,The Conference on Computer Vision and Pattern Recognition
Where and Why Are They Looking? Jointly Inferring Human Attention and Intentions in Complex Tasks,2018,CVPR,The Conference on Computer Vision and Pattern Recognition
Fully Convolutional Adaptation Networks for Semantic Segmentation,2018,CVPR,The Conference on Computer Vision and Pattern Recognition
Semantic Video Segmentation by Gated Recurrent Flow Propagation,2018,CVPR,The Conference on Computer Vision and Pattern Recognition
Interpretable Video Captioning via Trajectory Structured Localization,2018,CVPR,The Conference on Computer Vision and Pattern Recognition
Deep Hashing via Discrepancy Minimization,2018,CVPR,The Conference on Computer Vision and Pattern Recognition
ShuffleNet: An Extremely Efficient Convolutional Neural Network for Mobile Devices,2018,CVPR,The Conference on Computer Vision and Pattern Recognition
Zero-Shot Recognition via Semantic Embeddings and Knowledge Graphs,2018,CVPR,The Conference on Computer Vision and Pattern Recognition
Referring Relationships,2018,CVPR,The Conference on Computer Vision and Pattern Recognition
Improving Object Localization With Fitness NMS and Bounded IoU Loss,2018,CVPR,The Conference on Computer Vision and Pattern Recognition
Interpret Neural Networks by Identifying Critical Data Routing Paths,2018,CVPR,The Conference on Computer Vision and Pattern Recognition
Deep Spatio-Temporal Random Fields for Efficient Video Segmentation,2018,CVPR,The Conference on Computer Vision and Pattern Recognition
Customized Image Narrative Generation via Interactive Visual Question Generation and Answering,2018,CVPR,The Conference on Computer Vision and Pattern Recognition
"PWC-Net: CNNs for Optical Flow Using Pyramid, Warping, and Cost Volume",2018,CVPR,The Conference on Computer Vision and Pattern Recognition
Revisiting Deep Intrinsic Image Decompositions,2018,CVPR,The Conference on Computer Vision and Pattern Recognition
Multi-Cell Detection and Classification Using a Generative Convolutional Model,2018,CVPR,The Conference on Computer Vision and Pattern Recognition
Learning Spatial-Aware Regressions for Visual Tracking,2018,CVPR,The Conference on Computer Vision and Pattern Recognition
High Performance Visual Tracking With Siamese Region Proposal Network,2018,CVPR,The Conference on Computer Vision and Pattern Recognition
LiteFlowNet: A Lightweight Convolutional Neural Network for Optical Flow Estimation,2018,CVPR,The Conference on Computer Vision and Pattern Recognition
VITAL: VIsual Tracking via Adversarial Learning,2018,CVPR,The Conference on Computer Vision and Pattern Recognition
Super SloMo: High Quality Estimation of Multiple Intermediate Frames for Video Interpolation,2018,CVPR,The Conference on Computer Vision and Pattern Recognition
"Real-World Repetition Estimation by Div, Grad and Curl",2018,CVPR,The Conference on Computer Vision and Pattern Recognition
Recurrent Pixel Embedding for Instance Grouping,2018,CVPR,The Conference on Computer Vision and Pattern Recognition
Deep Unsupervised Saliency Detection: A Multiple Noisy Labeling Perspective,2018,CVPR,The Conference on Computer Vision and Pattern Recognition
Learning Intrinsic Image Decomposition From Watching the World,2018,CVPR,The Conference on Computer Vision and Pattern Recognition
TieNet: Text-Image Embedding Network for Common Thorax Disease Classification and Reporting in Chest X-Rays,2018,CVPR,The Conference on Computer Vision and Pattern Recognition
Generating Synthetic X-Ray Images of a Person From the Surface Geometry,2018,CVPR,The Conference on Computer Vision and Pattern Recognition
Gibson Env: Real-World Perception for Embodied Agents,2018,CVPR,The Conference on Computer Vision and Pattern Recognition
Reinforcement Cutting-Agent Learning for Video Object Segmentation,2018,CVPR,The Conference on Computer Vision and Pattern Recognition
End-to-End Deep Kronecker-Product Matching for Person Re-Identification,2018,CVPR,The Conference on Computer Vision and Pattern Recognition
Semantic Visual Localization,2018,CVPR,The Conference on Computer Vision and Pattern Recognition
Objects as Context for Detecting Their Semantic Parts,2018,CVPR,The Conference on Computer Vision and Pattern Recognition
End-to-End Weakly-Supervised Semantic Alignment,2018,CVPR,The Conference on Computer Vision and Pattern Recognition
Dynamic Zoom-In Network for Fast Object Detection in Large Images,2018,CVPR,The Conference on Computer Vision and Pattern Recognition
Learning Markov Clustering Networks for Scene Text Detection,2018,CVPR,The Conference on Computer Vision and Pattern Recognition
Deep Reinforcement Learning of Region Proposal Networks for Object Detection,2018,CVPR,The Conference on Computer Vision and Pattern Recognition
Beyond Holistic Object Recognition: Enriching Image Understanding With Part States,2018,CVPR,The Conference on Computer Vision and Pattern Recognition
Discriminability Objective for Training Descriptive Captions,2018,CVPR,The Conference on Computer Vision and Pattern Recognition
Visual Question Answering With Memory-Augmented Networks,2018,CVPR,The Conference on Computer Vision and Pattern Recognition
Structure Inference Net: Object Detection Using Scene-Level Context and Instance-Level Relationships,2018,CVPR,The Conference on Computer Vision and Pattern Recognition
Occluded Pedestrian Detection Through Guided Attention in CNNs,2018,CVPR,The Conference on Computer Vision and Pattern Recognition
Reward Learning From Narrated Demonstrations,2018,CVPR,The Conference on Computer Vision and Pattern Recognition
Weakly-Supervised Semantic Segmentation Network With Deep Seeded Region Growing,2018,CVPR,The Conference on Computer Vision and Pattern Recognition
PoTion: Pose MoTion Representation for Action Recognition,2018,CVPR,The Conference on Computer Vision and Pattern Recognition
Feature Space Transfer for Data Augmentation,2018,CVPR,The Conference on Computer Vision and Pattern Recognition
Analytic Expressions for Probabilistic Moments of PL-DNN With Gaussian Input,2018,CVPR,The Conference on Computer Vision and Pattern Recognition
Detail-Preserving Pooling in Deep Networks,2018,CVPR,The Conference on Computer Vision and Pattern Recognition
Rethinking Feature Distribution for Loss Functions in Image Classification,2018,CVPR,The Conference on Computer Vision and Pattern Recognition
"Shift: A Zero FLOP, Zero Parameter Alternative to Spatial Convolutions",2018,CVPR,The Conference on Computer Vision and Pattern Recognition
Sketch-a-Classifier: Sketch-Based Photo Classifier Generation,2018,CVPR,The Conference on Computer Vision and Pattern Recognition
Light Field Intrinsics With a Deep Encoder-Decoder Network,2018,CVPR,The Conference on Computer Vision and Pattern Recognition
Learning Generative ConvNets via Multi-Grid Modeling and Sampling,2018,CVPR,The Conference on Computer Vision and Pattern Recognition
Manifold Learning in Quotient Spaces,2018,CVPR,The Conference on Computer Vision and Pattern Recognition
Learning Intelligent Dialogs for Bounding Box Annotation,2018,CVPR,The Conference on Computer Vision and Pattern Recognition
Boosting Adversarial Attacks With Momentum,2018,CVPR,The Conference on Computer Vision and Pattern Recognition
NISP: Pruning Networks Using Neuron Importance Score Propagation,2018,CVPR,The Conference on Computer Vision and Pattern Recognition
PointGrid: A Deep Network for 3D Shape Understanding,2018,CVPR,The Conference on Computer Vision and Pattern Recognition
Tell Me Where to Look: Guided Attention Inference Network,2018,CVPR,The Conference on Computer Vision and Pattern Recognition
3D Semantic Segmentation With Submanifold Sparse Convolutional Networks,2018,CVPR,The Conference on Computer Vision and Pattern Recognition
TOM-Net: Learning Transparent Object Matting From a Single Image,2018,CVPR,The Conference on Computer Vision and Pattern Recognition
Translating and Segmenting Multimodal Medical Volumes With Cycle- and Shape-Consistency Generative Adversarial Network,2018,CVPR,The Conference on Computer Vision and Pattern Recognition
An Unsupervised Learning Model for Deformable Medical Image Registration,2018,CVPR,The Conference on Computer Vision and Pattern Recognition
Deep Lesion Graphs in the Wild: Relationship Learning and Organization of Significant Radiology Image Findings in a Diverse Large-Scale Lesion Database,2018,CVPR,The Conference on Computer Vision and Pattern Recognition
Learning Distributions of Shape Trajectories From Longitudinal Datasets: A Hierarchical Model on a Manifold of Diffeomorphisms,2018,CVPR,The Conference on Computer Vision and Pattern Recognition
Bilateral Ordinal Relevance Multi-Instance Regression for Facial Action Unit Intensity Estimation,2018,CVPR,The Conference on Computer Vision and Pattern Recognition
Pulling Actions out of Context: Explicit Separation for Effective Combination,2018,CVPR,The Conference on Computer Vision and Pattern Recognition
Dynamic Feature Learning for Partial Face Recognition,2018,CVPR,The Conference on Computer Vision and Pattern Recognition
Exploiting Transitivity for Learning Person Re-Identification Models on a Budget,2018,CVPR,The Conference on Computer Vision and Pattern Recognition
Deep Spatial Feature Reconstruction for Partial Person Re-Identification: Alignment-Free Approach,2018,CVPR,The Conference on Computer Vision and Pattern Recognition
Every Smile Is Unique: Landmark-Guided Diverse Smile Generation,2018,CVPR,The Conference on Computer Vision and Pattern Recognition
UV-GAN: Adversarial Facial UV Map Completion for Pose-Invariant Face Recognition,2018,CVPR,The Conference on Computer Vision and Pattern Recognition
Cascaded Pyramid Network for Multi-Person Pose Estimation,2018,CVPR,The Conference on Computer Vision and Pattern Recognition
A Face-to-Face Neural Conversation Model,2018,CVPR,The Conference on Computer Vision and Pattern Recognition
End-to-End Recovery of Human Shape and Pose,2018,CVPR,The Conference on Computer Vision and Pattern Recognition
CNN Driven Sparse Multi-Level B-Spline Image Registration,2018,CVPR,The Conference on Computer Vision and Pattern Recognition
Anatomical Priors in Convolutional Networks for Unsupervised Biomedical Segmentation,2018,CVPR,The Conference on Computer Vision and Pattern Recognition
3D Registration of Curves and Surfaces Using Local Differential Information,2018,CVPR,The Conference on Computer Vision and Pattern Recognition
Weakly Supervised Learning of Single-Cell Feature Embeddings,2018,CVPR,The Conference on Computer Vision and Pattern Recognition
Guided Proofreading of Automatic Segmentations for Connectomics,2018,CVPR,The Conference on Computer Vision and Pattern Recognition
Wide Compression: Tensor Ring Nets,2018,CVPR,The Conference on Computer Vision and Pattern Recognition
Improvements to Context Based Self-Supervised Learning,2018,CVPR,The Conference on Computer Vision and Pattern Recognition
Learning Structure and Strength of CNN Filters for Small Sample Size Training,2018,CVPR,The Conference on Computer Vision and Pattern Recognition
Boosting Self-Supervised Learning via Knowledge Transfer,2018,CVPR,The Conference on Computer Vision and Pattern Recognition
