title,year,conf,conf_long
Weakly Supervised Instance Segmentation Using Class Peak Response,2018,CVPR,The Conference on Computer Vision and Pattern Recognition
Collaborative and Adversarial Network for Unsupervised Domain Adaptation,2018,CVPR,The Conference on Computer Vision and Pattern Recognition
Environment Upgrade Reinforcement Learning for Non-Differentiable Multi-Stage Pipelines,2018,CVPR,The Conference on Computer Vision and Pattern Recognition
Teaching Categories to Human Learners With Visual Explanations,2018,CVPR,The Conference on Computer Vision and Pattern Recognition
Density Adaptive Point Set Registration,2018,CVPR,The Conference on Computer Vision and Pattern Recognition
Left-Right Comparative Recurrent Model for Stereo Matching,2018,CVPR,The Conference on Computer Vision and Pattern Recognition
Im2Pano3D: Extrapolating 360° Structure and Semantics Beyond the Field of View,2018,CVPR,The Conference on Computer Vision and Pattern Recognition
Polarimetric Dense Monocular SLAM,2018,CVPR,The Conference on Computer Vision and Pattern Recognition
Learning Time/Memory-Efficient Deep Architectures With Budgeted Super Networks,2018,CVPR,The Conference on Computer Vision and Pattern Recognition
Cross-View Image Synthesis Using Conditional GANs,2018,CVPR,The Conference on Computer Vision and Pattern Recognition
"Sparse, Smart Contours to Represent and Edit Images",2018,CVPR,The Conference on Computer Vision and Pattern Recognition
Anticipating Traffic Accidents With Adaptive Loss and Large-Scale Incident DB,2018,CVPR,The Conference on Computer Vision and Pattern Recognition
A Minimalist Approach to Type-Agnostic Detection of Quadrics in Point Clouds,2018,CVPR,The Conference on Computer Vision and Pattern Recognition
Facelet-Bank for Fast Portrait Manipulation,2018,CVPR,The Conference on Computer Vision and Pattern Recognition
Visual to Sound: Generating Natural Sound for Videos in the Wild,2018,CVPR,The Conference on Computer Vision and Pattern Recognition
"A Unifying Contrast Maximization Framework for Event Cameras, With Applications to Motion, Depth, and Optical Flow Estimation",2018,CVPR,The Conference on Computer Vision and Pattern Recognition
Modeling Facial Geometry Using Compositional VAEs,2018,CVPR,The Conference on Computer Vision and Pattern Recognition
Tangent Convolutions for Dense Prediction in 3D,2018,CVPR,The Conference on Computer Vision and Pattern Recognition
RayNet: Learning Volumetric 3D Reconstruction With Ray Potentials,2018,CVPR,The Conference on Computer Vision and Pattern Recognition
Neural 3D Mesh Renderer,2018,CVPR,The Conference on Computer Vision and Pattern Recognition
Structured Attention Guided Convolutional Neural Fields for Monocular Depth Estimation,2018,CVPR,The Conference on Computer Vision and Pattern Recognition
Automatic 3D Indoor Scene Modeling From Single Panorama,2018,CVPR,The Conference on Computer Vision and Pattern Recognition
Extreme 3D Face Reconstruction: Seeing Through Occlusions,2018,CVPR,The Conference on Computer Vision and Pattern Recognition
Beyond Grobner Bases: Basis Selection for Minimal Solvers,2018,CVPR,The Conference on Computer Vision and Pattern Recognition
"Lions and Tigers and Bears: Capturing Non-Rigid, 3D, Articulated Shape From Images",2018,CVPR,The Conference on Computer Vision and Pattern Recognition
Deep Cocktail Network: Multi-Source Unsupervised Domain Adaptation With Category Shift,2018,CVPR,The Conference on Computer Vision and Pattern Recognition
DOTA: A Large-Scale Dataset for Object Detection in Aerial Images,2018,CVPR,The Conference on Computer Vision and Pattern Recognition
Finding Beans in Burgers: Deep Semantic-Visual Embedding With Localization,2018,CVPR,The Conference on Computer Vision and Pattern Recognition
Feature Super-Resolution: Make Machine See More Clearly,2018,CVPR,The Conference on Computer Vision and Pattern Recognition
ClusterNet: Detecting Small Objects in Large Scenes by Exploiting Spatio-Temporal Information,2018,CVPR,The Conference on Computer Vision and Pattern Recognition
MaskLab: Instance Segmentation by Refining Object Detection With Semantic and Direction Features,2018,CVPR,The Conference on Computer Vision and Pattern Recognition
Hashing as Tie-Aware Learning to Rank,2018,CVPR,The Conference on Computer Vision and Pattern Recognition
Classification-Driven Dynamic Image Enhancement,2018,CVPR,The Conference on Computer Vision and Pattern Recognition
Knowledge Aided Consistency for Weakly Supervised Phrase Grounding,2018,CVPR,The Conference on Computer Vision and Pattern Recognition
Who Let the Dogs Out? Modeling Dog Behavior From Visual Data,2018,CVPR,The Conference on Computer Vision and Pattern Recognition
Pseudo Mask Augmented Object Detection,2018,CVPR,The Conference on Computer Vision and Pattern Recognition
Dual Skipping Networks,2018,CVPR,The Conference on Computer Vision and Pattern Recognition
Memory Matching Networks for One-Shot Image Recognition,2018,CVPR,The Conference on Computer Vision and Pattern Recognition
IQA: Visual Question Answering in Interactive Environments,2018,CVPR,The Conference on Computer Vision and Pattern Recognition
Pose Transferrable Person Re-Identification,2018,CVPR,The Conference on Computer Vision and Pattern Recognition
Large Scale Fine-Grained Categorization and Domain-Specific Transfer Learning,2018,CVPR,The Conference on Computer Vision and Pattern Recognition
Data Distillation: Towards Omni-Supervised Learning,2018,CVPR,The Conference on Computer Vision and Pattern Recognition
Object Referring in Videos With Language and Human Gaze,2018,CVPR,The Conference on Computer Vision and Pattern Recognition
Feature Selective Networks for Object Detection,2018,CVPR,The Conference on Computer Vision and Pattern Recognition
Learning a Discriminative Filter Bank Within a CNN for Fine-Grained Recognition,2018,CVPR,The Conference on Computer Vision and Pattern Recognition
Grounding Referring Expressions in Images by Variational Context,2018,CVPR,The Conference on Computer Vision and Pattern Recognition
Dynamic Graph Generation Network: Generating Relational Knowledge From Diagrams,2018,CVPR,The Conference on Computer Vision and Pattern Recognition
A Network Architecture for Point Cloud Classification via Automatic Depth Images Generation,2018,CVPR,The Conference on Computer Vision and Pattern Recognition
Towards Dense Object Tracking in a 2D Honeybee Hive,2018,CVPR,The Conference on Computer Vision and Pattern Recognition
Long-Term On-Board Prediction of People in Traffic Scenes Under Uncertainty,2018,CVPR,The Conference on Computer Vision and Pattern Recognition
Single-Shot Refinement Neural Network for Object Detection,2018,CVPR,The Conference on Computer Vision and Pattern Recognition
Video Captioning via Hierarchical Reinforcement Learning,2018,CVPR,The Conference on Computer Vision and Pattern Recognition
Tips and Tricks for Visual Question Answering: Learnings From the 2017 Challenge,2018,CVPR,The Conference on Computer Vision and Pattern Recognition
Learning to Segment Every Thing,2018,CVPR,The Conference on Computer Vision and Pattern Recognition
Self-Supervised Adversarial Hashing Networks for Cross-Modal Retrieval,2018,CVPR,The Conference on Computer Vision and Pattern Recognition
Parallel Attention: A Unified Framework for Visual Object Discovery Through Dialogs and Queries,2018,CVPR,The Conference on Computer Vision and Pattern Recognition
Zigzag Learning for Weakly Supervised Object Detection,2018,CVPR,The Conference on Computer Vision and Pattern Recognition
Attentive Fashion Grammar Network for Fashion Landmark Detection and Clothing Category Classification,2018,CVPR,The Conference on Computer Vision and Pattern Recognition
Generalized Zero-Shot Learning via Synthesized Examples,2018,CVPR,The Conference on Computer Vision and Pattern Recognition
Partially Shared Multi-Task Convolutional Neural Network With Local Constraint for Face Attribute Learning,2018,CVPR,The Conference on Computer Vision and Pattern Recognition
SYQ: Learning Symmetric Quantization for Efficient Deep Neural Networks,2018,CVPR,The Conference on Computer Vision and Pattern Recognition
DS*: Tighter Lifting-Free Convex Relaxations for Quadratic Matching Problems,2018,CVPR,The Conference on Computer Vision and Pattern Recognition
Deep Mutual Learning,2018,CVPR,The Conference on Computer Vision and Pattern Recognition
Coupled End-to-End Transfer Learning With Generalized Fisher Information,2018,CVPR,The Conference on Computer Vision and Pattern Recognition
Residual Parameter Transfer for Deep Domain Adaptation,2018,CVPR,The Conference on Computer Vision and Pattern Recognition
High-Order Tensor Regularization With Application to Attribute Ranking,2018,CVPR,The Conference on Computer Vision and Pattern Recognition
Learning to Localize Sound Source in Visual Scenes,2018,CVPR,The Conference on Computer Vision and Pattern Recognition
Dynamic Few-Shot Visual Learning Without Forgetting,2018,CVPR,The Conference on Computer Vision and Pattern Recognition
Two-Step Quantization for Low-Bit Neural Networks,2018,CVPR,The Conference on Computer Vision and Pattern Recognition
Improved Lossy Image Compression With Priming and Spatially Adaptive Bit Rates for Recurrent Networks,2018,CVPR,The Conference on Computer Vision and Pattern Recognition
Conditional Probability Models for Deep Image Compression,2018,CVPR,The Conference on Computer Vision and Pattern Recognition
Deep Diffeomorphic Transformer Networks,2018,CVPR,The Conference on Computer Vision and Pattern Recognition
The Lovász-Softmax Loss: A Tractable Surrogate for the Optimization of the Intersection-Over-Union Measure in Neural Networks,2018,CVPR,The Conference on Computer Vision and Pattern Recognition
Generative Adversarial Perturbations,2018,CVPR,The Conference on Computer Vision and Pattern Recognition
Learning Strict Identity Mappings in Deep Residual Networks,2018,CVPR,The Conference on Computer Vision and Pattern Recognition
Geometric Robustness of Deep Networks: Analysis and Improvement,2018,CVPR,The Conference on Computer Vision and Pattern Recognition
View Extrapolation of Human Body From a Single Image,2018,CVPR,The Conference on Computer Vision and Pattern Recognition
Geometry Aware Constrained Optimization Techniques for Deep Learning,2018,CVPR,The Conference on Computer Vision and Pattern Recognition
PointNetVLAD: Deep Point Cloud Based Retrieval for Large-Scale Place Recognition,2018,CVPR,The Conference on Computer Vision and Pattern Recognition
An Efficient and Provable Approach for Mixture Proportion Estimation Using Linear Independence Assumption,2018,CVPR,The Conference on Computer Vision and Pattern Recognition
VoxelNet: End-to-End Learning for Point Cloud Based 3D Object Detection,2018,CVPR,The Conference on Computer Vision and Pattern Recognition
Image to Image Translation for Domain Adaptation,2018,CVPR,The Conference on Computer Vision and Pattern Recognition
MobileNetV2: Inverted Residuals and Linear Bottlenecks,2018,CVPR,The Conference on Computer Vision and Pattern Recognition
Im2Struct: Recovering 3D Shape Structure From a Single RGB Image,2018,CVPR,The Conference on Computer Vision and Pattern Recognition
Trust Your Model: Light Field Depth Estimation With Inline Occlusion Handling,2018,CVPR,The Conference on Computer Vision and Pattern Recognition
Baseline Desensitizing in Translation Averaging,2018,CVPR,The Conference on Computer Vision and Pattern Recognition
Mining Point Cloud Local Structures by Kernel Correlation and Graph Pooling,2018,CVPR,The Conference on Computer Vision and Pattern Recognition
Large-Scale Point Cloud Semantic Segmentation With Superpoint Graphs,2018,CVPR,The Conference on Computer Vision and Pattern Recognition
Very Large-Scale Global SfM by Distributed Motion Averaging,2018,CVPR,The Conference on Computer Vision and Pattern Recognition
ScanComplete: Large-Scale Scene Completion and Semantic Segmentation for 3D Scans,2018,CVPR,The Conference on Computer Vision and Pattern Recognition
Solving the Perspective-2-Point Problem for Flying-Camera Photo Composition,2018,CVPR,The Conference on Computer Vision and Pattern Recognition
Reflection Removal for Large-Scale 3D Point Clouds,2018,CVPR,The Conference on Computer Vision and Pattern Recognition
Attentional ShapeContextNet for Point Cloud Recognition,2018,CVPR,The Conference on Computer Vision and Pattern Recognition
Geometry-Aware Deep Network for Single-Image Novel View Synthesis,2018,CVPR,The Conference on Computer Vision and Pattern Recognition
InverseFaceNet: Deep Monocular Inverse Face Rendering,2018,CVPR,The Conference on Computer Vision and Pattern Recognition
Sparse Photometric 3D Face Reconstruction Guided by Morphable Models,2018,CVPR,The Conference on Computer Vision and Pattern Recognition
Texture Mapping for 3D Reconstruction With RGB-D Sensor,2018,CVPR,The Conference on Computer Vision and Pattern Recognition
Learning Less Is More - 6D Camera Localization via 3D Surface Regression,2018,CVPR,The Conference on Computer Vision and Pattern Recognition
Feature Mapping for Learning Fast and Accurate 3D Pose Inference From Synthetic Images,2018,CVPR,The Conference on Computer Vision and Pattern Recognition
Indoor RGB-D Compass From a Single Line and Plane,2018,CVPR,The Conference on Computer Vision and Pattern Recognition
Geometry-Aware Network for Non-Rigid Shape Prediction From a Single View,2018,CVPR,The Conference on Computer Vision and Pattern Recognition
Sim2Real Viewpoint Invariant Visual Servoing by Recurrent Control,2018,CVPR,The Conference on Computer Vision and Pattern Recognition
DocUNet: Document Image Unwarping via a Stacked U-Net,2018,CVPR,The Conference on Computer Vision and Pattern Recognition
Analysis of Hand Segmentation in the Wild,2018,CVPR,The Conference on Computer Vision and Pattern Recognition
RoadTracer: Automatic Extraction of Road Networks From Aerial Images,2018,CVPR,The Conference on Computer Vision and Pattern Recognition
Alternating-Stereo VINS: Observability Analysis and Performance Evaluation,2018,CVPR,The Conference on Computer Vision and Pattern Recognition
Soccer on Your Tabletop,2018,CVPR,The Conference on Computer Vision and Pattern Recognition
EPINET: A Fully-Convolutional Neural Network Using Epipolar Geometry for Depth From Light Field Images,2018,CVPR,The Conference on Computer Vision and Pattern Recognition
A Hybrid l1-l0 Layer Decomposition Model for Tone Mapping,2018,CVPR,The Conference on Computer Vision and Pattern Recognition
Deeply Learned Filter Response Functions for Hyperspectral Reconstruction,2018,CVPR,The Conference on Computer Vision and Pattern Recognition
CRRN: Multi-Scale Guided Concurrent Reflection Removal Network,2018,CVPR,The Conference on Computer Vision and Pattern Recognition
Single Image Reflection Separation With Perceptual Losses,2018,CVPR,The Conference on Computer Vision and Pattern Recognition
A Robust Method for Strong Rolling Shutter Effects Correction Using Lines With Automatic Feature Selection,2018,CVPR,The Conference on Computer Vision and Pattern Recognition
Time-Resolved Light Transport Decomposition for Thermal Photometric Stereo,2018,CVPR,The Conference on Computer Vision and Pattern Recognition
Efficient Diverse Ensemble for Discriminative Co-Tracking,2018,CVPR,The Conference on Computer Vision and Pattern Recognition
Rolling Shutter and Radial Distortion Are Features for High Frame Rate Multi-Camera Tracking,2018,CVPR,The Conference on Computer Vision and Pattern Recognition
A Twofold Siamese Network for Real-Time Object Tracking,2018,CVPR,The Conference on Computer Vision and Pattern Recognition
Multi-Cue Correlation Filters for Robust Visual Tracking,2018,CVPR,The Conference on Computer Vision and Pattern Recognition
Squeeze-and-Excitation Networks,2018,CVPR,The Conference on Computer Vision and Pattern Recognition
Learning Attentions: Residual Attentional Siamese Network for High Performance Online Visual Tracking,2018,CVPR,The Conference on Computer Vision and Pattern Recognition
SINT++: Robust Visual Tracking via Adversarial Positive Instance Generation,2018,CVPR,The Conference on Computer Vision and Pattern Recognition
High-Speed Tracking With Multi-Kernel Correlation Filters,2018,CVPR,The Conference on Computer Vision and Pattern Recognition
Occlusion Aware Unsupervised Learning of Optical Flow,2018,CVPR,The Conference on Computer Vision and Pattern Recognition
Revisiting Video Saliency: A Large-Scale Benchmark and a New Model,2018,CVPR,The Conference on Computer Vision and Pattern Recognition
Learning Spatial-Temporal Regularized Correlation Filters for Visual Tracking,2018,CVPR,The Conference on Computer Vision and Pattern Recognition
Multimodal Visual Concept Learning With Weakly Supervised Techniques,2018,CVPR,The Conference on Computer Vision and Pattern Recognition
Efficient Large-Scale Approximate Nearest Neighbor Search on OpenCL FPGA,2018,CVPR,The Conference on Computer Vision and Pattern Recognition
Learning a Complete Image Indexing Pipeline,2018,CVPR,The Conference on Computer Vision and Pattern Recognition
Transparency by Design: Closing the Gap Between Performance and Interpretability in Visual Reasoning,2018,CVPR,The Conference on Computer Vision and Pattern Recognition
Fooling Vision and Language Models Despite Localization and Attention Mechanism,2018,CVPR,The Conference on Computer Vision and Pattern Recognition
Categorizing Concepts With Basic Level for Vision-to-Language,2018,CVPR,The Conference on Computer Vision and Pattern Recognition
Don't Just Assume; Look and Answer: Overcoming Priors for Visual Question Answering,2018,CVPR,The Conference on Computer Vision and Pattern Recognition
Learning Pixel-Level Semantic Affinity With Image-Level Supervision for Weakly Supervised Semantic Segmentation,2018,CVPR,The Conference on Computer Vision and Pattern Recognition
From Lifestyle Vlogs to Everyday Interactions,2018,CVPR,The Conference on Computer Vision and Pattern Recognition
Cross-Domain Weakly-Supervised Object Detection Through Progressive Domain Adaptation,2018,CVPR,The Conference on Computer Vision and Pattern Recognition
RotationNet: Joint Object Categorization and Pose Estimation Using Multiviews From Unsupervised Viewpoints,2018,CVPR,The Conference on Computer Vision and Pattern Recognition
An End-to-End TextSpotter With Explicit Alignment and Attention,2018,CVPR,The Conference on Computer Vision and Pattern Recognition
"Revisiting Salient Object Detection: Simultaneous Detection, Ranking, and Subitizing of Multiple Salient Objects",2018,CVPR,The Conference on Computer Vision and Pattern Recognition
Context Encoding for Semantic Segmentation,2018,CVPR,The Conference on Computer Vision and Pattern Recognition
Creating Capsule Wardrobes From Fashion Images,2018,CVPR,The Conference on Computer Vision and Pattern Recognition
Webly Supervised Learning Meets Zero-Shot Learning: A Hybrid Approach for Fine-Grained Classification,2018,CVPR,The Conference on Computer Vision and Pattern Recognition
"Look, Imagine and Match: Improving Textual-Visual Cross-Modal Retrieval With Generative Models",2018,CVPR,The Conference on Computer Vision and Pattern Recognition
Bidirectional Attentive Fusion With Context Gating for Dense Video Captioning,2018,CVPR,The Conference on Computer Vision and Pattern Recognition
InLoc: Indoor Visual Localization With Dense Matching and View Synthesis,2018,CVPR,The Conference on Computer Vision and Pattern Recognition
Towards High Performance Video Object Detection,2018,CVPR,The Conference on Computer Vision and Pattern Recognition
Neural Baby Talk,2018,CVPR,The Conference on Computer Vision and Pattern Recognition
Few-Shot Image Recognition by Predicting Parameters From Activations,2018,CVPR,The Conference on Computer Vision and Pattern Recognition
Iterative Visual Reasoning Beyond Convolutions,2018,CVPR,The Conference on Computer Vision and Pattern Recognition
Visual Question Reasoning on General Dependency Tree,2018,CVPR,The Conference on Computer Vision and Pattern Recognition
CVM-Net: Cross-View Matching Network for Image-Based Ground-to-Aerial Geo-Localization,2018,CVPR,The Conference on Computer Vision and Pattern Recognition
Revisiting Dilated Convolution: A Simple Approach for Weakly- and Semi-Supervised Semantic Segmentation,2018,CVPR,The Conference on Computer Vision and Pattern Recognition
Low-Shot Learning From Imaginary Data,2018,CVPR,The Conference on Computer Vision and Pattern Recognition
DoubleFusion: Real-Time Capture of Human Performances With Inner Body Shapes From a Single Depth Sensor,2018,CVPR,The Conference on Computer Vision and Pattern Recognition
DensePose: Dense Human Pose Estimation in the Wild,2018,CVPR,The Conference on Computer Vision and Pattern Recognition
Ordinal Depth Supervision for 3D Human Pose Estimation,2018,CVPR,The Conference on Computer Vision and Pattern Recognition
Consensus Maximization for Semantic Region Correspondences,2018,CVPR,The Conference on Computer Vision and Pattern Recognition
Robust Hough Transform Based 3D Reconstruction From Circular Light Fields,2018,CVPR,The Conference on Computer Vision and Pattern Recognition
Alive Caricature From 2D to 3D,2018,CVPR,The Conference on Computer Vision and Pattern Recognition
Nonlinear 3D Face Morphable Model,2018,CVPR,The Conference on Computer Vision and Pattern Recognition
Through-Wall Human Pose Estimation Using Radio Signals,2018,CVPR,The Conference on Computer Vision and Pattern Recognition
WILDTRACK: A Multi-Camera HD Dataset for Dense Unscripted Pedestrian Detection,2018,CVPR,The Conference on Computer Vision and Pattern Recognition
Direct Shape Regression Networks for End-to-End Face Alignment,2018,CVPR,The Conference on Computer Vision and Pattern Recognition
Natural and Effective Obfuscation by Head Inpainting,2018,CVPR,The Conference on Computer Vision and Pattern Recognition
3D Semantic Trajectory Reconstruction From 3D Pixel Continuum,2018,CVPR,The Conference on Computer Vision and Pattern Recognition
Optimizing Filter Size in Convolutional Neural Networks for Facial Action Unit Recognition,2018,CVPR,The Conference on Computer Vision and Pattern Recognition
V2V-PoseNet: Voxel-to-Voxel Prediction Network for Accurate 3D Hand and Human Pose Estimation From a Single Depth Map,2018,CVPR,The Conference on Computer Vision and Pattern Recognition
Ring Loss: Convex Feature Normalization for Face Recognition,2018,CVPR,The Conference on Computer Vision and Pattern Recognition
Adversarially Occluded Samples for Person Re-Identification,2018,CVPR,The Conference on Computer Vision and Pattern Recognition
Classifier Learning With Prior Probabilities for Facial Action Unit Recognition,2018,CVPR,The Conference on Computer Vision and Pattern Recognition
4DFAB: A Large Scale 4D Database for Facial Expression Analysis and Biometric Applications,2018,CVPR,The Conference on Computer Vision and Pattern Recognition
Seeing Small Faces From Robust Anchor's Perspective,2018,CVPR,The Conference on Computer Vision and Pattern Recognition
2D/3D Pose Estimation and Action Recognition Using Multitask Deep Learning,2018,CVPR,The Conference on Computer Vision and Pattern Recognition
Dense 3D Regression for Hand Pose Estimation,2018,CVPR,The Conference on Computer Vision and Pattern Recognition
Camera Style Adaptation for Person Re-Identification,2018,CVPR,The Conference on Computer Vision and Pattern Recognition
PoseTrack: A Benchmark for Human Pose Estimation and Tracking,2018,CVPR,The Conference on Computer Vision and Pattern Recognition
Exploit the Unknown Gradually: One-Shot Video-Based Person Re-Identification by Stepwise Learning,2018,CVPR,The Conference on Computer Vision and Pattern Recognition
Pose-Robust Face Recognition via Deep Residual Equivariant Mapping,2018,CVPR,The Conference on Computer Vision and Pattern Recognition
DecideNet: Counting Varying Density Crowds Through Attention Guided Detection and Density Estimation,2018,CVPR,The Conference on Computer Vision and Pattern Recognition
LSTM Pose Machines,2018,CVPR,The Conference on Computer Vision and Pattern Recognition
What Makes a Video a Video: Analyzing Temporal Information in Video Understanding Models and Datasets,2018,CVPR,The Conference on Computer Vision and Pattern Recognition
Fast Video Object Segmentation by Reference-Guided Mask Propagation,2018,CVPR,The Conference on Computer Vision and Pattern Recognition
NeuralNetwork-Viterbi: A Framework for Weakly Supervised Video Learning,2018,CVPR,The Conference on Computer Vision and Pattern Recognition
Actor and Observer: Joint Modeling of First and Third-Person Videos,2018,CVPR,The Conference on Computer Vision and Pattern Recognition
HSA-RNN: Hierarchical Structure-Adaptive RNN for Video Summarization,2018,CVPR,The Conference on Computer Vision and Pattern Recognition
Fast and Accurate Online Video Object Segmentation via Tracking Parts,2018,CVPR,The Conference on Computer Vision and Pattern Recognition
Now You Shake Me: Towards Automatic 4D Cinema,2018,CVPR,The Conference on Computer Vision and Pattern Recognition
Viewpoint-Aware Video Summarization,2018,CVPR,The Conference on Computer Vision and Pattern Recognition
Photometric Stereo in Participating Media Considering Shape-Dependent Forward Scatter,2018,CVPR,The Conference on Computer Vision and Pattern Recognition
Direction-Aware Spatial Context Features for Shadow Detection,2018,CVPR,The Conference on Computer Vision and Pattern Recognition
Discriminative Learning of Latent Features for Zero-Shot Recognition,2018,CVPR,The Conference on Computer Vision and Pattern Recognition
Learning to Adapt Structured Output Space for Semantic Segmentation,2018,CVPR,The Conference on Computer Vision and Pattern Recognition
Multi-Task Learning Using Uncertainty to Weigh Losses for Scene Geometry and Semantics,2018,CVPR,The Conference on Computer Vision and Pattern Recognition
