title,year,conf,conf_long
Embodied Question Answering,2018,CVPR,The Conference on Computer Vision and Pattern Recognition
Learning by Asking Questions,2018,CVPR,The Conference on Computer Vision and Pattern Recognition
Finding Tiny Faces in the Wild With Generative Adversarial Network,2018,CVPR,The Conference on Computer Vision and Pattern Recognition
Learning Face Age Progression: A Pyramid Architecture of GANs,2018,CVPR,The Conference on Computer Vision and Pattern Recognition
PairedCycleGAN: Asymmetric Style Transfer for Applying and Removing Makeup,2018,CVPR,The Conference on Computer Vision and Pattern Recognition
GANerated Hands for Real-Time 3D Hand Tracking From Monocular RGB,2018,CVPR,The Conference on Computer Vision and Pattern Recognition
Learning Pose Specific Representations by Predicting Different Views,2018,CVPR,The Conference on Computer Vision and Pattern Recognition
Weakly and Semi Supervised Human Body Part Parsing via Pose-Guided Knowledge Transfer,2018,CVPR,The Conference on Computer Vision and Pattern Recognition
Person Transfer GAN to Bridge Domain Gap for Person Re-Identification,2018,CVPR,The Conference on Computer Vision and Pattern Recognition
Cross-Modal Deep Variational Hand Pose Estimation,2018,CVPR,The Conference on Computer Vision and Pattern Recognition
Disentangled Person Image Generation,2018,CVPR,The Conference on Computer Vision and Pattern Recognition
Super-FAN: Integrated Facial Landmark Localization and Super-Resolution of Real-World Low Resolution Faces in Arbitrary Poses With GANs,2018,CVPR,The Conference on Computer Vision and Pattern Recognition
Multistage Adversarial Losses for Pose-Based Human Image Synthesis,2018,CVPR,The Conference on Computer Vision and Pattern Recognition
Rotation Averaging and Strong Duality,2018,CVPR,The Conference on Computer Vision and Pattern Recognition
Hybrid Camera Pose Estimation,2018,CVPR,The Conference on Computer Vision and Pattern Recognition
A Certifiably Globally Optimal Solution to the Non-Minimal Relative Pose Problem,2018,CVPR,The Conference on Computer Vision and Pattern Recognition
Single View Stereo Matching,2018,CVPR,The Conference on Computer Vision and Pattern Recognition
Fight Ill-Posedness With Ill-Posedness: Single-Shot Variational Depth Super-Resolution From Shading,2018,CVPR,The Conference on Computer Vision and Pattern Recognition
Deep Depth Completion of a Single RGB-D Image,2018,CVPR,The Conference on Computer Vision and Pattern Recognition
Multi-View Harmonized Bilinear Network for 3D Object Recognition,2018,CVPR,The Conference on Computer Vision and Pattern Recognition
PPFNet: Global Context Aware Local Features for Robust 3D Point Matching,2018,CVPR,The Conference on Computer Vision and Pattern Recognition
FoldingNet: Point Cloud Auto-Encoder via Deep Grid Deformation,2018,CVPR,The Conference on Computer Vision and Pattern Recognition
A Papier-Mâché Approach to Learning 3D Surface Generation,2018,CVPR,The Conference on Computer Vision and Pattern Recognition
LEGO: Learning Edge With Geometry All at Once by Watching Videos,2018,CVPR,The Conference on Computer Vision and Pattern Recognition
Five-Point Fundamental Matrix Estimation for Uncalibrated Cameras,2018,CVPR,The Conference on Computer Vision and Pattern Recognition
PointFusion: Deep Sensor Fusion for 3D Bounding Box Estimation,2018,CVPR,The Conference on Computer Vision and Pattern Recognition
Scalable Dense Non-Rigid Structure-From-Motion: A Grassmannian Perspective,2018,CVPR,The Conference on Computer Vision and Pattern Recognition
GVCNN: Group-View Convolutional Neural Networks for 3D Shape Recognition,2018,CVPR,The Conference on Computer Vision and Pattern Recognition
Depth and Transient Imaging With Compressive SPAD Array Cameras,2018,CVPR,The Conference on Computer Vision and Pattern Recognition
GeoNet: Geometric Neural Network for Joint Depth and Surface Normal Estimation,2018,CVPR,The Conference on Computer Vision and Pattern Recognition
Real-Time Seamless Single Shot 6D Object Pose Prediction,2018,CVPR,The Conference on Computer Vision and Pattern Recognition
"Factoring Shape, Pose, and Layout From the 2D Image of a 3D Scene",2018,CVPR,The Conference on Computer Vision and Pattern Recognition
Monocular Relative Depth Perception With Web Stereo Data Supervision,2018,CVPR,The Conference on Computer Vision and Pattern Recognition
Spline Error Weighting for Robust Visual-Inertial Fusion,2018,CVPR,The Conference on Computer Vision and Pattern Recognition
Single-Image Depth Estimation Based on Fourier Domain Analysis,2018,CVPR,The Conference on Computer Vision and Pattern Recognition
Unsupervised Learning of Monocular Depth Estimation and Visual Odometry With Deep Feature Reconstruction,2018,CVPR,The Conference on Computer Vision and Pattern Recognition
Detect-and-Track: Efficient Pose Estimation in Videos,2018,CVPR,The Conference on Computer Vision and Pattern Recognition
Supervision-by-Registration: An Unsupervised Approach to Improve the Precision of Facial Landmark Detectors,2018,CVPR,The Conference on Computer Vision and Pattern Recognition
Diversity Regularized Spatiotemporal Attention for Video-Based Person Re-Identification,2018,CVPR,The Conference on Computer Vision and Pattern Recognition
Style Aggregated Network for Facial Landmark Detection,2018,CVPR,The Conference on Computer Vision and Pattern Recognition
Learning Deep Models for Face Anti-Spoofing: Binary or Auxiliary Supervision,2018,CVPR,The Conference on Computer Vision and Pattern Recognition
Deep Cost-Sensitive and Order-Preserving Feature Learning for Cross-Population Age Estimation,2018,CVPR,The Conference on Computer Vision and Pattern Recognition
First-Person Hand Action Benchmark With RGB-D Videos and 3D Hand Pose Annotations,2018,CVPR,The Conference on Computer Vision and Pattern Recognition
A Pose-Sensitive Embedding for Person Re-Identification With Expanded Cross Neighborhood Re-Ranking,2018,CVPR,The Conference on Computer Vision and Pattern Recognition
Disentangling 3D Pose in a Dendritic CNN for Unconstrained 2D Face Alignment,2018,CVPR,The Conference on Computer Vision and Pattern Recognition
A Hierarchical Generative Model for Eye Image Synthesis and Eye Gaze Estimation,2018,CVPR,The Conference on Computer Vision and Pattern Recognition
MiCT: Mixed 3D/2D Convolutional Tube for Human Action Recognition,2018,CVPR,The Conference on Computer Vision and Pattern Recognition
Learning to Estimate 3D Human Pose and Shape From a Single Color Image,2018,CVPR,The Conference on Computer Vision and Pattern Recognition
Glimpse Clouds: Human Activity Recognition From Unstructured Feature Points,2018,CVPR,The Conference on Computer Vision and Pattern Recognition
Context-Aware Deep Feature Compression for High-Speed Visual Tracking,2018,CVPR,The Conference on Computer Vision and Pattern Recognition
Correlation Tracking via Joint Discrimination and Reliability Learning,2018,CVPR,The Conference on Computer Vision and Pattern Recognition
PhaseNet for Video Frame Interpolation,2018,CVPR,The Conference on Computer Vision and Pattern Recognition
The Best of Both Worlds: Combining CNNs and Geometric Constraints for Hierarchical Motion Segmentation,2018,CVPR,The Conference on Computer Vision and Pattern Recognition
Hyperparameter Optimization for Tracking With Continuous Deep Q-Learning,2018,CVPR,The Conference on Computer Vision and Pattern Recognition
Scale-Transferrable Object Detection,2018,CVPR,The Conference on Computer Vision and Pattern Recognition
A Prior-Less Method for Multi-Face Tracking in Unconstrained Videos,2018,CVPR,The Conference on Computer Vision and Pattern Recognition
End-to-End Flow Correlation Tracking With Spatial-Temporal Attention,2018,CVPR,The Conference on Computer Vision and Pattern Recognition
Deep Texture Manifold for Ground Terrain Recognition,2018,CVPR,The Conference on Computer Vision and Pattern Recognition
Learning Superpixels With Segmentation-Aware Affinity Loss,2018,CVPR,The Conference on Computer Vision and Pattern Recognition
Interactive Image Segmentation With Latent Diversity,2018,CVPR,The Conference on Computer Vision and Pattern Recognition
The Unreasonable Effectiveness of Deep Features as a Perceptual Metric,2018,CVPR,The Conference on Computer Vision and Pattern Recognition
Local Descriptors Optimized for Average Precision,2018,CVPR,The Conference on Computer Vision and Pattern Recognition
Recovering Realistic Texture in Image Super-Resolution by Deep Spatial Feature Transform,2018,CVPR,The Conference on Computer Vision and Pattern Recognition
Deep Extreme Cut: From Extreme Points to Object Segmentation,2018,CVPR,The Conference on Computer Vision and Pattern Recognition
Learning to Parse Wireframes in Images of Man-Made Environments,2018,CVPR,The Conference on Computer Vision and Pattern Recognition
Occlusion-Aware Rolling Shutter Rectification of 3D Scenes,2018,CVPR,The Conference on Computer Vision and Pattern Recognition
Content-Sensitive Supervoxels via Uniform Tessellations on Video Manifolds,2018,CVPR,The Conference on Computer Vision and Pattern Recognition
Intrinsic Image Transformation via Scale Space Decomposition,2018,CVPR,The Conference on Computer Vision and Pattern Recognition
Learned Shape-Tailored Descriptors for Segmentation,2018,CVPR,The Conference on Computer Vision and Pattern Recognition
PAD-Net: Multi-Tasks Guided Prediction-and-Distillation Network for Simultaneous Depth Estimation and Scene Parsing,2018,CVPR,The Conference on Computer Vision and Pattern Recognition
Multi-Image Semantic Matching by Mining Consistent Features,2018,CVPR,The Conference on Computer Vision and Pattern Recognition
Density-Aware Single Image De-Raining Using a Multi-Stream Dense Network,2018,CVPR,The Conference on Computer Vision and Pattern Recognition
Joint Cuts and Matching of Partitions in One Graph,2018,CVPR,The Conference on Computer Vision and Pattern Recognition
Progressive Attention Guided Recurrent Network for Salient Object Detection,2018,CVPR,The Conference on Computer Vision and Pattern Recognition
Fast and Accurate Single Image Super-Resolution via Information Distillation Network,2018,CVPR,The Conference on Computer Vision and Pattern Recognition
Hallucinated-IQA: No-Reference Image Quality Assessment via Adversarial Learning,2018,CVPR,The Conference on Computer Vision and Pattern Recognition
NAG: Network for Adversary Generation,2018,CVPR,The Conference on Computer Vision and Pattern Recognition
Dynamic-Structured Semantic Propagation Network,2018,CVPR,The Conference on Computer Vision and Pattern Recognition
Cross-Domain Self-Supervised Multi-Task Feature Learning Using Synthetic Imagery,2018,CVPR,The Conference on Computer Vision and Pattern Recognition
A Two-Step Disentanglement Method,2018,CVPR,The Conference on Computer Vision and Pattern Recognition
Robust Facial Landmark Detection via a Fully-Convolutional Local-Global Context Network,2018,CVPR,The Conference on Computer Vision and Pattern Recognition
Decorrelated Batch Normalization,2018,CVPR,The Conference on Computer Vision and Pattern Recognition
Learning to Sketch With Shortcut Cycle Consistency,2018,CVPR,The Conference on Computer Vision and Pattern Recognition
Towards a Mathematical Understanding of the Difficulty in Learning With Feedforward Neural Networks,2018,CVPR,The Conference on Computer Vision and Pattern Recognition
FaceID-GAN: Learning a Symmetry Three-Player GAN for Identity-Preserving Face Synthesis,2018,CVPR,The Conference on Computer Vision and Pattern Recognition
A Constrained Deep Neural Network for Ordinal Regression,2018,CVPR,The Conference on Computer Vision and Pattern Recognition
Modulated Convolutional Networks,2018,CVPR,The Conference on Computer Vision and Pattern Recognition
Learning Steerable Filters for Rotation Equivariant CNNs,2018,CVPR,The Conference on Computer Vision and Pattern Recognition
Efficient Interactive Annotation of Segmentation Datasets With Polygon-RNN++,2018,CVPR,The Conference on Computer Vision and Pattern Recognition
SplineCNN: Fast Geometric Deep Learning With Continuous B-Spline Kernels,2018,CVPR,The Conference on Computer Vision and Pattern Recognition
GAGAN: Geometry-Aware Generative Adversarial Networks,2018,CVPR,The Conference on Computer Vision and Pattern Recognition
On the Robustness of Semantic Segmentation Models to Adversarial Attacks,2018,CVPR,The Conference on Computer Vision and Pattern Recognition
Feedback-Prop: Convolutional Neural Network Inference Under Partial Evidence,2018,CVPR,The Conference on Computer Vision and Pattern Recognition
Super-Resolving Very Low-Resolution Face Images With Supplementary Attributes,2018,CVPR,The Conference on Computer Vision and Pattern Recognition
Frustum PointNets for 3D Object Detection From RGB-D Data,2018,CVPR,The Conference on Computer Vision and Pattern Recognition
W2F: A Weakly-Supervised to Fully-Supervised Framework for Object Detection,2018,CVPR,The Conference on Computer Vision and Pattern Recognition
3D Object Detection With Latent Support Surfaces,2018,CVPR,The Conference on Computer Vision and Pattern Recognition
Towards Faster Training of Global Covariance Pooling Networks by Iterative Matrix Square Root Normalization,2018,CVPR,The Conference on Computer Vision and Pattern Recognition
Recurrent Scene Parsing With Perspective Understanding in the Loop,2018,CVPR,The Conference on Computer Vision and Pattern Recognition
Improving Occlusion and Hard Negative Handling for Single-Stage Pedestrian Detectors,2018,CVPR,The Conference on Computer Vision and Pattern Recognition
Learning to Act Properly: Predicting and Explaining Affordances From Images,2018,CVPR,The Conference on Computer Vision and Pattern Recognition
Pointwise Convolutional Neural Networks,2018,CVPR,The Conference on Computer Vision and Pattern Recognition
Image-Image Domain Adaptation With Preserved Self-Similarity and Domain-Dissimilarity for Person Re-Identification,2018,CVPR,The Conference on Computer Vision and Pattern Recognition
A Generative Adversarial Approach for Zero-Shot Learning From Noisy Texts,2018,CVPR,The Conference on Computer Vision and Pattern Recognition
"Tensorize, Factorize and Regularize: Robust Visual Relationship Learning",2018,CVPR,The Conference on Computer Vision and Pattern Recognition
Transductive Unbiased Embedding for Zero-Shot Learning,2018,CVPR,The Conference on Computer Vision and Pattern Recognition
Hierarchical Novelty Detection for Visual Object Recognition,2018,CVPR,The Conference on Computer Vision and Pattern Recognition
Zero-Shot Visual Recognition Using Semantics-Preserving Adversarial Embedding Networks,2018,CVPR,The Conference on Computer Vision and Pattern Recognition
Learning Rich Features for Image Manipulation Detection,2018,CVPR,The Conference on Computer Vision and Pattern Recognition
Human Semantic Parsing for Person Re-Identification,2018,CVPR,The Conference on Computer Vision and Pattern Recognition
Stacked Latent Attention for Multimodal Reasoning,2018,CVPR,The Conference on Computer Vision and Pattern Recognition
R-FCN-3000 at 30fps: Decoupling Detection and Classification,2018,CVPR,The Conference on Computer Vision and Pattern Recognition
CSRNet: Dilated Convolutional Neural Networks for Understanding the Highly Congested Scenes,2018,CVPR,The Conference on Computer Vision and Pattern Recognition
Revisiting Knowledge Transfer for Training Object Class Detectors,2018,CVPR,The Conference on Computer Vision and Pattern Recognition
Deep Sparse Coding for Invariant Multimodal Halle Berry Neurons,2018,CVPR,The Conference on Computer Vision and Pattern Recognition
On the Convergence of PatchMatch and Its Variants,2018,CVPR,The Conference on Computer Vision and Pattern Recognition
Rethinking the Faster R-CNN Architecture for Temporal Action Localization,2018,CVPR,The Conference on Computer Vision and Pattern Recognition
MoNet: Deep Motion Exploitation for Video Object Segmentation,2018,CVPR,The Conference on Computer Vision and Pattern Recognition
Video Representation Learning Using Discriminative Pooling,2018,CVPR,The Conference on Computer Vision and Pattern Recognition
Recognizing Human Actions as the Evolution of Pose Estimation Maps,2018,CVPR,The Conference on Computer Vision and Pattern Recognition
Video Person Re-Identification With Competitive Snippet-Similarity Aggregation and Co-Attentive Snippet Embedding,2018,CVPR,The Conference on Computer Vision and Pattern Recognition
Mask-Guided Contrastive Attention Model for Person Re-Identification,2018,CVPR,The Conference on Computer Vision and Pattern Recognition
Blazingly Fast Video Object Segmentation With Pixel-Wise Metric Learning,2018,CVPR,The Conference on Computer Vision and Pattern Recognition
Learning to Compare: Relation Network for Few-Shot Learning,2018,CVPR,The Conference on Computer Vision and Pattern Recognition
COCO-Stuff: Thing and Stuff Classes in Context,2018,CVPR,The Conference on Computer Vision and Pattern Recognition
Image Generation From Scene Graphs,2018,CVPR,The Conference on Computer Vision and Pattern Recognition
Deep Cauchy Hashing for Hamming Space Retrieval,2018,CVPR,The Conference on Computer Vision and Pattern Recognition
Learning to Look Around: Intelligently Exploring Unseen Environments for Unknown Tasks,2018,CVPR,The Conference on Computer Vision and Pattern Recognition
Multi-Scale Location-Aware Kernel Representation for Object Detection,2018,CVPR,The Conference on Computer Vision and Pattern Recognition
Clinical Skin Lesion Diagnosis Using Representations Inspired by Dermatologist Criteria,2018,CVPR,The Conference on Computer Vision and Pattern Recognition
Compare and Contrast: Learning Prominent Visual Differences,2018,CVPR,The Conference on Computer Vision and Pattern Recognition
"Multi-Evidence Filtering and Fusion for Multi-Label Classification, Object Detection and Semantic Segmentation Based on Weakly Supervised Learning",2018,CVPR,The Conference on Computer Vision and Pattern Recognition
HashGAN: Deep Learning to Hash With Pair Conditional Wasserstein GAN,2018,CVPR,The Conference on Computer Vision and Pattern Recognition
Min-Entropy Latent Model for Weakly Supervised Object Detection,2018,CVPR,The Conference on Computer Vision and Pattern Recognition
MAttNet: Modular Attention Network for Referring Expression Comprehension,2018,CVPR,The Conference on Computer Vision and Pattern Recognition
AttnGAN: Fine-Grained Text to Image Generation With Attentional Generative Adversarial Networks,2018,CVPR,The Conference on Computer Vision and Pattern Recognition
Adversarial Complementary Learning for Weakly Supervised Object Localization,2018,CVPR,The Conference on Computer Vision and Pattern Recognition
Conditional Generative Adversarial Network for Structured Domain Adaptation,2018,CVPR,The Conference on Computer Vision and Pattern Recognition
GroupCap: Group-Based Image Captioning With Structured Relevance and Diversity Constraints,2018,CVPR,The Conference on Computer Vision and Pattern Recognition
Weakly-Supervised Semantic Segmentation by Iteratively Mining Common Object Features,2018,CVPR,The Conference on Computer Vision and Pattern Recognition
Bootstrapping the Performance of Webly Supervised Semantic Segmentation,2018,CVPR,The Conference on Computer Vision and Pattern Recognition
DeepVoting: A Robust and Explainable Deep Network for Semantic Part Detection Under Partial Occlusion,2018,CVPR,The Conference on Computer Vision and Pattern Recognition
Geometry-Aware Scene Text Detection With Instance Transformation Network,2018,CVPR,The Conference on Computer Vision and Pattern Recognition
Optical Flow Guided Feature: A Fast and Robust Motion Representation for Video Action Recognition,2018,CVPR,The Conference on Computer Vision and Pattern Recognition
Motion-Guided Cascaded Refinement Network for Video Object Segmentation,2018,CVPR,The Conference on Computer Vision and Pattern Recognition
A Memory Network Approach for Story-Based Temporal Summarization of 360° Videos,2018,CVPR,The Conference on Computer Vision and Pattern Recognition
Cube Padding for Weakly-Supervised Saliency Prediction in 360° Videos,2018,CVPR,The Conference on Computer Vision and Pattern Recognition
Appearance-and-Relation Networks for Video Classification,2018,CVPR,The Conference on Computer Vision and Pattern Recognition
Excitation Backprop for RNNs,2018,CVPR,The Conference on Computer Vision and Pattern Recognition
One-Shot Action Localization by Learning Sequence Matching Network,2018,CVPR,The Conference on Computer Vision and Pattern Recognition
Structure Preserving Video Prediction,2018,CVPR,The Conference on Computer Vision and Pattern Recognition
Person Re-Identification With Cascaded Pairwise Convolutions,2018,CVPR,The Conference on Computer Vision and Pattern Recognition
On the Importance of Label Quality for Semantic Segmentation,2018,CVPR,The Conference on Computer Vision and Pattern Recognition
Scalable and Effective Deep CCA via Soft Decorrelation,2018,CVPR,The Conference on Computer Vision and Pattern Recognition
Duplex Generative Adversarial Network for Unsupervised Domain Adaptation,2018,CVPR,The Conference on Computer Vision and Pattern Recognition
Edit Probability for Scene Text Recognition,2018,CVPR,The Conference on Computer Vision and Pattern Recognition
Global Versus Localized Generative Adversarial Nets,2018,CVPR,The Conference on Computer Vision and Pattern Recognition
MoCoGAN: Decomposing Motion and Content for Video Generation,2018,CVPR,The Conference on Computer Vision and Pattern Recognition
Recurrent Residual Module for Fast Inference in Videos,2018,CVPR,The Conference on Computer Vision and Pattern Recognition
Improving Landmark Localization With Semi-Supervised Learning,2018,CVPR,The Conference on Computer Vision and Pattern Recognition
Adversarial Data Programming: Using GANs to Relax the Bottleneck of Curated Labeled Data,2018,CVPR,The Conference on Computer Vision and Pattern Recognition
Stochastic Variational Inference With Gradient Linearization,2018,CVPR,The Conference on Computer Vision and Pattern Recognition
Multi-Label Zero-Shot Learning With Structured Knowledge Graphs,2018,CVPR,The Conference on Computer Vision and Pattern Recognition
MorphNet: Fast & Simple Resource-Constrained Structure Learning of Deep Networks,2018,CVPR,The Conference on Computer Vision and Pattern Recognition
Deep Adversarial Subspace Clustering,2018,CVPR,The Conference on Computer Vision and Pattern Recognition
Towards Human-Machine Cooperation: Self-Supervised Sample Mining for Object Detection,2018,CVPR,The Conference on Computer Vision and Pattern Recognition
Discrete-Continuous ADMM for Transductive Inference in Higher-Order MRFs,2018,CVPR,The Conference on Computer Vision and Pattern Recognition
Robust Physical-World Attacks on Deep Learning Visual Classification,2018,CVPR,The Conference on Computer Vision and Pattern Recognition
Generating a Fusion Image: One's Identity and Another's Shape,2018,CVPR,The Conference on Computer Vision and Pattern Recognition
Learning to Promote Saliency Detectors,2018,CVPR,The Conference on Computer Vision and Pattern Recognition
Image Super-Resolution via Dual-State Recurrent Networks,2018,CVPR,The Conference on Computer Vision and Pattern Recognition
Deep Back-Projection Networks for Super-Resolution,2018,CVPR,The Conference on Computer Vision and Pattern Recognition
Focus Manipulation Detection via Photometric Histogram Analysis,2018,CVPR,The Conference on Computer Vision and Pattern Recognition
Compassionately Conservative Balanced Cuts for Image Segmentation,2018,CVPR,The Conference on Computer Vision and Pattern Recognition
A High-Quality Denoising Dataset for Smartphone Cameras,2018,CVPR,The Conference on Computer Vision and Pattern Recognition
Context-Aware Synthesis for Video Frame Interpolation,2018,CVPR,The Conference on Computer Vision and Pattern Recognition
Salient Object Detection Driven by Fixation Prediction,2018,CVPR,The Conference on Computer Vision and Pattern Recognition
Enhancing the Spatial Resolution of Stereo Images Using a Parallax Prior,2018,CVPR,The Conference on Computer Vision and Pattern Recognition
HATS: Histograms of Averaged Time Surfaces for Robust Event-Based Object Classification,2018,CVPR,The Conference on Computer Vision and Pattern Recognition
A Bi-Directional Message Passing Model for Salient Object Detection,2018,CVPR,The Conference on Computer Vision and Pattern Recognition
Matching Pixels Using Co-Occurrence Statistics,2018,CVPR,The Conference on Computer Vision and Pattern Recognition
SeedNet: Automatic Seed Generation With Deep Reinforcement Learning for Robust Interactive Segmentation,2018,CVPR,The Conference on Computer Vision and Pattern Recognition
Jerk-Aware Video Acceleration Magnification,2018,CVPR,The Conference on Computer Vision and Pattern Recognition
Defense Against Adversarial Attacks Using High-Level Representation Guided Denoiser,2018,CVPR,The Conference on Computer Vision and Pattern Recognition
Stacked Conditional Generative Adversarial Networks for Jointly Learning Shadow Detection and Shadow Removal,2018,CVPR,The Conference on Computer Vision and Pattern Recognition
Image Correction via Deep Reciprocating HDR Transformation,2018,CVPR,The Conference on Computer Vision and Pattern Recognition
PieAPP: Perceptual Image-Error Assessment Through Pairwise Preference,2018,CVPR,The Conference on Computer Vision and Pattern Recognition
Normalized Cut Loss for Weakly-Supervised CNN Segmentation,2018,CVPR,The Conference on Computer Vision and Pattern Recognition
ISTA-Net: Interpretable Optimization-Inspired Deep Network for Image Compressive Sensing,2018,CVPR,The Conference on Computer Vision and Pattern Recognition
Fast End-to-End Trainable Guided Filter,2018,CVPR,The Conference on Computer Vision and Pattern Recognition
Disentangling Structure and Aesthetics for Style-Aware Image Completion,2018,CVPR,The Conference on Computer Vision and Pattern Recognition
