title,year,conf,conf_long
Learning a Discriminative Feature Network for Semantic Segmentation,2018,CVPR,The Conference on Computer Vision and Pattern Recognition
Kernelized Subspace Pooling for Deep Local Descriptors,2018,CVPR,The Conference on Computer Vision and Pattern Recognition
pOSE: Pseudo Object Space Error for Initialization-Free Bundle Adjustment,2018,CVPR,The Conference on Computer Vision and Pattern Recognition
Deformable Shape Completion With Graph Convolutional Autoencoders,2018,CVPR,The Conference on Computer Vision and Pattern Recognition
Learning From Millions of 3D Scans for Large-Scale 3D Face Recognition,2018,CVPR,The Conference on Computer Vision and Pattern Recognition
CarFusion: Combining Point Tracking and Part Detection for Dynamic 3D Reconstruction of Vehicles,2018,CVPR,The Conference on Computer Vision and Pattern Recognition
Deep Material-Aware Cross-Spectral Stereo Matching,2018,CVPR,The Conference on Computer Vision and Pattern Recognition
Augmenting Crowd-Sourced 3D Reconstructions Using Semantic Detections,2018,CVPR,The Conference on Computer Vision and Pattern Recognition
Matryoshka Networks: Predicting 3D Geometry via Nested Shape Layers,2018,CVPR,The Conference on Computer Vision and Pattern Recognition
Triplet-Center Loss for Multi-View 3D Object Retrieval,2018,CVPR,The Conference on Computer Vision and Pattern Recognition
Learning 3D Shape Completion From Laser Scan Data With Weak Supervision,2018,CVPR,The Conference on Computer Vision and Pattern Recognition
End-to-End Learning of Keypoint Detector and Descriptor for Pose Invariant 3D Matching,2018,CVPR,The Conference on Computer Vision and Pattern Recognition
"ICE-BA: Incremental, Consistent and Efficient Bundle Adjustment for Visual-Inertial SLAM",2018,CVPR,The Conference on Computer Vision and Pattern Recognition
"GeoNet: Unsupervised Learning of Dense Depth, Optical Flow and Camera Pose",2018,CVPR,The Conference on Computer Vision and Pattern Recognition
Radially-Distorted Conjugate Translations,2018,CVPR,The Conference on Computer Vision and Pattern Recognition
Deep Ordinal Regression Network for Monocular Depth Estimation,2018,CVPR,The Conference on Computer Vision and Pattern Recognition
Analytical Modeling of Vanishing Points and Curves in Catadioptric Cameras,2018,CVPR,The Conference on Computer Vision and Pattern Recognition
Learning Depth From Monocular Videos Using Direct Methods,2018,CVPR,The Conference on Computer Vision and Pattern Recognition
Salience Guided Depth Calibration for Perceptually Optimized Compressive Light Field 3D Display,2018,CVPR,The Conference on Computer Vision and Pattern Recognition
MegaDepth: Learning Single-View Depth Prediction From Internet Photos,2018,CVPR,The Conference on Computer Vision and Pattern Recognition
LayoutNet: Reconstructing the 3D Room Layout From a Single RGB Image,2018,CVPR,The Conference on Computer Vision and Pattern Recognition
CBMV: A Coalesced Bidirectional Matching Volume for Disparity Estimation,2018,CVPR,The Conference on Computer Vision and Pattern Recognition
Zoom and Learn: Generalizing Deep Stereo Matching to Novel Domains,2018,CVPR,The Conference on Computer Vision and Pattern Recognition
Exploring Disentangled Feature Representation Beyond Face Identification,2018,CVPR,The Conference on Computer Vision and Pattern Recognition
Learning Facial Action Units From Web Images With Scalable Weakly Supervised Clustering,2018,CVPR,The Conference on Computer Vision and Pattern Recognition
Human Pose Estimation With Parsing Induced Learner,2018,CVPR,The Conference on Computer Vision and Pattern Recognition
Multi-Level Factorisation Net for Person Re-Identification,2018,CVPR,The Conference on Computer Vision and Pattern Recognition
Attention-Aware Compositional Network for Person Re-Identification,2018,CVPR,The Conference on Computer Vision and Pattern Recognition
Look at Boundary: A Boundary-Aware Face Alignment Algorithm,2018,CVPR,The Conference on Computer Vision and Pattern Recognition
Demo2Vec: Reasoning Object Affordances From Online Videos,2018,CVPR,The Conference on Computer Vision and Pattern Recognition
Monocular 3D Pose and Shape Estimation of Multiple People in Natural Scenes - The Importance of Multiple Scene Constraints,2018,CVPR,The Conference on Computer Vision and Pattern Recognition
"3D Human Sensing, Action and Emotion Recognition in Robot Assisted Therapy of Children With Autism",2018,CVPR,The Conference on Computer Vision and Pattern Recognition
Facial Expression Recognition by De-Expression Residue Learning,2018,CVPR,The Conference on Computer Vision and Pattern Recognition
A Causal And-Or Graph Model for Visibility Fluent Reasoning in Tracking Interacting Objects,2018,CVPR,The Conference on Computer Vision and Pattern Recognition
Weakly Supervised Facial Action Unit Recognition Through Adversarial Training,2018,CVPR,The Conference on Computer Vision and Pattern Recognition
Non-Linear Temporal Subspace Representations for Activity Recognition,2018,CVPR,The Conference on Computer Vision and Pattern Recognition
Towards Pose Invariant Face Recognition in the Wild,2018,CVPR,The Conference on Computer Vision and Pattern Recognition
Unifying Identification and Context Learning for Person Recognition,2018,CVPR,The Conference on Computer Vision and Pattern Recognition
Jointly Optimize Data Augmentation and Network Training: Adversarial Data Augmentation in Human Pose Estimation,2018,CVPR,The Conference on Computer Vision and Pattern Recognition
Wing Loss for Robust Facial Landmark Localisation With Convolutional Neural Networks,2018,CVPR,The Conference on Computer Vision and Pattern Recognition
Multiple Granularity Group Interaction Prediction,2018,CVPR,The Conference on Computer Vision and Pattern Recognition
Social GAN: Socially Acceptable Trajectories With Generative Adversarial Networks,2018,CVPR,The Conference on Computer Vision and Pattern Recognition
Deep Group-Shuffling Random Walk for Person Re-Identification,2018,CVPR,The Conference on Computer Vision and Pattern Recognition
Transferable Joint Attribute-Identity Deep Learning for Unsupervised Person Re-Identification,2018,CVPR,The Conference on Computer Vision and Pattern Recognition
Harmonious Attention Network for Person Re-Identification,2018,CVPR,The Conference on Computer Vision and Pattern Recognition
Real-Time Rotation-Invariant Face Detection With Progressive Calibration Networks,2018,CVPR,The Conference on Computer Vision and Pattern Recognition
Deep Regression Forests for Age Estimation,2018,CVPR,The Conference on Computer Vision and Pattern Recognition
Weakly-Supervised Deep Convolutional Neural Network Learning for Facial Action Unit Intensity Estimation,2018,CVPR,The Conference on Computer Vision and Pattern Recognition
Memory Based Online Learning of Deep Representations From Video Streams,2018,CVPR,The Conference on Computer Vision and Pattern Recognition
Efficient and Deep Person Re-Identification Using Multi-Level Similarity,2018,CVPR,The Conference on Computer Vision and Pattern Recognition
Multi-Level Fusion Based 3D Object Detection From Monocular Images,2018,CVPR,The Conference on Computer Vision and Pattern Recognition
A Perceptual Measure for Deep Single Image Camera Calibration,2018,CVPR,The Conference on Computer Vision and Pattern Recognition
Learning to Generate Time-Lapse Videos Using Multi-Stage Dynamic Generative Adversarial Networks,2018,CVPR,The Conference on Computer Vision and Pattern Recognition
Document Enhancement Using Visibility Detection,2018,CVPR,The Conference on Computer Vision and Pattern Recognition
A Weighted Sparse Sampling and Smoothing Frame Transition Approach for Semantic Fast-Forward First-Person Videos,2018,CVPR,The Conference on Computer Vision and Pattern Recognition
Context Contrasted Feature and Gated Multi-Scale Aggregation for Scene Segmentation,2018,CVPR,The Conference on Computer Vision and Pattern Recognition
Deep Layer Aggregation,2018,CVPR,The Conference on Computer Vision and Pattern Recognition
Convolutional Neural Networks With Alternately Updated Clique,2018,CVPR,The Conference on Computer Vision and Pattern Recognition
Practical Block-Wise Neural Network Architecture Generation,2018,CVPR,The Conference on Computer Vision and Pattern Recognition
xUnit: Learning a Spatial Activation Function for Efficient Image Restoration,2018,CVPR,The Conference on Computer Vision and Pattern Recognition
Crafting a Toolchain for Image Restoration by Deep Reinforcement Learning,2018,CVPR,The Conference on Computer Vision and Pattern Recognition
Deformation Aware Image Compression,2018,CVPR,The Conference on Computer Vision and Pattern Recognition
Distributable Consistent Multi-Object Matching,2018,CVPR,The Conference on Computer Vision and Pattern Recognition
Residual Dense Network for Image Super-Resolution,2018,CVPR,The Conference on Computer Vision and Pattern Recognition
Attentive Generative Adversarial Network for Raindrop Removal From a Single Image,2018,CVPR,The Conference on Computer Vision and Pattern Recognition
FSRNet: End-to-End Learning Face Super-Resolution With Facial Priors,2018,CVPR,The Conference on Computer Vision and Pattern Recognition
Burst Denoising With Kernel Prediction Networks,2018,CVPR,The Conference on Computer Vision and Pattern Recognition
Unsupervised Sparse Dirichlet-Net for Hyperspectral Image Super-Resolution,2018,CVPR,The Conference on Computer Vision and Pattern Recognition
Dynamic Scene Deblurring Using Spatially Variant Recurrent Neural Networks,2018,CVPR,The Conference on Computer Vision and Pattern Recognition
SPLATNet: Sparse Lattice Networks for Point Cloud Processing,2018,CVPR,The Conference on Computer Vision and Pattern Recognition
Surface Networks,2018,CVPR,The Conference on Computer Vision and Pattern Recognition
Self-Supervised Multi-Level Face Model Learning for Monocular Reconstruction at Over 250 Hz,2018,CVPR,The Conference on Computer Vision and Pattern Recognition
"CodeSLAM — Learning a Compact, Optimisable Representation for Dense Visual SLAM",2018,CVPR,The Conference on Computer Vision and Pattern Recognition
SGPN: Similarity Group Proposal Network for 3D Point Cloud Instance Segmentation,2018,CVPR,The Conference on Computer Vision and Pattern Recognition
PlaneNet: Piece-Wise Planar Reconstruction From a Single RGB Image,2018,CVPR,The Conference on Computer Vision and Pattern Recognition
Deep Parametric Continuous Convolutional Neural Networks,2018,CVPR,The Conference on Computer Vision and Pattern Recognition
FeaStNet: Feature-Steered Graph Convolutions for 3D Shape Analysis,2018,CVPR,The Conference on Computer Vision and Pattern Recognition
Image Collection Pop-Up: 3D Reconstruction and Clustering of Rigid and Non-Rigid Categories,2018,CVPR,The Conference on Computer Vision and Pattern Recognition
Geometry-Aware Learning of Maps for Camera Localization,2018,CVPR,The Conference on Computer Vision and Pattern Recognition
Recurrent Slice Networks for 3D Segmentation of Point Clouds,2018,CVPR,The Conference on Computer Vision and Pattern Recognition
Depth-Based 3D Hand Pose Estimation: From Current Achievements to Future Goals,2018,CVPR,The Conference on Computer Vision and Pattern Recognition
SobolevFusion: 3D Reconstruction of Scenes Undergoing Free Non-Rigid Motion,2018,CVPR,The Conference on Computer Vision and Pattern Recognition
AdaDepth: Unsupervised Content Congruent Adaptation for Depth Estimation,2018,CVPR,The Conference on Computer Vision and Pattern Recognition
Learning to Find Good Correspondences,2018,CVPR,The Conference on Computer Vision and Pattern Recognition
OATM: Occlusion Aware Template Matching by Consensus Set Maximization,2018,CVPR,The Conference on Computer Vision and Pattern Recognition
Deep Learning of Graph Matching,2018,CVPR,The Conference on Computer Vision and Pattern Recognition
Unsupervised Discovery of Object Landmarks as Structural Representations,2018,CVPR,The Conference on Computer Vision and Pattern Recognition
Quantization and Training of Neural Networks for Efficient Integer-Arithmetic-Only Inference,2018,CVPR,The Conference on Computer Vision and Pattern Recognition
Lean Multiclass Crowdsourcing,2018,CVPR,The Conference on Computer Vision and Pattern Recognition
Partial Transfer Learning With Selective Adversarial Networks,2018,CVPR,The Conference on Computer Vision and Pattern Recognition
Self-Supervised Feature Learning by Learning to Spot Artifacts,2018,CVPR,The Conference on Computer Vision and Pattern Recognition
LDMNet: Low Dimensional Manifold Regularized Neural Networks,2018,CVPR,The Conference on Computer Vision and Pattern Recognition
CondenseNet: An Efficient DenseNet Using Learned Group Convolutions,2018,CVPR,The Conference on Computer Vision and Pattern Recognition
Learning Deep Descriptors With Scale-Aware Triplet Networks,2018,CVPR,The Conference on Computer Vision and Pattern Recognition
Decoupled Networks,2018,CVPR,The Conference on Computer Vision and Pattern Recognition
Deep Adversarial Metric Learning,2018,CVPR,The Conference on Computer Vision and Pattern Recognition
PU-Net: Point Cloud Upsampling Network,2018,CVPR,The Conference on Computer Vision and Pattern Recognition
Real-Time Monocular Depth Estimation Using Synthetic Data With Domain Adaptation via Image Style Transfer,2018,CVPR,The Conference on Computer Vision and Pattern Recognition
Learning for Disparity Estimation Through Feature Constancy,2018,CVPR,The Conference on Computer Vision and Pattern Recognition
DeepMVS: Learning Multi-View Stereopsis,2018,CVPR,The Conference on Computer Vision and Pattern Recognition
Self-Calibrating Polarising Radiometric Calibration,2018,CVPR,The Conference on Computer Vision and Pattern Recognition
Coding Kendall's Shape Trajectories for 3D Action Recognition,2018,CVPR,The Conference on Computer Vision and Pattern Recognition
"Efficient, Sparse Representation of Manifold Distance Matrices for Classical Scaling",2018,CVPR,The Conference on Computer Vision and Pattern Recognition
Motion Segmentation by Exploiting Complementary Geometric Models,2018,CVPR,The Conference on Computer Vision and Pattern Recognition
"Estimation of Camera Locations in Highly Corrupted Scenarios: All About That Base, No Shape Trouble",2018,CVPR,The Conference on Computer Vision and Pattern Recognition
4D Human Body Correspondences From Panoramic Depth Maps,2018,CVPR,The Conference on Computer Vision and Pattern Recognition
Reconstructing Thin Structures of Manifold Surfaces by Integrating Spatial Curves,2018,CVPR,The Conference on Computer Vision and Pattern Recognition
Multi-View Consistency as Supervisory Signal for Learning Shape and Pose Prediction,2018,CVPR,The Conference on Computer Vision and Pattern Recognition
Probabilistic Plant Modeling via Multi-View Image-to-Image Translation,2018,CVPR,The Conference on Computer Vision and Pattern Recognition
Deep Marching Cubes: Learning Explicit Surface Representations,2018,CVPR,The Conference on Computer Vision and Pattern Recognition
Tags2Parts: Discovering Semantic Regions From Shape Tags,2018,CVPR,The Conference on Computer Vision and Pattern Recognition
Uncalibrated Photometric Stereo Under Natural Illumination,2018,CVPR,The Conference on Computer Vision and Pattern Recognition
Robust Depth Estimation From Auto Bracketed Images,2018,CVPR,The Conference on Computer Vision and Pattern Recognition
Free Supervision From Video Games,2018,CVPR,The Conference on Computer Vision and Pattern Recognition
Planar Shape Detection at Structural Scales,2018,CVPR,The Conference on Computer Vision and Pattern Recognition
Pix3D: Dataset and Methods for Single-Image 3D Shape Modeling,2018,CVPR,The Conference on Computer Vision and Pattern Recognition
Camera Pose Estimation With Unknown Principal Point,2018,CVPR,The Conference on Computer Vision and Pattern Recognition
Inverse Composition Discriminative Optimization for Point Cloud Registration,2018,CVPR,The Conference on Computer Vision and Pattern Recognition
SurfConv: Bridging 3D and 2D Convolution for RGBD Images,2018,CVPR,The Conference on Computer Vision and Pattern Recognition
A Fast Resection-Intersection Method for the Known Rotation Problem,2018,CVPR,The Conference on Computer Vision and Pattern Recognition
3D Pose Estimation and 3D Model Retrieval for Objects in the Wild,2018,CVPR,The Conference on Computer Vision and Pattern Recognition
Structure From Recurrent Motion: From Rigidity to Recurrency,2018,CVPR,The Conference on Computer Vision and Pattern Recognition
Learning Patch Reconstructability for Accelerating Multi-View Stereo,2018,CVPR,The Conference on Computer Vision and Pattern Recognition
Progressively Complementarity-Aware Fusion Network for RGB-D Salient Object Detection,2018,CVPR,The Conference on Computer Vision and Pattern Recognition
"Pixels, Voxels, and Views: A Study of Shape Representations for Single View 3D Object Shape Prediction",2018,CVPR,The Conference on Computer Vision and Pattern Recognition
Learning Dual Convolutional Neural Networks for Low-Level Vision,2018,CVPR,The Conference on Computer Vision and Pattern Recognition
Defocus Blur Detection via Multi-Stream Bottom-Top-Bottom Fully Convolutional Network,2018,CVPR,The Conference on Computer Vision and Pattern Recognition
3D-RCNN: Instance-Level 3D Object Reconstruction via Render-and-Compare,2018,CVPR,The Conference on Computer Vision and Pattern Recognition
PiCANet: Learning Pixel-Wise Contextual Attention for Saliency Detection,2018,CVPR,The Conference on Computer Vision and Pattern Recognition
Curve Reconstruction via the Global Statistics of Natural Curves,2018,CVPR,The Conference on Computer Vision and Pattern Recognition
What Do Deep Networks Like to See?,2018,CVPR,The Conference on Computer Vision and Pattern Recognition
“Zero-Shot” Super-Resolution Using Deep Internal Learning,2018,CVPR,The Conference on Computer Vision and Pattern Recognition
"Detect Globally, Refine Locally: A Novel Approach to Saliency Detection",2018,CVPR,The Conference on Computer Vision and Pattern Recognition
Beyond the Pixel-Wise Loss for Topology-Aware Delineation,2018,CVPR,The Conference on Computer Vision and Pattern Recognition
KIPPI: KInetic Polygonal Partitioning of Images,2018,CVPR,The Conference on Computer Vision and Pattern Recognition
Image Blind Denoising With Generative Adversarial Network Based Noise Modeling,2018,CVPR,The Conference on Computer Vision and Pattern Recognition
Multi-Scale Weighted Nuclear Norm Image Restoration,2018,CVPR,The Conference on Computer Vision and Pattern Recognition
MoNet: Moments Embedding Network,2018,CVPR,The Conference on Computer Vision and Pattern Recognition
Active Fixation Control to Predict Saccade Sequences,2018,CVPR,The Conference on Computer Vision and Pattern Recognition
Densely Connected Pyramid Dehazing Network,2018,CVPR,The Conference on Computer Vision and Pattern Recognition
Universal Denoising Networks : A Novel CNN Architecture for Image Denoising,2018,CVPR,The Conference on Computer Vision and Pattern Recognition
Learning Convolutional Networks for Content-Weighted Image Compression,2018,CVPR,The Conference on Computer Vision and Pattern Recognition
Deep Video Super-Resolution Network Using Dynamic Upsampling Filters Without Explicit Motion Compensation,2018,CVPR,The Conference on Computer Vision and Pattern Recognition
Erase or Fill? Deep Joint Recurrent Rain Removal and Reconstruction in Videos,2018,CVPR,The Conference on Computer Vision and Pattern Recognition
Flow Guided Recurrent Neural Encoder for Video Salient Object Detection,2018,CVPR,The Conference on Computer Vision and Pattern Recognition
Gated Fusion Network for Single Image Dehazing,2018,CVPR,The Conference on Computer Vision and Pattern Recognition
Learning a Single Convolutional Super-Resolution Network for Multiple Degradations,2018,CVPR,The Conference on Computer Vision and Pattern Recognition
Non-Blind Deblurring: Handling Kernel Uncertainty With CNNs,2018,CVPR,The Conference on Computer Vision and Pattern Recognition
Boundary Flow: A Siamese Network That Predicts Boundary Motion Without Training on Motion,2018,CVPR,The Conference on Computer Vision and Pattern Recognition
Learning to See in the Dark,2018,CVPR,The Conference on Computer Vision and Pattern Recognition
"Fast and Furious: Real Time End-to-End 3D Detection, Tracking and Motion Forecasting With a Single Convolutional Net",2018,CVPR,The Conference on Computer Vision and Pattern Recognition
An Analysis of Scale Invariance in Object Detection ­ SNIP,2018,CVPR,The Conference on Computer Vision and Pattern Recognition
Relation Networks for Object Detection,2018,CVPR,The Conference on Computer Vision and Pattern Recognition
Zero-Shot Sketch-Image Hashing,2018,CVPR,The Conference on Computer Vision and Pattern Recognition
VizWiz Grand Challenge: Answering Visual Questions From Blind People,2018,CVPR,The Conference on Computer Vision and Pattern Recognition
Divide and Grow: Capturing Huge Diversity in Crowd Images With Incrementally Growing CNN,2018,CVPR,The Conference on Computer Vision and Pattern Recognition
Structured Set Matching Networks for One-Shot Part Labeling,2018,CVPR,The Conference on Computer Vision and Pattern Recognition
Self-Supervised Learning of Geometrically Stable Features Through Probabilistic Introspection,2018,CVPR,The Conference on Computer Vision and Pattern Recognition
Link and Code: Fast Indexing With Graphs and Compact Regression Codes,2018,CVPR,The Conference on Computer Vision and Pattern Recognition
Textbook Question Answering Under Instructor Guidance With Memory Networks,2018,CVPR,The Conference on Computer Vision and Pattern Recognition
Unsupervised Deep Generative Adversarial Hashing Network,2018,CVPR,The Conference on Computer Vision and Pattern Recognition
Vision-and-Language Navigation: Interpreting Visually-Grounded Navigation Instructions in Real Environments,2018,CVPR,The Conference on Computer Vision and Pattern Recognition
DenseASPP for Semantic Segmentation in Street Scenes,2018,CVPR,The Conference on Computer Vision and Pattern Recognition
Efficient Optimization for Rank-Based Loss Functions,2018,CVPR,The Conference on Computer Vision and Pattern Recognition
Wasserstein Introspective Neural Networks,2018,CVPR,The Conference on Computer Vision and Pattern Recognition
Taskonomy: Disentangling Task Transfer Learning,2018,CVPR,The Conference on Computer Vision and Pattern Recognition
Maximum Classifier Discrepancy for Unsupervised Domain Adaptation,2018,CVPR,The Conference on Computer Vision and Pattern Recognition
BPGrad: Towards Global Optimality in Deep Learning via Branch and Pruning,2018,CVPR,The Conference on Computer Vision and Pattern Recognition
Perturbative Neural Networks,2018,CVPR,The Conference on Computer Vision and Pattern Recognition
Unsupervised Correlation Analysis,2018,CVPR,The Conference on Computer Vision and Pattern Recognition
A Biresolution Spectral Framework for Product Quantization,2018,CVPR,The Conference on Computer Vision and Pattern Recognition
Domain Adaptive Faster R-CNN for Object Detection in the Wild,2018,CVPR,The Conference on Computer Vision and Pattern Recognition
Low-Shot Learning With Large-Scale Diffusion,2018,CVPR,The Conference on Computer Vision and Pattern Recognition
Joint Pose and Expression Modeling for Facial Expression Recognition,2018,CVPR,The Conference on Computer Vision and Pattern Recognition
Lightweight Probabilistic Deep Networks,2018,CVPR,The Conference on Computer Vision and Pattern Recognition
Adversarially Learned One-Class Classifier for Novelty Detection,2018,CVPR,The Conference on Computer Vision and Pattern Recognition
Defense Against Universal Adversarial Perturbations,2018,CVPR,The Conference on Computer Vision and Pattern Recognition
Disentangling Factors of Variation by Mixing Them,2018,CVPR,The Conference on Computer Vision and Pattern Recognition
Deformable GANs for Pose-Based Human Image Generation,2018,CVPR,The Conference on Computer Vision and Pattern Recognition
Hierarchical Recurrent Attention Networks for Structured Online Maps,2018,CVPR,The Conference on Computer Vision and Pattern Recognition
Sliced Wasserstein Distance for Learning Gaussian Mixture Models,2018,CVPR,The Conference on Computer Vision and Pattern Recognition
Aligning Infinite-Dimensional Covariance Matrices in Reproducing Kernel Hilbert Spaces for Domain Adaptation,2018,CVPR,The Conference on Computer Vision and Pattern Recognition
CLEAR: Cumulative LEARning for One-Shot One-Class Image Recognition,2018,CVPR,The Conference on Computer Vision and Pattern Recognition
Local and Global Optimization Techniques in Graph-Based Clustering,2018,CVPR,The Conference on Computer Vision and Pattern Recognition
Multi-Task Learning by Maximizing Statistical Dependence,2018,CVPR,The Conference on Computer Vision and Pattern Recognition
Robust Classification With Convolutional Prototype Learning,2018,CVPR,The Conference on Computer Vision and Pattern Recognition
Generative Modeling Using the Sliced Wasserstein Distance,2018,CVPR,The Conference on Computer Vision and Pattern Recognition
Unsupervised Feature Learning via Non-Parametric Instance Discrimination,2018,CVPR,The Conference on Computer Vision and Pattern Recognition
Multi-Task Adversarial Network for Disentangled Feature Learning,2018,CVPR,The Conference on Computer Vision and Pattern Recognition
Learning From Synthetic Data: Addressing Domain Shift for Semantic Segmentation,2018,CVPR,The Conference on Computer Vision and Pattern Recognition
Empirical Study of the Topology and Geometry of Deep Networks,2018,CVPR,The Conference on Computer Vision and Pattern Recognition
Boosting Domain Adaptation by Discovering Latent Domains,2018,CVPR,The Conference on Computer Vision and Pattern Recognition
Shape From Shading Through Shape Evolution,2018,CVPR,The Conference on Computer Vision and Pattern Recognition
