title,year,conf,conf_long
Weighting-based Variable Neighborhood Search for Optimal Camera Placement,2021,AAAI,the Association for the Advancement of Artificial Intelligence
"Multi-Goal Multi-Agent Path Finding via Decoupled and Integrated Goal
      Vertex Ordering",2021,AAAI,the Association for the Advancement of Artificial Intelligence
"Bayes DistNet - A Robust Neural Network for Algorithm Runtime Distribution
      Predictions",2021,AAAI,the Association for the Advancement of Artificial Intelligence
Learning Branching Heuristics for Propositional Model Counting,2021,AAAI,the Association for the Advancement of Artificial Intelligence
"Accelerated Combinatorial Search for Outlier Detection with Provable Bound
      on Sub-Optimality",2021,AAAI,the Association for the Advancement of Artificial Intelligence
"Combining Reinforcement Learning with Lin-Kernighan-Helsgaun Algorithm for
      the Traveling Salesman Problem",2021,AAAI,the Association for the Advancement of Artificial Intelligence
"Improving Maximum k-plex Solver via Second-Order Reduction and Graph Color
      Bounding",2021,AAAI,the Association for the Advancement of Artificial Intelligence
"GATE: Graph Attention Transformer Encoder for Cross-lingual Relation and
      Event Extraction",2021,AAAI,the Association for the Advancement of Artificial Intelligence
"Empirical Regularization for Synthetic Sentence Pairs in Unsupervised
      Neural Machine Translation",2021,AAAI,the Association for the Advancement of Artificial Intelligence
"Segmentation of Tweets with URLs and its Applications to Sentiment
      Analysis",2021,AAAI,the Association for the Advancement of Artificial Intelligence
Unsupervised Opinion Summarization with Content Planning,2021,AAAI,the Association for the Advancement of Artificial Intelligence
Enhancing Scientific Papers Summarization with Citation Graph,2021,AAAI,the Association for the Advancement of Artificial Intelligence
Multi-Dimensional Explanation of Target Variables from Documents,2021,AAAI,the Association for the Advancement of Artificial Intelligence
Joint Semantic Analysis with Document-Level Cross-Task Coherence Rewards,2021,AAAI,the Association for the Advancement of Artificial Intelligence
"Segatron: Segment-Aware Transformer for Language Modeling and
      Understanding",2021,AAAI,the Association for the Advancement of Artificial Intelligence
Learning to Copy Coherent Knowledge for Response Generation,2021,AAAI,the Association for the Advancement of Artificial Intelligence
Contextualized Rewriting for Text Summarization,2021,AAAI,the Association for the Advancement of Artificial Intelligence
"Knowledge-driven Natural Language Understanding of English Text and its
      Applications",2021,AAAI,the Association for the Advancement of Artificial Intelligence
"One SPRING to Rule Them Both: Symmetric AMR Semantic Parsing and
      Generation without a Complex Pipeline",2021,AAAI,the Association for the Advancement of Artificial Intelligence
"Benchmarking Knowledge-Enhanced Commonsense Question Answering via
      Knowledge-to-Text Transformation",2021,AAAI,the Association for the Advancement of Artificial Intelligence
"Multilingual Transfer Learning for QA using Translation as Data
      Augmentation",2021,AAAI,the Association for the Advancement of Artificial Intelligence
"Learning to Rationalize for Nonmonotonic Reasoning with Distant
      Supervision",2021,AAAI,the Association for the Advancement of Artificial Intelligence
Brain Decoding Using fNIRS,2021,AAAI,the Association for the Advancement of Artificial Intelligence
"Extracting Zero-shot Structured Information from Form-like Documents:
      Pretraining with Keys and Triggers",2021,AAAI,the Association for the Advancement of Artificial Intelligence
Simple or Complex? Learning to Predict Readability of Bengali Texts,2021,AAAI,the Association for the Advancement of Artificial Intelligence
"Lexically Constrained Neural Machine Translation with Explicit Alignment
      Guidance",2021,AAAI,the Association for the Advancement of Artificial Intelligence
"Aspect-Level Sentiment-Controllable Review Generation with Mutual Learning
      Framework",2021,AAAI,the Association for the Advancement of Artificial Intelligence
"Weakly-Supervised Hierarchical Models for Predicting Persuasive Strategies
      in Good-faith Textual Requests",2021,AAAI,the Association for the Advancement of Artificial Intelligence
A Lightweight Neural Model for Biomedical Entity Linking,2021,AAAI,the Association for the Advancement of Artificial Intelligence
"Bidirectional Machine Reading Comprehension for Aspect Sentiment Triplet
      Extraction",2021,AAAI,the Association for the Advancement of Artificial Intelligence
"Empower Distantly Supervised Relation Extraction with Collaborative
      Adversarial Training",2021,AAAI,the Association for the Advancement of Artificial Intelligence
"Reasoning in Dialog: Improving Response Generation by Context Reading
      Comprehension",2021,AAAI,the Association for the Advancement of Artificial Intelligence
Meta-Transfer Learning for Low-Resource Abstractive Summarization,2021,AAAI,the Association for the Advancement of Artificial Intelligence
"Adaptive Prior-Dependent Correction Enhanced Reinforcement Learning for
      Natural Language Generation",2021,AAAI,the Association for the Advancement of Artificial Intelligence
How Linguistically Fair Are Multilingual Pre-Trained Language Models?,2021,AAAI,the Association for the Advancement of Artificial Intelligence
DirectQE: Direct Pretraining for Machine Translation Quality Estimation,2021,AAAI,the Association for the Advancement of Artificial Intelligence
"We Can Explain Your Research in Layman's Terms: Towards Automating
      Science Journalism at Scale",2021,AAAI,the Association for the Advancement of Artificial Intelligence
Consecutive Decoding for Speech-to-text Translation,2021,AAAI,the Association for the Advancement of Artificial Intelligence
"Listen, Understand and Translate: Triple Supervision Decouples End-to-end
      Speech-to-text Translation",2021,AAAI,the Association for the Advancement of Artificial Intelligence
MultiTalk: A Highly-Branching Dialog Testbed for Diverse Conversations,2021,AAAI,the Association for the Advancement of Artificial Intelligence
"Knowledge-aware Leap-LSTM: Integrating Prior Knowledge into Leap-LSTM
      towards Faster Long Text Classification",2021,AAAI,the Association for the Advancement of Artificial Intelligence
FILTER: An Enhanced Fusion Method for Cross-lingual Language Understanding,2021,AAAI,the Association for the Advancement of Artificial Intelligence
"Rethinking Boundaries: End-To-End Recognition of Discontinuous Mentions
      with Pointer Networks",2021,AAAI,the Association for the Advancement of Artificial Intelligence
"Encoder-Decoder Based Unified Semantic Role Labeling with Label-Aware
      Syntax",2021,AAAI,the Association for the Advancement of Artificial Intelligence
End-to-end Semantic Role Labeling with Neural Transition-based Model,2021,AAAI,the Association for the Advancement of Artificial Intelligence
"Multi-View Feature Representation for Dialogue Generation with
      Bidirectional Distillation",2021,AAAI,the Association for the Advancement of Artificial Intelligence
"More the Merrier: Towards Multi-Emotion and Intensity Controllable
      Response Generation",2021,AAAI,the Association for the Advancement of Artificial Intelligence
"LRC-BERT: Latent-representation Contrastive Knowledge Distillation for
      Natural Language Understanding",2021,AAAI,the Association for the Advancement of Artificial Intelligence
Nested Named Entity Recognition with Partially-Observed TreeCRFs,2021,AAAI,the Association for the Advancement of Artificial Intelligence
A Theoretical Analysis of the Repetition Problem in Text Generation,2021,AAAI,the Association for the Advancement of Artificial Intelligence
Paragraph-level Commonsense Transformers with Recurrent Memory,2021,AAAI,the Association for the Advancement of Artificial Intelligence
Judgment Prediction via Injecting Legal Knowledge into Neural Networks,2021,AAAI,the Association for the Advancement of Artificial Intelligence
Question-Driven Span Labeling Model for AspectOpinion Pair Extraction,2021,AAAI,the Association for the Advancement of Artificial Intelligence
Analogy Training Multilingual Encoders,2021,AAAI,the Association for the Advancement of Artificial Intelligence
"Fake it Till You Make it: Self-Supervised Semantic Shifts for Monolingual
      Word Embedding Tasks",2021,AAAI,the Association for the Advancement of Artificial Intelligence
"Perception Score: A Learned Metric for Open-ended Text Generation
      Evaluation",2021,AAAI,the Association for the Advancement of Artificial Intelligence
"DialogBERT: Discourse-Aware Response Generation via Learning to Recover
      and Rank Utterances",2021,AAAI,the Association for the Advancement of Artificial Intelligence
"Read, Retrospect, Select: An MRC Framework to Short Text Entity Linking",2021,AAAI,the Association for the Advancement of Artificial Intelligence
Label Confusion Learning to Enhance Text Classification Models,2021,AAAI,the Association for the Advancement of Artificial Intelligence
Iterative Utterance Segmentation for Neural Semantic Parsing,2021,AAAI,the Association for the Advancement of Artificial Intelligence
BERT & Family Eat Word Salad: Experiments with Text Understanding,2021,AAAI,the Association for the Advancement of Artificial Intelligence
Sketch and Customize: A Counterfactual Story Generator,2021,AAAI,the Association for the Advancement of Artificial Intelligence
"Self-Attention Attribution: Interpreting Information Interactions Inside
      Transformer",2021,AAAI,the Association for the Advancement of Artificial Intelligence
Humor Knowledge Enriched Transformer for Understanding Multimodal Humor,2021,AAAI,the Association for the Advancement of Artificial Intelligence
"Synchronous Interactive Decoding for Multilingual Neural Machine
      Translation",2021,AAAI,the Association for the Advancement of Artificial Intelligence
"Show Me How To Revise: Improving Lexically Constrained Sentence Generation
      with XLNet",2021,AAAI,the Association for the Advancement of Artificial Intelligence
Towards Fully Automated Manga Translation,2021,AAAI,the Association for the Advancement of Artificial Intelligence
SMART: A Situation Model for Algebra Story Problems via Attributed Grammar,2021,AAAI,the Association for the Advancement of Artificial Intelligence
It Takes Two to Empathize: One to Seek and One to Provide,2021,AAAI,the Association for the Advancement of Artificial Intelligence
"C2C-GenDA: Cluster-to-Cluster Generation for Data Augmentation of Slot
      Filling",2021,AAAI,the Association for the Advancement of Artificial Intelligence
Few-shot Learning for Multi-label Intent Detection,2021,AAAI,the Association for the Advancement of Artificial Intelligence
"HARGAN: Heterogeneous Argument Attention Network for Persuasiveness
      Prediction",2021,AAAI,the Association for the Advancement of Artificial Intelligence
"SARG: A Novel Semi Autoregressive Generator for Multi-turn Incomplete
      Utterance Restoration",2021,AAAI,the Association for the Advancement of Artificial Intelligence
"Entity Guided Question Generation with Contextual Structure and Sequence
      Information Capturing",2021,AAAI,the Association for the Advancement of Artificial Intelligence
"Story Ending Generation with Multi-Level Graph Convolutional Networks over
      Dependency Trees",2021,AAAI,the Association for the Advancement of Artificial Intelligence
Adaptive Beam Search Decoding for Discrete Keyphrase Generation,2021,AAAI,the Association for the Advancement of Artificial Intelligence
Distribution Matching for Rationalization,2021,AAAI,the Association for the Advancement of Artificial Intelligence
"Audio-Oriented Multimodal Machine Comprehension via Dynamic Inter- and
      Intra-modality Attention",2021,AAAI,the Association for the Advancement of Artificial Intelligence
Unsupervised Learning of Discourse Structures using a Tree Autoencoder,2021,AAAI,the Association for the Advancement of Artificial Intelligence
"Dynamic Hybrid Relation Exploration Network for Cross-Domain
      Context-Dependent Semantic Parsing",2021,AAAI,the Association for the Advancement of Artificial Intelligence
"DDRel: A New Dataset for Interpersonal Relation Classification in Dyadic
      Dialogues",2021,AAAI,the Association for the Advancement of Artificial Intelligence
"Flexible Non-Autoregressive Extractive Summarization with Threshold: How
      to Extract a Non-Fixed Number of Summary Sentences",2021,AAAI,the Association for the Advancement of Artificial Intelligence
EQG-RACE: Examination-Type Question Generation,2021,AAAI,the Association for the Advancement of Artificial Intelligence
Hierarchical Macro Discourse Parsing Based on Topic Segmentation,2021,AAAI,the Association for the Advancement of Artificial Intelligence
FIXMYPOSE: Pose Correctional Captioning and Retrieval,2021,AAAI,the Association for the Advancement of Artificial Intelligence
"Self-supervised Pre-training and Contrastive Representation Learning for
      Multiple-choice Video QA",2021,AAAI,the Association for the Advancement of Artificial Intelligence
"The Gap on Gap: Tackling the Problem of Differing Data Distributions in
      Bias-Measuring Datasets",2021,AAAI,the Association for the Advancement of Artificial Intelligence
"SALNet: Semi-supervised Few-Shot Text Classification with Attention-based
      Lexicon Construction",2021,AAAI,the Association for the Advancement of Artificial Intelligence
"Multi-SpectroGAN: High-Diversity and High-Fidelity Spectrogram Generation
      with Adversarial Style Combination for Speech Synthesis",2021,AAAI,the Association for the Advancement of Artificial Intelligence
"Have We Solved The Hard Problem? Its Not Easy! Contextual Lexical
      Contrast as a Means to Probe Neural Coherence",2021,AAAI,the Association for the Advancement of Artificial Intelligence
Learning Light-Weight Translation Models from Deep Transformer,2021,AAAI,the Association for the Advancement of Artificial Intelligence
"Improving the Efficiency and Effectiveness for BERT-based Entity
      Resolution",2021,AAAI,the Association for the Advancement of Artificial Intelligence
Multi-view Inference for Relation Extraction with Uncertain Knowledge,2021,AAAI,the Association for the Advancement of Artificial Intelligence
"Towards Topic-Aware Slide Generation For Academic Papers With Unsupervised
      Mutual Learning",2021,AAAI,the Association for the Advancement of Artificial Intelligence
"The Style-Content Duality of Attractiveness: Learning to Write
      Eye-Catching Headlines via Disentanglement",2021,AAAI,the Association for the Advancement of Artificial Intelligence
"ACT: an Attentive Convolutional Transformer for Efficient Text
      Classification",2021,AAAI,the Association for the Advancement of Artificial Intelligence
Quantum-inspired Neural Network for Conversational Emotion Recognition,2021,AAAI,the Association for the Advancement of Artificial Intelligence
HopRetriever: Retrieve Hops over Wikipedia to Answer Complex Questions,2021,AAAI,the Association for the Advancement of Artificial Intelligence
"Merging Statistical Feature via Adaptive Gate for Improved Text
      Classification",2021,AAAI,the Association for the Advancement of Artificial Intelligence
TSQA: Tabular Scenario Based Question Answering,2021,AAAI,the Association for the Advancement of Artificial Intelligence
"Interpretable NLG for Task-oriented Dialogue Systems with Heterogeneous
      Rendering Machines",2021,AAAI,the Association for the Advancement of Artificial Intelligence
An Efficient Transformer Decoder with Compressed Sub-layers,2021,AAAI,the Association for the Advancement of Artificial Intelligence
"An Unsupervised Sampling Approach for Image-Sentence Matching Using
      Document-level Structural Information",2021,AAAI,the Association for the Advancement of Artificial Intelligence
Finding Sparse Structures for Domain Specific Neural Machine Translation,2021,AAAI,the Association for the Advancement of Artificial Intelligence
"Infusing Multi-Source Knowledge with Heterogeneous Graph Neural Network
      for Emotional Conversation Generation",2021,AAAI,the Association for the Advancement of Artificial Intelligence
Hierarchical Coherence Modeling for Document Quality Assessment,2021,AAAI,the Association for the Advancement of Artificial Intelligence
Graph-Evolving Meta-Learning for Low-Resource Medical Dialogue Generation,2021,AAAI,the Association for the Advancement of Artificial Intelligence
Neural Sentence Simplification with Semantic Dependency Information,2021,AAAI,the Association for the Advancement of Artificial Intelligence
"Converse, Focus and Guess - Towards Multi-Document Driven Dialogue",2021,AAAI,the Association for the Advancement of Artificial Intelligence
"Natural Language Inference in Context - Investigating Contextual Reasoning
      over Long Texts",2021,AAAI,the Association for the Advancement of Artificial Intelligence
How to Train Your Agent to Read and Write,2021,AAAI,the Association for the Advancement of Artificial Intelligence
"Filling the Gap of Utterance-aware and Speaker-aware Representation for
      Multi-turn Dialogue",2021,AAAI,the Association for the Advancement of Artificial Intelligence
"Towards Faithfulness in Open Domain Table-to-text Generation from an
      Entity-centric View",2021,AAAI,the Association for the Advancement of Artificial Intelligence
Faster Depth-Adaptive Transformers,2021,AAAI,the Association for the Advancement of Artificial Intelligence
"A Graph Reasoning Network for Multi-turn Response Selection via Customized
      Pre-training",2021,AAAI,the Association for the Advancement of Artificial Intelligence
Generating CCG Categories,2021,AAAI,the Association for the Advancement of Artificial Intelligence
CrossNER: Evaluating Cross-Domain Named Entity Recognition,2021,AAAI,the Association for the Advancement of Artificial Intelligence
"On the Importance of Word Order Information in Cross-lingual Sequence
      Labeling",2021,AAAI,the Association for the Advancement of Artificial Intelligence
"SCRUPLES: A Corpus of Community Ethical Judgments on 32,000 Real-Life
      Anecdotes",2021,AAAI,the Association for the Advancement of Artificial Intelligence
"UNICORN on RAINBOW: A Universal Commonsense Reasoning Model on a New
      Multitask Benchmark",2021,AAAI,the Association for the Advancement of Artificial Intelligence
Span-Based Event Coreference Resolution,2021,AAAI,the Association for the Advancement of Artificial Intelligence
"LET: Linguistic Knowledge Enhanced Graph Transformer for Chinese Short
      Text Matching",2021,AAAI,the Association for the Advancement of Artificial Intelligence
"Knowledge-driven Data Construction for Zero-shot Evaluation in Commonsense
      Question Answering",2021,AAAI,the Association for the Advancement of Artificial Intelligence
"Generate Your Counterfactuals: Towards Controlled Counterfactual
      Generation for Text",2021,AAAI,the Association for the Advancement of Artificial Intelligence
Generating Natural Language Attacks in a Hard Label Black Box Setting,2021,AAAI,the Association for the Advancement of Artificial Intelligence
"Bridging Towers of Multi-task Learning with a Gating Mechanism for
      Aspect-based Sentiment Analysis and Sequential Metaphor Identification",2021,AAAI,the Association for the Advancement of Artificial Intelligence
A Joint Training Dual-MRC Framework for Aspect Based Sentiment Analysis,2021,AAAI,the Association for the Advancement of Artificial Intelligence
"Variational Inference for Learning Representations of Natural Language
      Edits",2021,AAAI,the Association for the Advancement of Artificial Intelligence
"How Robust are Model Rankings : A Leaderboard Customization Approach for
      Equitable Evaluation",2021,AAAI,the Association for the Advancement of Artificial Intelligence
Continual Learning for Named Entity Recognition,2021,AAAI,the Association for the Advancement of Artificial Intelligence
MASKER: Masked Keyword Regularization for Reliable Text Classification,2021,AAAI,the Association for the Advancement of Artificial Intelligence
Disentangled Motif-aware Graph Learning for Phrase Grounding,2021,AAAI,the Association for the Advancement of Artificial Intelligence
Knowledge-aware Named Entity Recognition with Alleviating Heterogeneity,2021,AAAI,the Association for the Advancement of Artificial Intelligence
Dialog Policy Learning for Joint Clarification and Active Learning Queries,2021,AAAI,the Association for the Advancement of Artificial Intelligence
"The Heads Hypothesis: A Unifying Statistical Approach Towards
      Understanding Multi-Headed Attention in BERT",2021,AAAI,the Association for the Advancement of Artificial Intelligence
Copy That! Editing Sequences by Copying Spans,2021,AAAI,the Association for the Advancement of Artificial Intelligence
Movie Summarization via Sparse Graph Construction,2021,AAAI,the Association for the Advancement of Artificial Intelligence
On the Softmax Bottleneck of Recurrent Language Models,2021,AAAI,the Association for the Advancement of Artificial Intelligence
"XL-WSD: An Extra-Large and Cross-Lingual Evaluation Framework for Word
      Sense Disambiguation",2021,AAAI,the Association for the Advancement of Artificial Intelligence
ALP-KD: Attention-Based Layer Projection for Knowledge Distillation,2021,AAAI,the Association for the Advancement of Artificial Intelligence
"Data Augmentation for Abstractive Query-Focused Multi-Document
      Summarization",2021,AAAI,the Association for the Advancement of Artificial Intelligence
"Revisiting Mahalanobis Distance for Transformer-Based Out-of-Domain
      Detection",2021,AAAI,the Association for the Advancement of Artificial Intelligence
Conceptualized and Contextualized Gaussian Embedding,2021,AAAI,the Association for the Advancement of Artificial Intelligence
"A Student-Teacher Architecture for Dialog Domain Adaptation Under the
      Meta-Learning Setting",2021,AAAI,the Association for the Advancement of Artificial Intelligence
"Exploring Auxiliary Reasoning Tasks for Task-oriented Dialog Systems with
      Meta Cooperative Learning",2021,AAAI,the Association for the Advancement of Artificial Intelligence
"Co-GAT: A Co-Interactive Graph Attention Network for Joint Dialog Act
      Recognition and Sentiment Classification",2021,AAAI,the Association for the Advancement of Artificial Intelligence
Reinforced History Backtracking for Conversational Question Answering,2021,AAAI,the Association for the Advancement of Artificial Intelligence
"Guiding Non-Autoregressive Neural Machine Translation Decoding with
      Reordering Information",2021,AAAI,the Association for the Advancement of Artificial Intelligence
"Towards Semantics-Enhanced Pre-Training: Can Lexicon Definitions Help
      Learning Sentence Meanings?",2021,AAAI,the Association for the Advancement of Artificial Intelligence
Automated Cross-prompt Scoring of Essay Traits,2021,AAAI,the Association for the Advancement of Artificial Intelligence
Exploring Transfer Learning For End-to-End Spoken Language Understanding,2021,AAAI,the Association for the Advancement of Artificial Intelligence
"Semantics Altering Modifications for Evaluating Comprehension in Machine
      Reading",2021,AAAI,the Association for the Advancement of Artificial Intelligence
"Learning from the Best: Rationalizing Predictions by Adversarial
      Information Calibration",2021,AAAI,the Association for the Advancement of Artificial Intelligence
Nutri-bullets: Summarizing Health Studies by Composing Segments,2021,AAAI,the Association for the Advancement of Artificial Intelligence
"DialogXL: All-in-One XLNet for Multi-Party Conversation Emotion
      Recognition",2021,AAAI,the Association for the Advancement of Artificial Intelligence
"SongMASS: Automatic Song Writing with Pre-training and Alignment
      Constraint",2021,AAAI,the Association for the Advancement of Artificial Intelligence
"Learning Contextual Representations for Semantic Parsing with
      Generation-Augmented Pre-Training",2021,AAAI,the Association for the Advancement of Artificial Intelligence
"A Simple and Effective Self-Supervised Contrastive Learning Framework for
      Aspect Detection",2021,AAAI,the Association for the Advancement of Artificial Intelligence
Fact-Enhanced Synthetic News Generation,2021,AAAI,the Association for the Advancement of Artificial Intelligence
"Improving Commonsense Causal Reasoning by Adversarial Training and Data
      Augmentation",2021,AAAI,the Association for the Advancement of Artificial Intelligence
Re-TACRED: Addressing Shortcomings of the TACRED Dataset,2021,AAAI,the Association for the Advancement of Artificial Intelligence
"Progressive Multi-task Learning with Controlled Information Flow for Joint
      Entity and Relation Extraction",2021,AAAI,the Association for the Advancement of Artificial Intelligence
"RpBERT: A Text-image Relation Propagation-based BERT Model for Multimodal
      NER",2021,AAAI,the Association for the Advancement of Artificial Intelligence
"Unsupervised Learning of Deterministic Dialogue Structure with
      Edge-Enhanced Graph Auto-Encoder",2021,AAAI,the Association for the Advancement of Artificial Intelligence
VisualMRC: Machine Reading Comprehension on Document Images,2021,AAAI,the Association for the Advancement of Artificial Intelligence
A Bidirectional Multi-paragraph Reading Model for Zero-shot Entity Linking,2021,AAAI,the Association for the Advancement of Artificial Intelligence
