title,year,conf,conf_long
Least General Generalizations in Description Logic: Verification and Existence,2020,AAAI,the Association for the Advancement of Artificial Intelligence
Complexity and Expressive Power of Disjunction and Negation in Limit Datalog,2020,AAAI,the Association for the Advancement of Artificial Intelligence
Logics for Sizes with Union or Intersection,2020,AAAI,the Association for the Advancement of Artificial Intelligence
FastLAS: Scalable Inductive Logic Programming Incorporating Domain-Specific Optimisation Criteria,2020,AAAI,the Association for the Advancement of Artificial Intelligence
Automatic Verification of Liveness Properties in the Situation Calculus,2020,AAAI,the Association for the Advancement of Artificial Intelligence
Path Ranking with Attention to Type Hierarchies,2020,AAAI,the Association for the Advancement of Artificial Intelligence
K-BERT: Enabling Language Representation with Knowledge Graph,2020,AAAI,the Association for the Advancement of Artificial Intelligence
Explanations for Inconsistency-Tolerant Query Answering under Existential Rules,2020,AAAI,the Association for the Advancement of Artificial Intelligence
Resilient Logic Programs: Answer Set Programs Challenged by Ontologies,2020,AAAI,the Association for the Advancement of Artificial Intelligence
Commonsense Knowledge Base Completion with Structural and Semantic Context,2020,AAAI,the Association for the Advancement of Artificial Intelligence
Blameworthiness in Security Games,2020,AAAI,the Association for the Advancement of Artificial Intelligence
Deciding Acceptance in Incomplete Argumentation Frameworks,2020,AAAI,the Association for the Advancement of Artificial Intelligence
Rule-Guided Compositional Representation Learning on Knowledge Graphs,2020,AAAI,the Association for the Advancement of Artificial Intelligence
Learning Query Inseparable εℒℋ Ontologies,2020,AAAI,the Association for the Advancement of Artificial Intelligence
Graph Representations for Higher-Order Logic and Theorem Proving,2020,AAAI,the Association for the Advancement of Artificial Intelligence
Relatedness and TBox-Driven Rule Learning in Large Knowledge Bases,2020,AAAI,the Association for the Advancement of Artificial Intelligence
A Framework for Measuring Information Asymmetry,2020,AAAI,the Association for the Advancement of Artificial Intelligence
Adversarial Deep Network Embedding for Cross-Network Node Classification,2020,AAAI,the Association for the Advancement of Artificial Intelligence
Contextual Parameter Generation for Knowledge Graph Link Prediction,2020,AAAI,the Association for the Advancement of Artificial Intelligence
InteractE: Improving Convolution-Based Knowledge Graph Embeddings by Increasing Feature Interactions,2020,AAAI,the Association for the Advancement of Artificial Intelligence
Query Answering with Guarded Existential Rules under Stable Model Semantics,2020,AAAI,the Association for the Advancement of Artificial Intelligence
COTSAE: CO-Training of Structure and Attribute Embeddings for Entity Alignment,2020,AAAI,the Association for the Advancement of Artificial Intelligence
Ranking-Based Semantics for Sets of Attacking Arguments,2020,AAAI,the Association for the Advancement of Artificial Intelligence
Few-Shot Knowledge Graph Completion,2020,AAAI,the Association for the Advancement of Artificial Intelligence
Towards Universal Languages for Tractable Ontology Mediated Query Answering,2020,AAAI,the Association for the Advancement of Artificial Intelligence
On the Expressivity of ASK Queries in SPARQL,2020,AAAI,the Association for the Advancement of Artificial Intelligence
Learning Hierarchy-Aware Knowledge Graph Embeddings for Link Prediction,2020,AAAI,the Association for the Advancement of Artificial Intelligence
A Practical Approach to Forgetting in Description Logics with Nominals,2020,AAAI,the Association for the Advancement of Artificial Intelligence
Deciding the Loosely Guarded Fragment and Querying Its Horn Fragment Using Resolution,2020,AAAI,the Association for the Advancement of Artificial Intelligence
LTLƒ Synthesis with Fairness and Stability Assumptions,2020,AAAI,the Association for the Advancement of Artificial Intelligence
Learning to Reason: Leveraging Neural Networks for Approximate DNF Counting,2020,AAAI,the Association for the Advancement of Artificial Intelligence
Quantized Compressive Sampling of Stochastic Gradients for Efficient Communication in Distributed Deep Learning,2020,AAAI,the Association for the Advancement of Artificial Intelligence
Indirect Stochastic Gradient Quantization and Its Application in Distributed Deep Learning,2020,AAAI,the Association for the Advancement of Artificial Intelligence
Image-Adaptive GAN Based Reconstruction,2020,AAAI,the Association for the Advancement of Artificial Intelligence
DeGAN: Data-Enriching GAN for Retrieving Representative Samples from a Trained Classifier,2020,AAAI,the Association for the Advancement of Artificial Intelligence
Bounds and Complexity Results for Learning Coalition-Based Interaction Functions in Networked Social Systems,2020,AAAI,the Association for the Advancement of Artificial Intelligence
Learning Optimal Decision Trees Using Caching Branch-and-Bound Search,2020,AAAI,the Association for the Advancement of Artificial Intelligence
Detecting Semantic Anomalies,2020,AAAI,the Association for the Advancement of Artificial Intelligence
Exact and Efficient Inference for Collective Flow Diffusion Model via Minimum Convex Cost Flow Algorithm,2020,AAAI,the Association for the Advancement of Artificial Intelligence
Pursuit of Low-Rank Models of Time-Varying Matrices Robust to Sparse and Measurement Noise,2020,AAAI,the Association for the Advancement of Artificial Intelligence
An Implicit Form of Krasulina's k-PCA Update without the Orthonormality Constraint,2020,AAAI,the Association for the Advancement of Artificial Intelligence
Kriging Convolutional Networks,2020,AAAI,the Association for the Advancement of Artificial Intelligence
Efficient Inference of Optimal Decision Trees,2020,AAAI,the Association for the Advancement of Artificial Intelligence
Few Shot Network Compression via Cross Distillation,2020,AAAI,the Association for the Advancement of Artificial Intelligence
A Three-Level Optimization Model for Nonlinearly Separable Clustering,2020,AAAI,the Association for the Advancement of Artificial Intelligence
Learning-Based Efficient Graph Similarity Computation via Multi-Scale Convolutional Set Matching,2020,AAAI,the Association for the Advancement of Artificial Intelligence
Learning to Optimize Computational Resources: Frugal Training with Generalization Guarantees,2020,AAAI,the Association for the Advancement of Artificial Intelligence
Scalable Attentive Sentence Pair Modeling via Distilled Sentence Embedding,2020,AAAI,the Association for the Advancement of Artificial Intelligence
Midas: Microcluster-Based Detector of Anomalies in Edge Streams,2020,AAAI,the Association for the Advancement of Artificial Intelligence
Exploratory Combinatorial Optimization with Reinforcement Learning,2020,AAAI,the Association for the Advancement of Artificial Intelligence
Event-Driven Continuous Time Bayesian Networks,2020,AAAI,the Association for the Advancement of Artificial Intelligence
An Efficient Evolutionary Algorithm for Subset Selection with General Cost Constraints,2020,AAAI,the Association for the Advancement of Artificial Intelligence
A Stochastic Derivative-Free Optimization Method with Importance Sampling: Theory and Learning to Control,2020,AAAI,the Association for the Advancement of Artificial Intelligence
Proximal Distilled Evolutionary Reinforcement Learning,2020,AAAI,the Association for the Advancement of Artificial Intelligence
Efficient Verification of ReLU-Based Neural Networks via Dependency Analysis,2020,AAAI,the Association for the Advancement of Artificial Intelligence
Information-Theoretic Understanding of Population Risk Improvement with Model Compression,2020,AAAI,the Association for the Advancement of Artificial Intelligence
A Multi-Scale Approach for Graph Link Prediction,2020,AAAI,the Association for the Advancement of Artificial Intelligence
Deterministic Value-Policy Gradients,2020,AAAI,the Association for the Advancement of Artificial Intelligence
Predicting Propositional Satisfiability via End-to-End Learning,2020,AAAI,the Association for the Advancement of Artificial Intelligence
Active Ordinal Querying for Tuplewise Similarity Learning,2020,AAAI,the Association for the Advancement of Artificial Intelligence
Fatigue-Aware Bandits for Dependent Click Models,2020,AAAI,the Association for the Advancement of Artificial Intelligence
Generalization Error Bounds of Gradient Descent for Learning Over-Parameterized Deep ReLU Networks,2020,AAAI,the Association for the Advancement of Artificial Intelligence
Exponential Family Graph Embeddings,2020,AAAI,the Association for the Advancement of Artificial Intelligence
Asking the Right Questions to the Right Users: Active Learning with Imperfect Oracles,2020,AAAI,the Association for the Advancement of Artificial Intelligence
Lifelong Learning with a Changing Action Set,2020,AAAI,the Association for the Advancement of Artificial Intelligence
Reinforcement Learning When All Actions Are Not Always Available,2020,AAAI,the Association for the Advancement of Artificial Intelligence
A Restricted Black-Box Adversarial Framework Towards Attacking Graph Embedding Models,2020,AAAI,the Association for the Advancement of Artificial Intelligence
Robust Data Programming with Precision-guided Labeling Functions,2020,AAAI,the Association for the Advancement of Artificial Intelligence
A New Ensemble Adversarial Attack Powered by Long-Term Gradient Memories,2020,AAAI,the Association for the Advancement of Artificial Intelligence
Toward A Thousand Lights: Decentralized Deep Reinforcement Learning for Large-Scale Traffic Signal Control,2020,AAAI,the Association for the Advancement of Artificial Intelligence
HoMM: Higher-Order Moment Matching for Unsupervised Domain Adaptation,2020,AAAI,the Association for the Advancement of Artificial Intelligence
Online Knowledge Distillation with Diverse Peers,2020,AAAI,the Association for the Advancement of Artificial Intelligence
Measuring and Relieving the Over-Smoothing Problem for Graph Neural Networks from the Topological View,2020,AAAI,the Association for the Advancement of Artificial Intelligence
ECGadv: Generating Adversarial Electrocardiogram to Misguide Arrhythmia Classification System,2020,AAAI,the Association for the Advancement of Artificial Intelligence
LS-Tree: Model Interpretation When the Data Are Linguistic,2020,AAAI,the Association for the Advancement of Artificial Intelligence
Generative Adversarial Networks for Video-to-Video Domain Adaptation,2020,AAAI,the Association for the Advancement of Artificial Intelligence
Fast Adaptively Weighted Matrix Factorization for Recommendation with Implicit Feedback,2020,AAAI,the Association for the Advancement of Artificial Intelligence
Variational Metric Scaling for Metric-Based Meta-Learning,2020,AAAI,the Association for the Advancement of Artificial Intelligence
A Frank-Wolfe Framework for Efficient and Effective Adversarial Attacks,2020,AAAI,the Association for the Advancement of Artificial Intelligence
Weakly Supervised Disentanglement by Pairwise Similarities,2020,AAAI,the Association for the Advancement of Artificial Intelligence
Outlier Detection Ensemble with Embedded Feature Selection,2020,AAAI,the Association for the Advancement of Artificial Intelligence
Multi-View Clustering in Latent Embedding Space,2020,AAAI,the Association for the Advancement of Artificial Intelligence
Adversarial-Learned Loss for Domain Adaptation,2020,AAAI,the Association for the Advancement of Artificial Intelligence
Multi-Range Attentive Bicomponent Graph Convolutional Network for Traffic Forecasting,2020,AAAI,the Association for the Advancement of Artificial Intelligence
AutoDAL: Distributed Active Learning with Automatic Hyperparameter Selection,2020,AAAI,the Association for the Advancement of Artificial Intelligence
Optimal Attack against Autoregressive Models by Manipulating the Environment,2020,AAAI,the Association for the Advancement of Artificial Intelligence
Multi-View Partial Multi-Label Learning with Graph-Based Disambiguation,2020,AAAI,the Association for the Advancement of Artificial Intelligence
Compressed Self-Attention for Deep Metric Learning,2020,AAAI,the Association for the Advancement of Artificial Intelligence
Semi-Supervised Learning under Class Distribution Mismatch,2020,AAAI,the Association for the Advancement of Artificial Intelligence
InstaNAS: Instance-Aware Neural Architecture Search,2020,AAAI,the Association for the Advancement of Artificial Intelligence
Distilling Portable Generative Adversarial Networks for Image Translation,2020,AAAI,the Association for the Advancement of Artificial Intelligence
Towards Better Forecasting by Fusing Near and Distant Future Visions,2020,AAAI,the Association for the Advancement of Artificial Intelligence
Seq2Sick: Evaluating the Robustness of Sequence-to-Sequence Models with Adversarial Examples,2020,AAAI,the Association for the Advancement of Artificial Intelligence
Adaptive Factorization Network: Learning Adaptive-Order Feature Interactions,2020,AAAI,the Association for the Advancement of Artificial Intelligence
Time2Graph: Revisiting Time Series Modeling with Dynamic Shapelets,2020,AAAI,the Association for the Advancement of Artificial Intelligence
Suspicion-Free Adversarial Attacks on Clustering Algorithms,2020,AAAI,the Association for the Advancement of Artificial Intelligence
A General Approach to Fairness with Optimal Transport,2020,AAAI,the Association for the Advancement of Artificial Intelligence
Active Learning in the Geometric Block Model,2020,AAAI,the Association for the Advancement of Artificial Intelligence
Deep Mixed Effect Model Using Gaussian Processes: A Personalized and Reliable Prediction for Healthcare,2020,AAAI,the Association for the Advancement of Artificial Intelligence
A Constraint-Based Approach to Learning and Explanation,2020,AAAI,the Association for the Advancement of Artificial Intelligence
Representing Closed Transformation Paths in Encoded Network Latent Space,2020,AAAI,the Association for the Advancement of Artificial Intelligence
Forgetting to Learn Logic Programs,2020,AAAI,the Association for the Advancement of Artificial Intelligence
Exploiting Spatial Invariance for Scalable Unsupervised Object Tracking,2020,AAAI,the Association for the Advancement of Artificial Intelligence
Label Error Correction and Generation through Label Relationships,2020,AAAI,the Association for the Advancement of Artificial Intelligence
A Tale of Two-Timescale Reinforcement Learning with the Tightest Finite-Time Bound,2020,AAAI,the Association for the Advancement of Artificial Intelligence
Explainable Data Decompositions,2020,AAAI,the Association for the Advancement of Artificial Intelligence
A Skip-Connected Evolving Recurrent Neural Network for Data Stream Classification under Label Latency Scenario,2020,AAAI,the Association for the Advancement of Artificial Intelligence
DNNs as Layers of Cooperating Classifiers,2020,AAAI,the Association for the Advancement of Artificial Intelligence
"Making Existing Clusterings Fairer: Algorithms, Complexity Results and Insights",2020,AAAI,the Association for the Advancement of Artificial Intelligence
Fixed-Horizon Temporal Difference Methods for Stable Reinforcement Learning,2020,AAAI,the Association for the Advancement of Artificial Intelligence
Capsule Routing via Variational Bayes,2020,AAAI,the Association for the Advancement of Artificial Intelligence
System Identification with Time-Aware Neural Sequence Models,2020,AAAI,the Association for the Advancement of Artificial Intelligence
Reinforcing Neural Network Stability with Attractor Dynamics,2020,AAAI,the Association for the Advancement of Artificial Intelligence
Optimizing Discrete Spaces via Expensive Evaluations: A Learning to Search Framework,2020,AAAI,the Association for the Advancement of Artificial Intelligence
Integrating Overlapping Datasets Using Bivariate Causal Discovery,2020,AAAI,the Association for the Advancement of Artificial Intelligence
Improving the Robustness of Wasserstein Embedding by Adversarial PAC-Bayesian Learning,2020,AAAI,the Association for the Advancement of Artificial Intelligence
Gradient-Aware Model-Based Policy Search,2020,AAAI,the Association for the Advancement of Artificial Intelligence
Fairness in Network Representation by Latent Structural Heterogeneity in Observational Data,2020,AAAI,the Association for the Advancement of Artificial Intelligence
On the Discrepancy between the Theoretical Analysis and Practical Implementations of Compressed Communication for Distributed Deep Learning,2020,AAAI,the Association for the Advancement of Artificial Intelligence
An Information-Theoretic Quantification of Discrimination with Exempt Features,2020,AAAI,the Association for the Advancement of Artificial Intelligence
Unsupervised Metric Learning with Synthetic Examples,2020,AAAI,the Association for the Advancement of Artificial Intelligence
Polynomial Matrix Completion for Missing Data Imputation and Transductive Learning,2020,AAAI,the Association for the Advancement of Artificial Intelligence
Distributionally Robust Counterfactual Risk Minimization,2020,AAAI,the Association for the Advancement of Artificial Intelligence
Regularized Training and Tight Certification for Randomized Smoothed Classifier with Provable Robustness,2020,AAAI,the Association for the Advancement of Artificial Intelligence
Privacy-Preserving Gaussian Process Regression – A Modular Approach to the Application of Homomorphic Encryption,2020,AAAI,the Association for the Advancement of Artificial Intelligence
Learning Triple Embeddings from Knowledge Graphs,2020,AAAI,the Association for the Advancement of Artificial Intelligence
Training Decision Trees as Replacement for Convolution Layers,2020,AAAI,the Association for the Advancement of Artificial Intelligence
Induction of Subgoal Automata for Reinforcement Learning,2020,AAAI,the Association for the Advancement of Artificial Intelligence
Fast and Deep Graph Neural Networks,2020,AAAI,the Association for the Advancement of Artificial Intelligence
On the Parameterized Complexity of Clustering Incomplete Data into Subspaces of Small Rank,2020,AAAI,the Association for the Advancement of Artificial Intelligence
Adaptive Convolutional ReLUs,2020,AAAI,the Association for the Advancement of Artificial Intelligence
Infinity Learning: Learning Markov Chains from Aggregate Steady-State Observations,2020,AAAI,the Association for the Advancement of Artificial Intelligence
Tensor-SVD Based Graph Learning for Multi-View Subspace Clustering,2020,AAAI,the Association for the Advancement of Artificial Intelligence
Cross-Modal Subspace Clustering via Deep Canonical Correlation Analysis,2020,AAAI,the Association for the Advancement of Artificial Intelligence
A Multi-Channel Neural Graphical Event Model with Negative Evidence,2020,AAAI,the Association for the Advancement of Artificial Intelligence
Revisiting Bilinear Pooling: A Coding Perspective,2020,AAAI,the Association for the Advancement of Artificial Intelligence
Improved Algorithms for Conservative Exploration in Bandits,2020,AAAI,the Association for the Advancement of Artificial Intelligence
Modeling Dialogues with Hashcode Representations: A Nonparametric Approach,2020,AAAI,the Association for the Advancement of Artificial Intelligence
Reinforcement Learning with Non-Markovian Rewards,2020,AAAI,the Association for the Advancement of Artificial Intelligence
Diachronic Embedding for Temporal Knowledge Graph Completion,2020,AAAI,the Association for the Advancement of Artificial Intelligence
Adversarially Robust Distillation,2020,AAAI,the Association for the Advancement of Artificial Intelligence
Robust Gradient-Based Markov Subsampling,2020,AAAI,the Association for the Advancement of Artificial Intelligence
Online Metric Learning for Multi-Label Classification,2020,AAAI,the Association for the Advancement of Artificial Intelligence
Potential Passenger Flow Prediction: A Novel Study for Urban Transportation Development,2020,AAAI,the Association for the Advancement of Artificial Intelligence
AlignFlow: Cycle Consistent Learning from Multiple Domains via Normalizing Flows,2020,AAAI,the Association for the Advancement of Artificial Intelligence
Robust Stochastic Bandit Algorithms under Probabilistic Unbounded Adversarial Attack,2020,AAAI,the Association for the Advancement of Artificial Intelligence
Nonlinear Mixup: Out-Of-Manifold Data Augmentation for Text Classification,2020,AAAI,the Association for the Advancement of Artificial Intelligence
IWE-Net: Instance Weight Network for Locating Negative Comments and its application to improve Traffic User Experience,2020,AAAI,the Association for the Advancement of Artificial Intelligence
AdaFilter: Adaptive Filter Fine-Tuning for Deep Transfer Learning,2020,AAAI,the Association for the Advancement of Artificial Intelligence
High Tissue Contrast MRI Synthesis Using Multi-Stage Attention-GAN for Segmentation,2020,AAAI,the Association for the Advancement of Artificial Intelligence
Robust Federated Learning via Collaborative Machine Teaching,2020,AAAI,the Association for the Advancement of Artificial Intelligence
Interpretable and Differentially Private Predictions,2020,AAAI,the Association for the Advancement of Artificial Intelligence
SNEQ: Semi-Supervised Attributed Network Embedding with Attention-Based Quantisation,2020,AAAI,the Association for the Advancement of Artificial Intelligence
SNEQ: Semi-Supervised Attributed Network Embedding with Attention-Based Quantisation,2020,AAAI,the Association for the Advancement of Artificial Intelligence
Heterogeneous Transfer Learning with Weighted Instance-Correspondence Data,2020,AAAI,the Association for the Advancement of Artificial Intelligence
EPOC: Efficient Perception via Optimal Communication,2020,AAAI,the Association for the Advancement of Artificial Intelligence
Eigenvalue Normalized Recurrent Neural Networks for Short Term Memory,2020,AAAI,the Association for the Advancement of Artificial Intelligence
Reasoning on Knowledge Graphs with Debate Dynamics,2020,AAAI,the Association for the Advancement of Artificial Intelligence
An Attention-Based Graph Neural Network for Heterogeneous Structural Learning,2020,AAAI,the Association for the Advancement of Artificial Intelligence
End-to-End Unpaired Image Denoising with Conditional Adversarial Networks,2020,AAAI,the Association for the Advancement of Artificial Intelligence
TellTail: Fast Scoring and Detection of Dense Subgraphs,2020,AAAI,the Association for the Advancement of Artificial Intelligence
Query-Driven Multi-Instance Learning,2020,AAAI,the Association for the Advancement of Artificial Intelligence
Towards Interpretation of Pairwise Learning,2020,AAAI,the Association for the Advancement of Artificial Intelligence
DWM: A Decomposable Winograd Method for Convolution Acceleration,2020,AAAI,the Association for the Advancement of Artificial Intelligence
Unsupervised Nonlinear Feature Selection from High-Dimensional Signed Networks,2020,AAAI,the Association for the Advancement of Artificial Intelligence
Feature Variance Regularization: A Simple Way to Improve the Generalizability of Neural Networks,2020,AAAI,the Association for the Advancement of Artificial Intelligence
Meta-Learning PAC-Bayes Priors in Model Averaging,2020,AAAI,the Association for the Advancement of Artificial Intelligence
DIANet: Dense-and-Implicit Attention Network,2020,AAAI,the Association for the Advancement of Artificial Intelligence
Collaborative Graph Convolutional Networks: Unsupervised Learning Meets Semi-Supervised Learning,2020,AAAI,the Association for the Advancement of Artificial Intelligence
Control Flow Graph Embedding Based on Multi-Instance Decomposition for Bug Localization,2020,AAAI,the Association for the Advancement of Artificial Intelligence
Word-Level Contextual Sentiment Analysis with Interpretability,2020,AAAI,the Association for the Advancement of Artificial Intelligence
Semi-Supervised Learning for Maximizing the Partial AUC,2020,AAAI,the Association for the Advancement of Artificial Intelligence
Co-Occurrence Estimation from Aggregated Data with Auxiliary Information,2020,AAAI,the Association for the Advancement of Artificial Intelligence
Class Prior Estimation with Biased Positives and Unlabeled Examples,2020,AAAI,the Association for the Advancement of Artificial Intelligence
Maximizing Overall Diversity for Improved Uncertainty Estimates in Deep Ensembles,2020,AAAI,the Association for the Advancement of Artificial Intelligence
Invariant Representations through Adversarial Forgetting,2020,AAAI,the Association for the Advancement of Artificial Intelligence
Bounding Regret in Empirical Games,2020,AAAI,the Association for the Advancement of Artificial Intelligence
An Efficient Explorative Sampling Considering the Generative Boundaries of Deep Generative Neural Networks,2020,AAAI,the Association for the Advancement of Artificial Intelligence
DefogGAN: Predicting Hidden Information in the StarCraft Fog of War with Generative Adversarial Nets,2020,AAAI,the Association for the Advancement of Artificial Intelligence
Sequential Recommendation with Relation-Aware Kernelized Self-Attention,2020,AAAI,the Association for the Advancement of Artificial Intelligence
Maximum Margin Multi-Dimensional Classification,2020,AAAI,the Association for the Advancement of Artificial Intelligence
