title,year,conf,conf_long
"The Undergraduate Games Corpus: A Dataset for Machine Perception of
      Interactive Media",2021,AAAI,the Association for the Advancement of Artificial Intelligence
Efficient Poverty Mapping from High Resolution Remote Sensing Images,2021,AAAI,the Association for the Advancement of Artificial Intelligence
Optimal Kidney Exchange with Immunosuppressants,2021,AAAI,the Association for the Advancement of Artificial Intelligence
TreeCaps: Tree-Based Capsule Networks for Source Code Processing,2021,AAAI,the Association for the Advancement of Artificial Intelligence
A Bottom-Up DAG Structure Extraction Model for Math Word Problems,2021,AAAI,the Association for the Advancement of Artificial Intelligence
"Diagnose Like A Pathologist: Weakly-Supervised Pathologist-Tree Network
      for Slide-Level Immunohistochemical Scoring",2021,AAAI,the Association for the Advancement of Artificial Intelligence
"Modeling the Momentum Spillover Effect for Stock Prediction via
      Attribute-Driven Graph Attention Networks",2021,AAAI,the Association for the Advancement of Artificial Intelligence
Differentially Private Link Prediction with Protected Connections,2021,AAAI,the Association for the Advancement of Artificial Intelligence
"Graph Neural Network to Dilute Outliers for Refactoring Monolith
      Application",2021,AAAI,the Association for the Advancement of Artificial Intelligence
KAN: Knowledge-aware Attention Network for Fake News Detection,2021,AAAI,the Association for the Advancement of Artificial Intelligence
"When Hashing Met Matching: Efficient Spatio-Temporal Search for
      Ridesharing",2021,AAAI,the Association for the Advancement of Artificial Intelligence
Gene Regulatory Network Inference using 3D Convolutional Neural Network,2021,AAAI,the Association for the Advancement of Artificial Intelligence
Universal Trading for Order Execution with Oracle Policy Distillation,2021,AAAI,the Association for the Advancement of Artificial Intelligence
Dual-Octave Convolution for Accelerated Parallel MR Image Reconstruction,2021,AAAI,the Association for the Advancement of Artificial Intelligence
MIMOSA: Multi-constraint Molecule Sampling for Molecule Optimization,2021,AAAI,the Association for the Advancement of Artificial Intelligence
"ECG ODE-GAN: Learning Ordinary Differential Equations of ECG Dynamics via
      Generative Adversarial Learning",2021,AAAI,the Association for the Advancement of Artificial Intelligence
"Towered Actor Critic For Handling Multiple Action Types In Reinforcement
      Learning For Drug Discovery",2021,AAAI,the Association for the Advancement of Artificial Intelligence
Hierarchical Graph Convolution Network for Traffic Forecasting,2021,AAAI,the Association for the Advancement of Artificial Intelligence
Automated Lay Language Summarization of Biomedical Scientific Reviews,2021,AAAI,the Association for the Advancement of Artificial Intelligence
"Sub-Seasonal Climate Forecasting via Machine Learning: Challenges,
      Analysis, and Advances",2021,AAAI,the Association for the Advancement of Artificial Intelligence
"Compound Word Transformer: Learning to Compose Full-Song Music over
      Dynamic Directed Hypergraphs",2021,AAAI,the Association for the Advancement of Artificial Intelligence
Modeling the Compatibility of Stem Tracks to Generate Music Mashups,2021,AAAI,the Association for the Advancement of Artificial Intelligence
SDGNN: Learning Node Representation for Signed Directed Networks,2021,AAAI,the Association for the Advancement of Artificial Intelligence
The Causal Learning of Retail Delinquency,2021,AAAI,the Association for the Advancement of Artificial Intelligence
"Deep Portfolio Optimization via Distributional Prediction of Residual
      Factors",2021,AAAI,the Association for the Advancement of Artificial Intelligence
Complex Coordinate-Based Meta-Analysis with Probabilistic Programming,2021,AAAI,the Association for the Advancement of Artificial Intelligence
"Who You Would Like to Share With? A Study of Share Recommendation in
      Social E-commerce",2021,AAAI,the Association for the Advancement of Artificial Intelligence
Estimating Calibrated Individualized Survival Curves with Deep Learning,2021,AAAI,the Association for the Advancement of Artificial Intelligence
Deep Contextual Clinical Prediction with Reverse Distillation,2021,AAAI,the Association for the Advancement of Artificial Intelligence
Learning to Stop: Dynamic Simulation Monte-Carlo Tree Search,2021,AAAI,the Association for the Advancement of Artificial Intelligence
"Predicting Livelihood Indicators from Community-Generated Street-Level
      Imagery",2021,AAAI,the Association for the Advancement of Artificial Intelligence
"Deep Conservation: A Latent-Dynamics Model for Exact Satisfaction of
      Physical Conservation Laws",2021,AAAI,the Association for the Advancement of Artificial Intelligence
"Two-Stream Convolution Augmented Transformer for Human Activity
      Recognition",2021,AAAI,the Association for the Advancement of Artificial Intelligence
Traffic Flow Prediction with Vehicle Trajectories,2021,AAAI,the Association for the Advancement of Artificial Intelligence
RevMan: Revenue-aware Multi-task Online Insurance Recommendation,2021,AAAI,the Association for the Advancement of Artificial Intelligence
MeInGame: Create a Game Character Face from a Single Portrait,2021,AAAI,the Association for the Advancement of Artificial Intelligence
Community-Aware Multi-Task Transportation Demand Prediction,2021,AAAI,the Association for the Advancement of Artificial Intelligence
"Asynchronous Stochastic Gradient Descent for Extreme-Scale Recommender
      Systems",2021,AAAI,the Association for the Advancement of Artificial Intelligence
"In-game Residential Home Planning via Visual Context-aware Global Relation
      Learning",2021,AAAI,the Association for the Advancement of Artificial Intelligence
Relational Classification of Biological Cells in Microscopy Images,2021,AAAI,the Association for the Advancement of Artificial Intelligence
Deep Style Transfer for Line Drawings,2021,AAAI,the Association for the Advancement of Artificial Intelligence
"RNA Secondary Structure Representation Network for RNA-proteins Binding
      Prediction",2021,AAAI,the Association for the Advancement of Artificial Intelligence
"PANTHER: Pathway Augmented Nonnegative Tensor Factorization for
      HighER-order Feature Learning",2021,AAAI,the Association for the Advancement of Artificial Intelligence
Programmatic Strategies for Real-Time Strategy Games,2021,AAAI,the Association for the Advancement of Artificial Intelligence
"Capturing Uncertainty in Unsupervised GPS Trajectory Segmentation Using
      Bayesian Deep Learning",2021,AAAI,the Association for the Advancement of Artificial Intelligence
Low-Rank Registration Based Manifolds for Convection-Dominated PDEs,2021,AAAI,the Association for the Advancement of Artificial Intelligence
Symbolic Music Generation with Transformer-GANs,2021,AAAI,the Association for the Advancement of Artificial Intelligence
Bringing UMAP Closer to the Speed of Light with GPU Acceleration,2021,AAAI,the Association for the Advancement of Artificial Intelligence
Deep Just-In-Time Inconsistency Detection Between Comments and Source Code,2021,AAAI,the Association for the Advancement of Artificial Intelligence
"XraySyn: Realistic View Synthesis From a Single Radiograph Through CT
      Priors",2021,AAAI,the Association for the Advancement of Artificial Intelligence
Pragmatic Code Autocomplete,2021,AAAI,the Association for the Advancement of Artificial Intelligence
"RareBERT: Transformer Architecture for Rare Disease Patient Identification
      using Administrative Claims",2021,AAAI,the Association for the Advancement of Artificial Intelligence
"Queue-Learning: A Reinforcement Learning Approach for Providing Quality of
      Service",2021,AAAI,the Association for the Advancement of Artificial Intelligence
Research Reproducibility as a Survival Analysis,2021,AAAI,the Association for the Advancement of Artificial Intelligence
"DeepPseudo: Pseudo Value Based Deep Learning Models for Competing Risk
      Analysis",2021,AAAI,the Association for the Advancement of Artificial Intelligence
"CardioGAN: Attentive Generative Adversarial Network with Dual
      Discriminators for Synthesis of ECG from PPG",2021,AAAI,the Association for the Advancement of Artificial Intelligence
"Stock Selection via Spatiotemporal Hypergraph Attention Network: A
      Learning to Rank Approach",2021,AAAI,the Association for the Advancement of Artificial Intelligence
"Content Masked Loss: Human-Like Brush Stroke Planning in a Reinforcement
      Learning Painting Agent",2021,AAAI,the Association for the Advancement of Artificial Intelligence
"StatEcoNet: Statistical Ecology Neural Networks for Species Distribution
      Modeling",2021,AAAI,the Association for the Advancement of Artificial Intelligence
"Integrating Static and Dynamic Data for Improved Prediction of Cognitive
      Declines Using Augmented Genotype-Phenotype Representations",2021,AAAI,the Association for the Advancement of Artificial Intelligence
GTA: Graph Truncated Attention for Retrosynthesis,2021,AAAI,the Association for the Advancement of Artificial Intelligence
"Physics-Informed Deep Learning for Traffic State Estimation: A Hybrid
      Paradigm Informed By Second-Order Traffic Models",2021,AAAI,the Association for the Advancement of Artificial Intelligence
"The LOB Recreation Model: Predicting the Limit Order Book from TAQ History
      Using an Ordinary Differential Equation Recurrent Neural Network",2021,AAAI,the Association for the Advancement of Artificial Intelligence
"Embracing Domain Differences in Fake News: Cross-domain Fake News
      Detection using Multi-modal Data",2021,AAAI,the Association for the Advancement of Artificial Intelligence
"Oral-3D: Reconstructing the 3D Structure of Oral Cavity from Panoramic
      X-ray",2021,AAAI,the Association for the Advancement of Artificial Intelligence
"Traffic Shaping in E-Commercial Search Engine: Multi-Objective Online
      Welfare Maximization",2021,AAAI,the Association for the Advancement of Artificial Intelligence
Fully Exploiting Cascade Graphs for Real-time Forwarding Prediction,2021,AAAI,the Association for the Advancement of Artificial Intelligence
A Hierarchical Approach to Multi-Event Survival Analysis,2021,AAAI,the Association for the Advancement of Artificial Intelligence
"DeepWriteSYN: On-Line Handwriting Synthesis via Deep Short-Term
      Representations",2021,AAAI,the Association for the Advancement of Artificial Intelligence
Sketch Generation with Drawing Process Guided by Vector Flow and Grayscale,2021,AAAI,the Association for the Advancement of Artificial Intelligence
"PSSM-Distil: Protein Secondary Structure Prediction (PSSP) on Low-Quality
      PSSM by Knowledge Distillation with Contrastive Learning",2021,AAAI,the Association for the Advancement of Artificial Intelligence
"Commission Fee is not Enough: A Hierarchical Reinforced Framework for
      Portfolio Management",2021,AAAI,the Association for the Advancement of Artificial Intelligence
"Alternative Baselines for Low-Shot 3D Medical Image Segmentation---An
      Atlas Perspective",2021,AAAI,the Association for the Advancement of Artificial Intelligence
"DeepTrader: A Deep Reinforcement Learning Approach for Risk-Return
      Balanced Portfolio Management with Market Conditions Embedding",2021,AAAI,the Association for the Advancement of Artificial Intelligence
"Dynamic Gaussian Mixture based Deep Generative Model For Robust
      Forecasting on Sparse Multivariate Time Series",2021,AAAI,the Association for the Advancement of Artificial Intelligence
Automated Symbolic Law Discovery: A Computer Vision Approach,2021,AAAI,the Association for the Advancement of Artificial Intelligence
Hierarchically and Cooperatively Learning Traffic Signal Control,2021,AAAI,the Association for the Advancement of Artificial Intelligence
Deep Partial Rank Aggregation for Personalized Attributes,2021,AAAI,the Association for the Advancement of Artificial Intelligence
"Towards Efficient Selection of Activity Trajectories based on Diversity
      and Coverage",2021,AAAI,the Association for the Advancement of Artificial Intelligence
"Minimizing Labeling Cost for Nuclei Instance Segmentation and
      Classification with Cross-domain Images and Weak Labels",2021,AAAI,the Association for the Advancement of Artificial Intelligence
"Bigram and Unigram Based Text Attack via Adaptive Monotonic Heuristic
      Search",2021,AAAI,the Association for the Advancement of Artificial Intelligence
"GRASP: Generic Framework for Health Status Representation Learning Based
      on Incorporating Knowledge from Similar Patients",2021,AAAI,the Association for the Advancement of Artificial Intelligence
"Window Loss for Bone Fracture Detection and Localization in X-ray Images
      with Point-based Annotation",2021,AAAI,the Association for the Advancement of Artificial Intelligence
A Spatial Regulated Patch-Wise Approach for Cervical Dysplasia Diagnosis,2021,AAAI,the Association for the Advancement of Artificial Intelligence
Online 3D Bin Packing with Constrained Deep Reinforcement Learning,2021,AAAI,the Association for the Advancement of Artificial Intelligence
"DEAR: Deep Reinforcement Learning for Online Advertising Impression in
      Recommender Systems",2021,AAAI,the Association for the Advancement of Artificial Intelligence
Towards Balanced Defect Prediction with Better Information Propagation,2021,AAAI,the Association for the Advancement of Artificial Intelligence
"Many-to-One Distribution Learning and K-Nearest Neighbor Smoothing for
      Thoracic Disease Identification",2021,AAAI,the Association for the Advancement of Artificial Intelligence
Probabilistic Programming Bots in Intuitive Physics Game Play,2021,AAAI,the Association for the Advancement of Artificial Intelligence
"Model-Agnostic Fits for Understanding Information Seeking Patterns in
      Humans",2021,AAAI,the Association for the Advancement of Artificial Intelligence
Apparently Irrational Choice as Optimal Sequential Decision Making,2021,AAAI,the Association for the Advancement of Artificial Intelligence
Visual Relation Detection using Hybrid Analogical Learning,2021,AAAI,the Association for the Advancement of Artificial Intelligence
Neural Analogical Matching,2021,AAAI,the Association for the Advancement of Artificial Intelligence
"Interpretable Self-Supervised Facial Micro-Expression Learning to Predict
      Cognitive State and Neurological Disorders",2021,AAAI,the Association for the Advancement of Artificial Intelligence
Quantum Cognitively Motivated Decision Fusion for Video Sentiment Analysis,2021,AAAI,the Association for the Advancement of Artificial Intelligence
"Towards a Better Understanding of VR Sickness: Physical Symptom Prediction
      for VR Contents",2021,AAAI,the Association for the Advancement of Artificial Intelligence
"PHASE: PHysically-grounded Abstract Social Events for Machine Social
      Perception",2021,AAAI,the Association for the Advancement of Artificial Intelligence
"Riemannian Embedding Banks for Common Spatial Patterns with EEG-based SPD
      Neural Networks",2021,AAAI,the Association for the Advancement of Artificial Intelligence
"Plug-and-Play Domain Adaptation for Cross-Subject EEG-based Emotion
      Recognition",2021,AAAI,the Association for the Advancement of Artificial Intelligence
Localization in the Crowd with Topological Constraints,2021,AAAI,the Association for the Advancement of Artificial Intelligence
Deep Event Stereo Leveraged by Event-to-Image Translation,2021,AAAI,the Association for the Advancement of Artificial Intelligence
Optical Flow Estimation from a Single Motion-blurred Image,2021,AAAI,the Association for the Advancement of Artificial Intelligence
Motion-blurred Video Interpolation and Extrapolation,2021,AAAI,the Association for the Advancement of Artificial Intelligence
"Disentangled Multi-Relational Graph Convolutional Network for Pedestrian
      Trajectory Prediction",2021,AAAI,the Association for the Advancement of Artificial Intelligence
Dense Events Grounding in Video,2021,AAAI,the Association for the Advancement of Artificial Intelligence
"Context-aware Attentional Pooling (CAP) for Fine-grained Visual
      Classification",2021,AAAI,the Association for the Advancement of Artificial Intelligence
Appearance-Motion Memory Consistency Network for Video Anomaly Detection,2021,AAAI,the Association for the Advancement of Artificial Intelligence
Rethinking Object Detection in Retail Stores,2021,AAAI,the Association for the Advancement of Artificial Intelligence
"YOLObile: Real-Time Object Detection on Mobile Devices via
      Compression-Compilation Co-Design",2021,AAAI,the Association for the Advancement of Artificial Intelligence
"Semantic MapNet: Building Allocentric Semantic Maps and Representations
      from Egocentric Views",2021,AAAI,the Association for the Advancement of Artificial Intelligence
Understanding Deformable Alignment in Video Super-Resolution,2021,AAAI,the Association for the Advancement of Artificial Intelligence
Deep Metric Learning with Graph Consistency,2021,AAAI,the Association for the Advancement of Artificial Intelligence
"CNN Profiler on Polar Coordinate Images for Tropical Cyclone Structure
      Analysis",2021,AAAI,the Association for the Advancement of Artificial Intelligence
"Commonsense Knowledge Aware Concept Selection For Diverse and Informative
      Visual Storytelling",2021,AAAI,the Association for the Advancement of Artificial Intelligence
"Attention-based Multi-Level Fusion Network for Light Field Depth
      Estimation",2021,AAAI,the Association for the Advancement of Artificial Intelligence
"Joint Demosaicking and Denoising in the Wild: The Case of Training Under
      Ground Truth Uncertainty",2021,AAAI,the Association for the Advancement of Artificial Intelligence
Spatial-temporal Causal Inference for Partial Image-to-video Adaptation,2021,AAAI,the Association for the Advancement of Artificial Intelligence
"Ref-NMS: Breaking Proposal Bottlenecks in Two-Stage Referring Expression
      Grounding",2021,AAAI,the Association for the Advancement of Artificial Intelligence
"RSPNet: Relative Speed Perception for Unsupervised Video Representation
      Learning",2021,AAAI,the Association for the Advancement of Artificial Intelligence
"Dual Distribution Alignment Network for Generalizable Person
      Re-Identification",2021,AAAI,the Association for the Advancement of Artificial Intelligence
RGB-D Salient Object Detection via 3D Convolutional Neural Networks,2021,AAAI,the Association for the Advancement of Artificial Intelligence
Mind-the-Gap! Unsupervised Domain Adaptation for Text-Video Retrieval,2021,AAAI,the Association for the Advancement of Artificial Intelligence
Local Relation Learning for Face Forgery Detection,2021,AAAI,the Association for the Advancement of Artificial Intelligence
"Deductive Learning for Weakly-Supervised 3D Human Pose Estimation via
      Uncalibrated Cameras",2021,AAAI,the Association for the Advancement of Artificial Intelligence
A Unified Multi-Scenario Attacking Network for Visual Object Tracking,2021,AAAI,the Association for the Advancement of Artificial Intelligence
SSD-GAN: Measuring the Realness in the Spatial and Spectral Domains,2021,AAAI,the Association for the Advancement of Artificial Intelligence
"Multi-Scale Spatial Temporal Graph Convolutional Network for
      Skeleton-Based Action Recognition",2021,AAAI,the Association for the Advancement of Artificial Intelligence
"Cascade Network with Guided Loss and Hybrid Attention for Finding Good
      Correspondences",2021,AAAI,the Association for the Advancement of Artificial Intelligence
"Generalizable Representation Learning for Mixture Domain Face
      Anti-Spoofing",2021,AAAI,the Association for the Advancement of Artificial Intelligence
SSPC-Net: Semi-supervised Semantic 3D Point Cloud Segmentation Network,2021,AAAI,the Association for the Advancement of Artificial Intelligence
"Deep Feature Space Trojan Attack of Neural Networks by Controlled
      Detoxification",2021,AAAI,the Association for the Advancement of Artificial Intelligence
"Graph and Temporal Convolutional Networks for 3D Multi-person Pose
      Estimation in Monocular Videos",2021,AAAI,the Association for the Advancement of Artificial Intelligence
DramaQA: Character-Centered Video Story Understanding with Hierarchical QA,2021,AAAI,the Association for the Advancement of Artificial Intelligence
"DeepCollaboration: Collaborative Generative and Discriminative Models for
      Class Incremental Learning",2021,AAAI,the Association for the Advancement of Artificial Intelligence
"Split then Refine: Stacked Attention-guided ResUNets for Blind Single
      Image Visible Watermark Removal",2021,AAAI,the Association for the Advancement of Artificial Intelligence
"RSGNet: Relation based Skeleton Graph Network for Crowded Scenes Pose
      Estimation",2021,AAAI,the Association for the Advancement of Artificial Intelligence
Voxel R-CNN: Towards High Performance Voxel-based 3D Object Detection,2021,AAAI,the Association for the Advancement of Artificial Intelligence
Arbitrary Video Style Transfer via Multi-Channel Correlation,2021,AAAI,the Association for the Advancement of Artificial Intelligence
Similarity Reasoning and Filtration for Image-Text Matching,2021,AAAI,the Association for the Advancement of Artificial Intelligence
"Spatio-Temporal Difference Descriptor for Skeleton-Based Action
      Recognition",2021,AAAI,the Association for the Advancement of Artificial Intelligence
Towards Universal Physical Attacks on Single Object Tracking,2021,AAAI,the Association for the Advancement of Artificial Intelligence
"Modeling the Probabilistic Distribution of Unlabeled Data for One-shot
      Medical Image Segmentation",2021,AAAI,the Association for the Advancement of Artificial Intelligence
Few-Shot Class-Incremental Learning via Relation Knowledge Distillation,2021,AAAI,the Association for the Advancement of Artificial Intelligence
"MIEHDR CNN: Main Image Enhancement based Ghost-Free High Dynamic Range
      Imaging using Dual-Lens Systems",2021,AAAI,the Association for the Advancement of Artificial Intelligence
Boosting Image-based Mutual Gaze Detection using Pseudo 3D Gaze,2021,AAAI,the Association for the Advancement of Artificial Intelligence
How to Save your Annotation Cost for Panoptic Segmentation?,2021,AAAI,the Association for the Advancement of Artificial Intelligence
"DIRV: Dense Interaction Region Voting for End-to-End Human-Object
      Interaction Detection",2021,AAAI,the Association for the Advancement of Artificial Intelligence
DecAug: Augmenting HOI Detection via Decomposition,2021,AAAI,the Association for the Advancement of Artificial Intelligence
Partially Non-Autoregressive Image Captioning,2021,AAAI,the Association for the Advancement of Artificial Intelligence
Memory-Augmented Image Captioning,2021,AAAI,the Association for the Advancement of Artificial Intelligence
Edge-competing Pathological Liver Vessel Segmentation with Limited Labels,2021,AAAI,the Association for the Advancement of Artificial Intelligence
Visual Boundary Knowledge Translation for Foreground Segmentation,2021,AAAI,the Association for the Advancement of Artificial Intelligence
Learning Complex 3D Human Self-Contact,2021,AAAI,the Association for the Advancement of Artificial Intelligence
Rain Streak Removal via Dual Graph Convolutional Network,2021,AAAI,the Association for the Advancement of Artificial Intelligence
"CompFeat: Comprehensive Feature Aggregation for Video Instance
      Segmentation",2021,AAAI,the Association for the Advancement of Artificial Intelligence
Deep Metric Learning with Self-Supervised Ranking,2021,AAAI,the Association for the Advancement of Artificial Intelligence
A Systematic Evaluation of Object Detection Networks for Scientific Plots,2021,AAAI,the Association for the Advancement of Artificial Intelligence
The Complexity of Object Association in Multiple Object Tracking,2021,AAAI,the Association for the Advancement of Artificial Intelligence
Learning Local Neighboring Structure for Robust 3D Shape Representation,2021,AAAI,the Association for the Advancement of Artificial Intelligence
"Semantic-guided Reinforced Region Embedding for Generalized Zero-Shot
      Learning",2021,AAAI,the Association for the Advancement of Artificial Intelligence
"Dynamic Graph Representation Learning for Video Dialog via Multi-Modal
      Shuffled Transformers",2021,AAAI,the Association for the Advancement of Artificial Intelligence
"Boundary-Aware Geometric Encoding for Semantic Segmentation of Point
      Clouds",2021,AAAI,the Association for the Advancement of Artificial Intelligence
Analogical Image Translation for Fog Generation,2021,AAAI,the Association for the Advancement of Artificial Intelligence
Temporal ROI Align for Video Object Recognition,2021,AAAI,the Association for the Advancement of Artificial Intelligence
SMART Frame Selection for Action Recognition,2021,AAAI,the Association for the Advancement of Artificial Intelligence
Proxy Synthesis: Learning with Synthetic Classes for Deep Metric Learning,2021,AAAI,the Association for the Advancement of Artificial Intelligence
Interpretable Graph Capsule Networks for Object Recognition,2021,AAAI,the Association for the Advancement of Artificial Intelligence
Class-Incremental Instance Segmentation via Multi-Teacher Networks,2021,AAAI,the Association for the Advancement of Artificial Intelligence
