title,year,conf,conf_long
"Transformer-Style Relational Reasoning with Dynamic Memory Updating for
      Temporal Network Modeling",2021,AAAI,the Association for the Advancement of Artificial Intelligence
A Unified Pretraining Framework for Passage Ranking and Expansion,2021,AAAI,the Association for the Advancement of Artificial Intelligence
Dynamic Knowledge Graph Alignment,2021,AAAI,the Association for the Advancement of Artificial Intelligence
Rethinking Graph Regularization for Graph Neural Networks,2021,AAAI,the Association for the Advancement of Artificial Intelligence
"Capturing Delayed Feedback in Conversion Rate Prediction via Elapsed-Time
      Sampling",2021,AAAI,the Association for the Advancement of Artificial Intelligence
Why Do Attributes Propagate in Graph Convolutional Neural Networks?,2021,AAAI,the Association for the Advancement of Artificial Intelligence
"Relaxed Clustered Hawkes Process for Student Procrastination Modeling in
      MOOCs",2021,AAAI,the Association for the Advancement of Artificial Intelligence
"Interpretable Clustering on Dynamic Graphs with Recurrent Graph Neural
      Networks",2021,AAAI,the Association for the Advancement of Artificial Intelligence
Coupled Layer-wise Graph Convolution for Transportation Demand Prediction,2021,AAAI,the Association for the Advancement of Artificial Intelligence
"Deep Graph-neighbor Coherence Preserving Network for Unsupervised
      Cross-modal Hashing",2021,AAAI,the Association for the Advancement of Artificial Intelligence
Dual Sparse Attention Network For Session-based Recommendation,2021,AAAI,the Association for the Advancement of Artificial Intelligence
"Self-Supervised Prototype Representation Learning for Event-Based
      Corporate Profiling",2021,AAAI,the Association for the Advancement of Artificial Intelligence
AugSplicing: Synchronized Behavior Detection in Streaming Tensors,2021,AAAI,the Association for the Advancement of Artificial Intelligence
Taxonomy Completion via Triplet Matching Network,2021,AAAI,the Association for the Advancement of Artificial Intelligence
"Tripartite Collaborative Filtering with Observability and Selection for
      Debiasing Rating Estimation on Missing-Not-at-Random Data",2021,AAAI,the Association for the Advancement of Artificial Intelligence
"Generalized Relation Learning with Semantic Correlation Awareness for Link
      Prediction",2021,AAAI,the Association for the Advancement of Artificial Intelligence
A Graph-based Relevance Matching Model for Ad-hoc Retrieval,2021,AAAI,the Association for the Advancement of Artificial Intelligence
Heterogeneous Graph Structure Learning for Graph Neural Networks,2021,AAAI,the Association for the Advancement of Artificial Intelligence
Cold-start Sequential Recommendation via Meta Learner,2021,AAAI,the Association for the Advancement of Artificial Intelligence
"Overcoming Catastrophic Forgetting in Graph Neural Networks with
      Experience Replay",2021,AAAI,the Association for the Advancement of Artificial Intelligence
"Modeling Heterogeneous Relations across Multiple Modes for Potential Crowd
      Flow Prediction",2021,AAAI,the Association for the Advancement of Artificial Intelligence
"Learning from History: Modeling Temporal Knowledge Graphs with Sequential
      Copy-Generation Networks",2021,AAAI,the Association for the Advancement of Artificial Intelligence
Adversarial Directed Graph Embedding,2021,AAAI,the Association for the Advancement of Artificial Intelligence
Relation-Aware Neighborhood Matching Model for Entity Alignment,2021,AAAI,the Association for the Advancement of Artificial Intelligence
Argument Mining Driven Analysis of Peer-Reviews,2021,AAAI,the Association for the Advancement of Artificial Intelligence
Uncovering Latent Biases in Text: Method and Application to Peer Review,2021,AAAI,the Association for the Advancement of Artificial Intelligence
A Market-Inspired Bidding Scheme for Peer Review Paper Assignment,2021,AAAI,the Association for the Advancement of Artificial Intelligence
"A Novice-Reviewer Experiment to Address Scarcity of Qualified Reviewers in
      Large Conferences",2021,AAAI,the Association for the Advancement of Artificial Intelligence
Catch Me if I Can: Detecting Strategic Behaviour in Peer Assessment,2021,AAAI,the Association for the Advancement of Artificial Intelligence
"Savable but Lost Lives when ICU Is Overloaded: a Model from 733 Patients
      in Epicenter Wuhan, China",2021,AAAI,the Association for the Advancement of Artificial Intelligence
"Persistence of Anti-vaccine Sentiment in Social Networks Through Strategic
      Interactions",2021,AAAI,the Association for the Advancement of Artificial Intelligence
"Automated Model Design and Benchmarking of Deep Learning Models for
      COVID-19 Detection with Chest CT Scans",2021,AAAI,the Association for the Advancement of Artificial Intelligence
"STELAR: Spatio-temporal Tensor Factorization with Latent Epidemiological
      Regularization",2021,AAAI,the Association for the Advancement of Artificial Intelligence
Transfer Graph Neural Networks for Pandemic Forecasting,2021,AAAI,the Association for the Advancement of Artificial Intelligence
MiniSeg: An Extremely Minimum Network for Efficient COVID-19 Segmentation,2021,AAAI,the Association for the Advancement of Artificial Intelligence
"Steering a Historical Disease Forecasting Model Under a Pandemic: Case of
      Flu and COVID-19",2021,AAAI,the Association for the Advancement of Artificial Intelligence
"Gaining Insight into SARS-CoV-2 Infection and COVID-19 Severity Using
      Self-supervised Edge Features and Graph Neural Networks",2021,AAAI,the Association for the Advancement of Artificial Intelligence
"Context Matters: Graph-based Self-supervised Representation Learning for
      Medical Images",2021,AAAI,the Association for the Advancement of Artificial Intelligence
Tracking Disease Outbreaks from Sparse Data with Bayesian Inference,2021,AAAI,the Association for the Advancement of Artificial Intelligence
"C-Watcher: A Framework for Early Detection of High-Risk Neighborhoods
      Ahead of COVID-19 Outbreak",2021,AAAI,the Association for the Advancement of Artificial Intelligence
Conversational Neuro-Symbolic Commonsense Reasoning,2021,AAAI,the Association for the Advancement of Artificial Intelligence
Interpretable Actions: Controlling Experts with Understandable Commands,2021,AAAI,the Association for the Advancement of Artificial Intelligence
"Dynamic Neuro-Symbolic Knowledge Graph Construction for Zero-shot
      Commonsense Question Answering",2021,AAAI,the Association for the Advancement of Artificial Intelligence
Aligning Artificial Neural Networks and Ontologies towards Explainable AI,2021,AAAI,the Association for the Advancement of Artificial Intelligence
Planning from Pixels in Atari with Learned Symbolic Representations,2021,AAAI,the Association for the Advancement of Artificial Intelligence
"Learning Game-Theoretic Models of Multiagent Trajectories Using Implicit
      Layers",2021,AAAI,the Association for the Advancement of Artificial Intelligence
Learning by Fixing: Solving Math Word Problems with Weak Supervision,2021,AAAI,the Association for the Advancement of Artificial Intelligence
"Answering Complex Queries in Knowledge Graphs with Bidirectional Sequence
      Encoders",2021,AAAI,the Association for the Advancement of Artificial Intelligence
"Self-Supervised Self-Supervision by Combining Deep Learning and
      Probabilistic Logic",2021,AAAI,the Association for the Advancement of Artificial Intelligence
Explaining Neural Matrix Factorization with Gradient Rollback,2021,AAAI,the Association for the Advancement of Artificial Intelligence
"A Scalable Reasoning and Learning Approach for Neural-Symbolic Stream
      Fusion",2021,AAAI,the Association for the Advancement of Artificial Intelligence
"Recognizing and Verifying Mathematical Equations using Multiplicative
      Differential Neural Units",2021,AAAI,the Association for the Advancement of Artificial Intelligence
"A Unified Framework for Planning with Learned Neural Network Transition
      Models",2021,AAAI,the Association for the Advancement of Artificial Intelligence
"Classification by Attention: Scene Graph Classification with Prior
      Knowledge",2021,AAAI,the Association for the Advancement of Artificial Intelligence
Differentiable Inductive Logic Programming for Structured Examples,2021,AAAI,the Association for the Advancement of Artificial Intelligence
Encoding Human Domain Knowledge to Warm Start Reinforcement Learning,2021,AAAI,the Association for the Advancement of Artificial Intelligence
Neural-Symbolic Integration: A Compositional Perspective,2021,AAAI,the Association for the Advancement of Artificial Intelligence
Adaptive Teaching of Temporal Logic Formulas to Preference-based Learners,2021,AAAI,the Association for the Advancement of Artificial Intelligence
Double Oracle Algorithm for Computing Equilibria in Continuous Games,2021,AAAI,the Association for the Advancement of Artificial Intelligence
A Few Queries Go a Long Way: Information-Distortion Tradeoffs in Matching,2021,AAAI,the Association for the Advancement of Artificial Intelligence
Representative Proxy Voting,2021,AAAI,the Association for the Advancement of Artificial Intelligence
"Forming Better Stable Solutions in Group Formation Games Inspired by
      Internet Exchange Points (IXPs)",2021,AAAI,the Association for the Advancement of Artificial Intelligence
Achieving Envy-freeness and Equitability with Monetary Transfers,2021,AAAI,the Association for the Advancement of Artificial Intelligence
"Proportionally Representative Participatory Budgeting with Ordinal
      Preferences",2021,AAAI,the Association for the Advancement of Artificial Intelligence
Fair and Truthful Mechanisms for Dichotomous Valuations,2021,AAAI,the Association for the Advancement of Artificial Intelligence
Bayesian Persuasion under Ex Ante and Ex Post Constraints,2021,AAAI,the Association for the Advancement of Artificial Intelligence
"Defending against Contagious Attacks on a Network with Resource
      Reallocation",2021,AAAI,the Association for the Advancement of Artificial Intelligence
Achieving Proportionality up to the Maximin Item with Indivisible Goods,2021,AAAI,the Association for the Advancement of Artificial Intelligence
The Price of Connectivity in Fair Division,2021,AAAI,the Association for the Advancement of Artificial Intelligence
Dividing a Graphical Cake,2021,AAAI,the Association for the Advancement of Artificial Intelligence
Maximin Fairness with Mixed Divisible and Indivisible Goods,2021,AAAI,the Association for the Advancement of Artificial Intelligence
Protecting the Protected Group: Circumventing Harmful Fairness,2021,AAAI,the Association for the Advancement of Artificial Intelligence
Selfish Creation of Social Networks,2021,AAAI,the Association for the Advancement of Artificial Intelligence
On the Complexity of Finding Justifications for Collective Decisions,2021,AAAI,the Association for the Advancement of Artificial Intelligence
Preserving Condorcet Winners under Strategic Manipulation,2021,AAAI,the Association for the Advancement of Artificial Intelligence
Reaching Individually Stable Coalition Structures in Hedonic Games,2021,AAAI,the Association for the Advancement of Artificial Intelligence
Reinforcement Learning of Sequential Price Mechanisms,2021,AAAI,the Association for the Advancement of Artificial Intelligence
Margin of Victory in Tournaments: Structural and Experimental Results,2021,AAAI,the Association for the Advancement of Artificial Intelligence
Welfare Guarantees in Schelling Segregation,2021,AAAI,the Association for the Advancement of Artificial Intelligence
Persuading Voters in District-based Elections,2021,AAAI,the Association for the Advancement of Artificial Intelligence
"Signaling in Bayesian Network Congestion Games: the Subtle Power of
      Symmetry",2021,AAAI,the Association for the Advancement of Artificial Intelligence
Computing Quantal Stackelberg Equilibrium in Extensive-Form Games,2021,AAAI,the Association for the Advancement of Artificial Intelligence
Fair and Efficient Allocations under Subadditive Valuations,2021,AAAI,the Association for the Advancement of Artificial Intelligence
"Scalable Equilibrium Computation in Multi-agent Influence Games on
      Networks",2021,AAAI,the Association for the Advancement of Artificial Intelligence
Proportional Representation under Single-Crossing Preferences Revisited,2021,AAAI,the Association for the Advancement of Artificial Intelligence
"Computational Analyses of the Electoral College: Campaigning Is Hard But
      Approximately Manageable",2021,AAAI,the Association for the Advancement of Artificial Intelligence
"Model-sharing Games: Analyzing Federated Learning Under Voluntary
      Participation",2021,AAAI,the Association for the Advancement of Artificial Intelligence
On Fair Division under Heterogeneous Matroid Constraints,2021,AAAI,the Association for the Advancement of Artificial Intelligence
PoA of Simple Auctions with Interdependent Values,2021,AAAI,the Association for the Advancement of Artificial Intelligence
Mind the Gap: Cake Cutting With Separation,2021,AAAI,the Association for the Advancement of Artificial Intelligence
"United for Change: Deliberative Coalition Formation to Change the Status
      Quo",2021,AAAI,the Association for the Advancement of Artificial Intelligence
Incentivizing Truthfulness Through Audits in Strategic Classification,2021,AAAI,the Association for the Advancement of Artificial Intelligence
"Almost Envy-freeness, Envy-rank, and Nash Social Welfare Matchings",2021,AAAI,the Association for the Advancement of Artificial Intelligence
"Faster Game Solving via Predictive Blackwell Approachability: Connecting
      Regret Matching and Mirror Descent",2021,AAAI,the Association for the Advancement of Artificial Intelligence
"Bandit Linear Optimization for Sequential Decision Making and
      Extensive-Form Games",2021,AAAI,the Association for the Advancement of Artificial Intelligence
"Model-Free Online Learning in Unknown Sequential Decision Making Problems
      and Games",2021,AAAI,the Association for the Advancement of Artificial Intelligence
Simultaneous 2nd Price Item Auctions with No-Underbidding,2021,AAAI,the Association for the Advancement of Artificial Intelligence
Convergence Analysis of No-Regret Bidding Algorithms in Repeated Auctions,2021,AAAI,the Association for the Advancement of Artificial Intelligence
Condorcet Relaxation In Spatial Voting,2021,AAAI,the Association for the Advancement of Artificial Intelligence
Present-Biased Optimization,2021,AAAI,the Association for the Advancement of Artificial Intelligence
Efficient Truthful Scheduling and Resource Allocation through Monitoring,2021,AAAI,the Association for the Advancement of Artificial Intelligence
"Infinite-Dimensional Fisher Markets: Equilibrium, Duality and Optimization",2021,AAAI,the Association for the Advancement of Artificial Intelligence
Fair and Efficient Online Allocations with Normalized Valuations,2021,AAAI,the Association for the Advancement of Artificial Intelligence
An Analysis of Approval-Based Committee Rules for 2D-Euclidean Elections,2021,AAAI,the Association for the Advancement of Artificial Intelligence
Aggregating Binary Judgments Ranked by Accuracy,2021,AAAI,the Association for the Advancement of Artificial Intelligence
District-Fair Participatory Budgeting,2021,AAAI,the Association for the Advancement of Artificial Intelligence
Fair and Efficient Allocations under Lexicographic Preferences,2021,AAAI,the Association for the Advancement of Artificial Intelligence
Necessarily Optimal One-Sided Matchings,2021,AAAI,the Association for the Advancement of Artificial Intelligence
Computing the Proportional Veto Core,2021,AAAI,the Association for the Advancement of Artificial Intelligence
"Multi-Scale Games: Representing and Solving Games on Networks with Group
      Structure",2021,AAAI,the Association for the Advancement of Artificial Intelligence
Multi-Party Campaigning,2021,AAAI,the Association for the Advancement of Artificial Intelligence
Classification with Strategically Withheld Data,2021,AAAI,the Association for the Advancement of Artificial Intelligence
On the PTAS for Maximin Shares in an Indivisible Mixed Manna,2021,AAAI,the Association for the Advancement of Artificial Intelligence
Evolution Strategies for Approximate Solution of Bayesian Games,2021,AAAI,the Association for the Advancement of Artificial Intelligence
Safe Search for Stackelberg Equilibria in Extensive-Form Games,2021,AAAI,the Association for the Advancement of Artificial Intelligence
Budget Feasible Mechanisms Over Graphs,2021,AAAI,the Association for the Advancement of Artificial Intelligence
"On the Approximation of Nash Equilibria in Sparse Win-Lose Multi-player
      Games",2021,AAAI,the Association for the Advancement of Artificial Intelligence
Trembling-Hand Perfection and Correlation in Sequential Games,2021,AAAI,the Association for the Advancement of Artificial Intelligence
"Complexity and Algorithms for Exploiting Quantal Opponents in Large
      Two-Player Games",2021,AAAI,the Association for the Advancement of Artificial Intelligence
Hindsight and Sequential Rationality of Correlated Play,2021,AAAI,the Association for the Advancement of Artificial Intelligence
On Fair and Efficient Allocations of Indivisible Goods,2021,AAAI,the Association for the Advancement of Artificial Intelligence
Coalition Formation in Multi-defender Security Games,2021,AAAI,the Association for the Advancement of Artificial Intelligence
Majority Opinion Diffusion in Social Networks: An Adversarial Approach,2021,AAAI,the Association for the Advancement of Artificial Intelligence
Fair and Efficient Allocations with Limited Demands,2021,AAAI,the Association for the Advancement of Artificial Intelligence
Scarce Societal Resource Allocation and the Price of (Local) Justice,2021,AAAI,the Association for the Advancement of Artificial Intelligence
"From Behavioral Theories to Econometrics: Inferring Preferences of Human
      Agents from Data on Repeated Interactions",2021,AAAI,the Association for the Advancement of Artificial Intelligence
Preference Elicitation as Average-Case Sorting,2021,AAAI,the Association for the Advancement of Artificial Intelligence
Market-Based Explanations of Collective Decisions,2021,AAAI,the Association for the Advancement of Artificial Intelligence
A Permutation-Equivariant Neural Network Architecture For Auction Design,2021,AAAI,the Association for the Advancement of Artificial Intelligence
Estimating -Rank by Maximizing Information Gain,2021,AAAI,the Association for the Advancement of Artificial Intelligence
Online Posted Pricing with Unknown Time-Discounted Valuations,2021,AAAI,the Association for the Advancement of Artificial Intelligence
"The Maximin Support Method: An Extension of the DHondt Method to
      Approval-Based Multiwinner Elections",2021,AAAI,the Association for the Advancement of Artificial Intelligence
"Solution Concepts in Hierarchical Games Under Bounded Rationality With
      Applications to Autonomous Driving",2021,AAAI,the Association for the Advancement of Artificial Intelligence
Modeling Voters in Multi-Winner Approval Voting,2021,AAAI,the Association for the Advancement of Artificial Intelligence
Coupon Design in Advertising Systems,2021,AAAI,the Association for the Advancement of Artificial Intelligence
"Restricted Domains of Dichotomous Preferences with Possibly Incomplete
      Information",2021,AAAI,the Association for the Advancement of Artificial Intelligence
Facilitys Perspective to Fair Facility Location Problems,2021,AAAI,the Association for the Advancement of Artificial Intelligence
The Smoothed Complexity of Computing Kemeny and Slater Rankings,2021,AAAI,the Association for the Advancement of Artificial Intelligence
If You Like Shapley Then Youll Love the Core,2021,AAAI,the Association for the Advancement of Artificial Intelligence
A Model of Winners Allocation,2021,AAAI,the Association for the Advancement of Artificial Intelligence
Targeted Negative Campaigning: Complexity and Approximations,2021,AAAI,the Association for the Advancement of Artificial Intelligence
"Finding and Certifying (Near-)Optimal Strategies in Black-Box
      Extensive-Form Games",2021,AAAI,the Association for the Advancement of Artificial Intelligence
Automated Mechanism Design for Classification with Partial Verification,2021,AAAI,the Association for the Advancement of Artificial Intelligence
Incentive-Aware PAC Learning,2021,AAAI,the Association for the Advancement of Artificial Intelligence
Classification with Few Tests through Self-Selection,2021,AAAI,the Association for the Advancement of Artificial Intelligence
"Computing Ex Ante Coordinated Team-Maxmin Equilibria in Zero-Sum
      Multiplayer Extensive-Form Games",2021,AAAI,the Association for the Advancement of Artificial Intelligence
Power in Liquid Democracy,2021,AAAI,the Association for the Advancement of Artificial Intelligence
Learning from Crowds by Modeling Common Confusions,2021,AAAI,the Association for the Advancement of Artificial Intelligence
Time to Transfer: Predicting and Evaluating Machine-Human Chatting Handoff,2021,AAAI,the Association for the Advancement of Artificial Intelligence
Teaching Active Human Learners,2021,AAAI,the Association for the Advancement of Artificial Intelligence
"Automated Storytelling via Causal, Commonsense Plot Ordering",2021,AAAI,the Association for the Advancement of Artificial Intelligence
MARTA: Leveraging Human Rationales for Explainable Text Classification,2021,AAAI,the Association for the Advancement of Artificial Intelligence
Human Uncertainty Inference via Deterministic Ensemble Neural Networks,2021,AAAI,the Association for the Advancement of Artificial Intelligence
"Learning to Sit: Synthesizing Human-Chair Interactions via Hierarchical
      Control",2021,AAAI,the Association for the Advancement of Artificial Intelligence
User Driven Model Adjustment via Boolean Rule Explanations,2021,AAAI,the Association for the Advancement of Artificial Intelligence
Classification Under Human Assistance,2021,AAAI,the Association for the Advancement of Artificial Intelligence
Wasserstein Distributionally Robust Inverse Multiobjective Optimization,2021,AAAI,the Association for the Advancement of Artificial Intelligence
"Illuminating Mario Scenes in the Latent Space of a Generative Adversarial
      Network",2021,AAAI,the Association for the Advancement of Artificial Intelligence
"ActionBert: Leveraging User Actions for Semantic Understanding of User
      Interfaces",2021,AAAI,the Association for the Advancement of Artificial Intelligence
Goal Blending for Responsive Shared Autonomy in a Navigating Vehicle,2021,AAAI,the Association for the Advancement of Artificial Intelligence
"Contrastive Adversarial Learning for Person Independent Facial Emotion
      Recognition",2021,AAAI,the Association for the Advancement of Artificial Intelligence
AI-Assisted Scientific Data Collection with Iterative Human Feedback,2021,AAAI,the Association for the Advancement of Artificial Intelligence
"Improving the Performance-Compatibility Tradeoff with Personalized
      Objective Functions",2021,AAAI,the Association for the Advancement of Artificial Intelligence
Indecision Modeling,2021,AAAI,the Association for the Advancement of Artificial Intelligence
Narrative Plan Generation with Self-Supervised Learning,2021,AAAI,the Association for the Advancement of Artificial Intelligence
Uncertain Graph Neural Networks for Facial Action Unit Detection,2021,AAAI,the Association for the Advancement of Artificial Intelligence
Learning Rewards From Linguistic Feedback,2021,AAAI,the Association for the Advancement of Artificial Intelligence
"Bounded Risk-Sensitive Markov Games: Forward Policy Design and Inverse
      Reward Learning with Iterative Reasoning and Cumulative Prospect Theory",2021,AAAI,the Association for the Advancement of Artificial Intelligence
"Content Learning with Structure-Aware Writing: A Graph-Infused Dual
      Conditional Variational Autoencoder for Automatic Storytelling",2021,AAAI,the Association for the Advancement of Artificial Intelligence
"A Continual Learning Framework for Uncertainty-Aware Interactive Image
      Segmentation",2021,AAAI,the Association for the Advancement of Artificial Intelligence
"Inferring Emotion from Large-scale Internet Voice Data: A Semi-supervised
      Curriculum Augmentation based Deep Learning Approach",2021,AAAI,the Association for the Advancement of Artificial Intelligence
Automatic Generation of Flexible Plans via Diverse Temporal Planning,2021,AAAI,the Association for the Advancement of Artificial Intelligence
"BT Expansion: a Sound and Complete Algorithm for Behavior Planning of
      Intelligent Robots with Behavior Trees",2021,AAAI,the Association for the Advancement of Artificial Intelligence
I3DOL: Incremental 3D Object Learning without Catastrophic Forgetting,2021,AAAI,the Association for the Advancement of Artificial Intelligence
Enabling Fast Instruction-Based Modification of Learned Robot Skills,2021,AAAI,the Association for the Advancement of Artificial Intelligence
"Consistent Right-Invariant Fixed-Lag Smoother with Application to Visual
      Inertial SLAM",2021,AAAI,the Association for the Advancement of Artificial Intelligence
"Supervised Training of Dense Object Nets using Optimal Descriptors for
      Industrial Robotic Applications",2021,AAAI,the Association for the Advancement of Artificial Intelligence
