title,year,conf,conf_long
Algorithms for Trip-Vehicle Assignment in Ride-Sharing,2018,AAAI,the Association for the Advancement of Artificial Intelligence
EAD: Elastic-Net Attacks to Deep Neural Networks via Adversarial Examples,2018,AAAI,the Association for the Advancement of Artificial Intelligence
Learning Differences Between Visual Scanning Patterns Can Disambiguate Bipolar and Unipolar Patients,2018,AAAI,the Association for the Advancement of Artificial Intelligence
Comparing Population Means Under Local Differential Privacy: With Significance and Power,2018,AAAI,the Association for the Advancement of Artificial Intelligence
MuseGAN: Multi-Track Sequential Generative Adversarial Networks for Symbolic Music Generation and Accompaniment,2018,AAAI,the Association for the Advancement of Artificial Intelligence
"Picasso,  Matisse,  or a Fake?  Automated Analysis of Drawings at the Stroke Level for Attribution and Authentication",2018,AAAI,the Association for the Advancement of Artificial Intelligence
Beyond Distributive Fairness in Algorithmic Decision Making: Feature Selection for Procedurally Fair Learning,2018,AAAI,the Association for the Advancement of Artificial Intelligence
Distributed Composite Quantization,2018,AAAI,the Association for the Advancement of Artificial Intelligence
Tensorized Projection for High-Dimensional Binary Embedding,2018,AAAI,the Association for the Advancement of Artificial Intelligence
Predicting Aesthetic Score Distribution Through Cumulative Jensen-Shannon Divergence,2018,AAAI,the Association for the Advancement of Artificial Intelligence
Norm Conflict Resolution in Stochastic Domains,2018,AAAI,the Association for the Advancement of Artificial Intelligence
Deep Representation-Decoupling Neural Networks for Monaural Music Mixture Separation,2018,AAAI,the Association for the Advancement of Artificial Intelligence
Early Prediction of Diabetes Complications from Electronic Health Records: A Multi-Task Survival Analysis Approach,2018,AAAI,the Association for the Advancement of Artificial Intelligence
Learning the Joint Representation of Heterogeneous Temporal Events for Clinical Endpoint Prediction,2018,AAAI,the Association for the Advancement of Artificial Intelligence
Multi-View Multi-Graph Embedding for Brain Network Clustering Analysis,2018,AAAI,the Association for the Advancement of Artificial Intelligence
Uplink Communication Efficient Differentially Private Sparse Optimization with Feature-Wise Distributed Data,2018,AAAI,the Association for the Advancement of Artificial Intelligence
Learning the Probability of Activation in the Presence of Latent Spreaders,2018,AAAI,the Association for the Advancement of Artificial Intelligence
Generating an Event Timeline About Daily Activities From a Semantic Concept Stream,2018,AAAI,the Association for the Advancement of Artificial Intelligence
On Organizing Online Soirees with Live Multi-Streaming,2018,AAAI,the Association for the Advancement of Artificial Intelligence
An AI Planning Solution to Scenario Generation for Enterprise Risk Management,2018,AAAI,the Association for the Advancement of Artificial Intelligence
Automated Segmentation of Overlapping Cytoplasm in Cervical Smear Images via Contour Fragments,2018,AAAI,the Association for the Advancement of Artificial Intelligence
When Social Advertising Meets Viral Marketing: Sequencing Social Advertisements for Influence Maximization,2018,AAAI,the Association for the Advancement of Artificial Intelligence
Synthesis of Programs from Multimodal Datasets,2018,AAAI,the Association for the Advancement of Artificial Intelligence
CD-CNN: A Partially Supervised Cross-Domain Deep Learning Model for Urban Resident Recognition,2018,AAAI,the Association for the Advancement of Artificial Intelligence
Geographic Differential Privacy for Mobile Crowd Coverage Maximization,2018,AAAI,the Association for the Advancement of Artificial Intelligence
Catching Captain Jack: Efficient Time and Space Dependent Patrols to Combat Oil-Siphoning in International Waters,2018,AAAI,the Association for the Advancement of Artificial Intelligence
Video Summarization via Semantic Attended Networks,2018,AAAI,the Association for the Advancement of Artificial Intelligence
TIMERS: Error-Bounded SVD Restart on Dynamic Networks,2018,AAAI,the Association for the Advancement of Artificial Intelligence
Ranking Users in Social Networks with Higher-Order Structures,2018,AAAI,the Association for the Advancement of Artificial Intelligence
Mitigating Overexposure in Viral Marketing,2018,AAAI,the Association for the Advancement of Artificial Intelligence
Neural Link Prediction over Aligned Networks,2018,AAAI,the Association for the Advancement of Artificial Intelligence
Privacy Preserving Point-of-Interest Recommendation Using Decentralized Matrix Factorization,2018,AAAI,the Association for the Advancement of Artificial Intelligence
CA-RNN: Using Context-Aligned Recurrent Neural Networks for Modeling Sentence Similarity,2018,AAAI,the Association for the Advancement of Artificial Intelligence
Dual Deep Neural Networks Cross-Modal Hashing,2018,AAAI,the Association for the Advancement of Artificial Intelligence
Representation Learning for Scale-Free Networks,2018,AAAI,the Association for the Advancement of Artificial Intelligence
VSE-ens: Visual-Semantic Embeddings with Efficient Negative Sampling,2018,AAAI,the Association for the Advancement of Artificial Intelligence
Partial Multi-View Outlier Detection Based on Collective Learning,2018,AAAI,the Association for the Advancement of Artificial Intelligence
A Network-Specific Markov Random Field Approach to Community Detection,2018,AAAI,the Association for the Advancement of Artificial Intelligence
Robust Detection of Link Communities in Large Social Networks by Exploiting Link Semantics,2018,AAAI,the Association for the Advancement of Artificial Intelligence
On Validation and Predictability of Digital Badges’ Influence on Individual Users,2018,AAAI,the Association for the Advancement of Artificial Intelligence
FILE: A Novel Framework for Predicting Social Status in Signed Networks,2018,AAAI,the Association for the Advancement of Artificial Intelligence
Community Detection in Attributed Graphs: An Embedding Approach,2018,AAAI,the Association for the Advancement of Artificial Intelligence
Social Recommendation with an Essential Preference Space,2018,AAAI,the Association for the Advancement of Artificial Intelligence
Early Detection of Fake News on Social Media Through Propagation Path Classification with Recurrent and Convolutional Networks,2018,AAAI,the Association for the Advancement of Artificial Intelligence
Cross-Lingual Entity Linking for Web Tables,2018,AAAI,the Association for the Advancement of Artificial Intelligence
DepthLGP: Learning Embeddings of Out-of-Sample Nodes in Dynamic Networks,2018,AAAI,the Association for the Advancement of Artificial Intelligence
Listening to the World Improves Speech Command Recognition,2018,AAAI,the Association for the Advancement of Artificial Intelligence
Location-Sensitive User Profiling Using Crowdsourced Labels,2018,AAAI,the Association for the Advancement of Artificial Intelligence
Binary Generative Adversarial Networks for Image Retrieval,2018,AAAI,the Association for the Advancement of Artificial Intelligence
Deep Region Hashing for Generic Instance Search from Images,2018,AAAI,the Association for the Advancement of Artificial Intelligence
Improved English to Russian Translation by Neural Suffix Prediction,2018,AAAI,the Association for the Advancement of Artificial Intelligence
Towards Efficient Detection of Overlapping Communities in Massive Networks,2018,AAAI,the Association for the Advancement of Artificial Intelligence
Structural Deep Embedding for Hyper-Networks,2018,AAAI,the Association for the Advancement of Artificial Intelligence
Confidence-Aware Matrix Factorization for Recommender Systems,2018,AAAI,the Association for the Advancement of Artificial Intelligence
Deep Asymmetric Transfer Network for Unbalanced Domain Adaptation,2018,AAAI,the Association for the Advancement of Artificial Intelligence
A Multi-Task Learning Approach for Improving Product Title Compression with User Search Log Data,2018,AAAI,the Association for the Advancement of Artificial Intelligence
Personalized Time-Aware Tag Recommendation,2018,AAAI,the Association for the Advancement of Artificial Intelligence
Telepath: Understanding Users from a Human Vision Perspective in Large-Scale Recommender Systems,2018,AAAI,the Association for the Advancement of Artificial Intelligence
RSDNE: Exploring Relaxed Similarity and Dissimilarity from Completely-Imbalanced Labels for Network Embedding,2018,AAAI,the Association for the Advancement of Artificial Intelligence
Contrastive Training for Models of Information Cascades,2018,AAAI,the Association for the Advancement of Artificial Intelligence
Retrieving and Classifying Affective Images via Deep Metric Learning,2018,AAAI,the Association for the Advancement of Artificial Intelligence
Multi-Facet Network Embedding: Beyond the General Solution of Detection and Representation,2018,AAAI,the Association for the Advancement of Artificial Intelligence
Urban Dreams of Migrants: A Case Study of Migrant Integration in Shanghai,2018,AAAI,the Association for the Advancement of Artificial Intelligence
From Common to Special: When Multi-Attribute Learning Meets Personalized Opinions,2018,AAAI,the Association for the Advancement of Artificial Intelligence
Discovering and Distinguishing Multiple Visual Senses for Polysemous Words,2018,AAAI,the Association for the Advancement of Artificial Intelligence
Spatiotemporal Activity Modeling Under Data Scarcity: A Graph-Regularized Cross-Modal Embedding Approach,2018,AAAI,the Association for the Advancement of Artificial Intelligence
Unsupervised Generative Adversarial Cross-Modal Hashing,2018,AAAI,the Association for the Advancement of Artificial Intelligence
Exploring Implicit Feedback for Open Domain Conversation Generation,2018,AAAI,the Association for the Advancement of Artificial Intelligence
Joint Training for Neural Machine Translation Models with Monolingual Data,2018,AAAI,the Association for the Advancement of Artificial Intelligence
Attention-via-Attention Neural Machine Translation,2018,AAAI,the Association for the Advancement of Artificial Intelligence
Dynamic Network Embedding by Modeling Triadic Closure Process,2018,AAAI,the Association for the Advancement of Artificial Intelligence
Inferring Emotion from Conversational Voice Data:  A Semi-Supervised Multi-Path Generative Neural Network Approach,2018,AAAI,the Association for the Advancement of Artificial Intelligence
"Learning Nonlinear Dynamics in Efficient,  Balanced Spiking Networks Using Local Plasticity Rules",2018,AAAI,the Association for the Advancement of Artificial Intelligence
"Perceiving,  Learning,  and Recognizing 3D Objects: An Approach to Cognitive Service Robots",2018,AAAI,the Association for the Advancement of Artificial Intelligence
A Unified Model for Document-Based Question Answering Based on Human-Like Reading Strategy,2018,AAAI,the Association for the Advancement of Artificial Intelligence
Thinking in PolAR Pictures: Using Rotation-Friendly Mental Images to Solve Leiter-R Form Completion,2018,AAAI,the Association for the Advancement of Artificial Intelligence
A Plasticity-Centric Approach to Train the Non-Differential Spiking Neural Networks,2018,AAAI,the Association for the Advancement of Artificial Intelligence
Explicit Reasoning over End-to-End Neural Architectures for Visual Question Answering,2018,AAAI,the Association for the Advancement of Artificial Intelligence
Action Recognition From Skeleton Data via Analogical Generalization Over Qualitative Representations,2018,AAAI,the Association for the Advancement of Artificial Intelligence
Glass-Box Program Synthesis: A Machine Learning Approach,2018,AAAI,the Association for the Advancement of Artificial Intelligence
Learning From Unannotated QA Pairs to Analogically Disambiguate and Answer Questions,2018,AAAI,the Association for the Advancement of Artificial Intelligence
Style Transfer in Text: Exploration and Evaluation,2018,AAAI,the Association for the Advancement of Artificial Intelligence
HAN: Hierarchical Association Network for Computing Semantic Relatedness,2018,AAAI,the Association for the Advancement of Artificial Intelligence
Maximizing Activity in Ising Networks via the TAP Approximation,2018,AAAI,the Association for the Advancement of Artificial Intelligence
Expected Utility with Relative Loss Reduction: A Unifying Decision Model for Resolving Four Well-Known Paradoxes,2018,AAAI,the Association for the Advancement of Artificial Intelligence
Towards Building Large Scale Multimodal Domain-Aware Conversation Systems,2018,AAAI,the Association for the Advancement of Artificial Intelligence
Complex Sequential Question Answering: Towards Learning to Converse Over Linked Question Answer Pairs with a Knowledge Graph,2018,AAAI,the Association for the Advancement of Artificial Intelligence
The Structural Affinity Method for Solving the Raven's Progressive Matrices Test for Intelligence,2018,AAAI,the Association for the Advancement of Artificial Intelligence
RUBER: An Unsupervised Method for Automatic Evaluation of Open-Domain Dialog Systems,2018,AAAI,the Association for the Advancement of Artificial Intelligence
Emotional Chatting Machine: Emotional Conversation Generation with Internal and External Memory,2018,AAAI,the Association for the Advancement of Artificial Intelligence
Transferring Decomposed Tensors for Scalable Energy Breakdown Across Regions,2018,AAAI,the Association for the Advancement of Artificial Intelligence
Scalable Relaxations of Sparse Packing Constraints: Optimal Biocontrol in Predator-Prey Networks,2018,AAAI,the Association for the Advancement of Artificial Intelligence
DyETC: Dynamic Electronic Toll Collection for Traffic Congestion Alleviation,2018,AAAI,the Association for the Advancement of Artificial Intelligence
Cellular Network Traffic Scheduling with Deep Reinforcement Learning,2018,AAAI,the Association for the Advancement of Artificial Intelligence
Dispatch Guided Allocation Optimization for Effective Emergency Response,2018,AAAI,the Association for the Advancement of Artificial Intelligence
DeepUrbanMomentum: An Online Deep-Learning System for Short-Term Urban Mobility Prediction,2018,AAAI,the Association for the Advancement of Artificial Intelligence
Variational BOLT: Approximate Learning in Factorial Hidden Markov Models with Application to Energy Disaggregation,2018,AAAI,the Association for the Advancement of Artificial Intelligence
Group Sparse Bayesian Learning for Active Surveillance on Epidemic Dynamics,2018,AAAI,the Association for the Advancement of Artificial Intelligence
Predicting Links in Plant-Pollinator Interaction Networks Using Latent Factor Models with Implicit Feedback,2018,AAAI,the Association for the Advancement of Artificial Intelligence
Computation Error Analysis of Block Floating Point Arithmetic Oriented Convolution Neural Network Accelerator Design,2018,AAAI,the Association for the Advancement of Artificial Intelligence
Multi-Entity Dependence Learning with Rich Context via Conditional Variational Auto-Encoder,2018,AAAI,the Association for the Advancement of Artificial Intelligence
Optimal Spot-Checking for Improving Evaluation Accuracy of Peer Grading Systems,2018,AAAI,the Association for the Advancement of Artificial Intelligence
Preventing Infectious Disease in Dynamic Populations Under Uncertainty,2018,AAAI,the Association for the Advancement of Artificial Intelligence
Efficiently Approximating the Pareto Frontier: Hydropower Dam Placement in the Amazon Basin,2018,AAAI,the Association for the Advancement of Artificial Intelligence
Minesweeper with Limited Moves,2018,AAAI,the Association for the Advancement of Artificial Intelligence
Event Representations for Automated Story Generation with Deep Neural Nets,2018,AAAI,the Association for the Advancement of Artificial Intelligence
Asymmetric Action Abstractions for Multi-Unit Control in Adversarial Real-Time Games,2018,AAAI,the Association for the Advancement of Artificial Intelligence
PVL: A Framework for Navigating the Precision-Variety Trade-Off in Automated Animation of Smiles,2018,AAAI,the Association for the Advancement of Artificial Intelligence
Utilitarians without Utilities: Maximizing Social Welfare for Graph Problems Using Only Ordinal Preferences,2018,AAAI,the Association for the Advancement of Artificial Intelligence
On the Complexity of Extended and Proportional Justified Representation,2018,AAAI,the Association for the Advancement of Artificial Intelligence
Rank Maximal Equal Contribution: A Probabilistic Social Choice Function,2018,AAAI,the Association for the Advancement of Artificial Intelligence
Groupwise Maximin Fair Allocation of Indivisible Goods,2018,AAAI,the Association for the Advancement of Artificial Intelligence
Truthful and Near-Optimal Mechanisms for Welfare Maximization in Multi-Winner Elections,2018,AAAI,the Association for the Advancement of Artificial Intelligence
Multiwinner Elections with Diversity Constraints,2018,AAAI,the Association for the Advancement of Artificial Intelligence
A Bayesian Clearing Mechanism for Combinatorial Auctions,2018,AAAI,the Association for the Advancement of Artificial Intelligence
AIVAT: A New Variance Reduction Technique for Agent Evaluation in Imperfect Information Games,2018,AAAI,the Association for the Advancement of Artificial Intelligence
Reinforcement Mechanism Design for Fraudulent Behaviour in e-Commerce,2018,AAAI,the Association for the Advancement of Artificial Intelligence
Computational Results for Extensive-Form Adversarial Team Games,2018,AAAI,the Association for the Advancement of Artificial Intelligence
On the Distortion of Voting with Multiple Representative Candidates,2018,AAAI,the Association for the Advancement of Artificial Intelligence
Disarmament Games with Resource,2018,AAAI,the Association for the Advancement of Artificial Intelligence
Computing the Strategy to Commit to in Polymatrix Games,2018,AAAI,the Association for the Advancement of Artificial Intelligence
"Resource Allocation Polytope Games: Uniqueness of Equilibrium,  Price of Stability,  and Price of Anarchy",2018,AAAI,the Association for the Advancement of Artificial Intelligence
Allocation Problems in Ride-Sharing Platforms: Online Matching with Offline Reusable Resources,2018,AAAI,the Association for the Advancement of Artificial Intelligence
Tool Auctions,2018,AAAI,the Association for the Advancement of Artificial Intelligence
Effective Heuristics for Committee Scoring Rules,2018,AAAI,the Association for the Advancement of Artificial Intelligence
On Social Envy-Freeness in Multi-Unit Markets,2018,AAAI,the Association for the Advancement of Artificial Intelligence
Facility Location Games with Fractional Preferences,2018,AAAI,the Association for the Advancement of Artificial Intelligence
The Complexity of Bribery in Network-Based Rating Systems,2018,AAAI,the Association for the Advancement of Artificial Intelligence
Weighted Voting Via No-Regret Learning,2018,AAAI,the Association for the Advancement of Artificial Intelligence
Cooperative Games with Bounded Dependency Degree,2018,AAAI,the Association for the Advancement of Artificial Intelligence
Committee Selection with Intraclass and Interclass Synergies,2018,AAAI,the Association for the Advancement of Artificial Intelligence
On Recognising Nearly Single-Crossing Preferences,2018,AAAI,the Association for the Advancement of Artificial Intelligence
Ranking Wily People Who Rank Each Other,2018,AAAI,the Association for the Advancement of Artificial Intelligence
Liquid Democracy: An Algorithmic Perspective,2018,AAAI,the Association for the Advancement of Artificial Intelligence
Policy Learning for Continuous Space Security Games Using Neural Networks,2018,AAAI,the Association for the Advancement of Artificial Intelligence
Approximately Stable Matchings with Budget Constraints,2018,AAAI,the Association for the Advancement of Artificial Intelligence
Approximating Bribery in Scoring Rules,2018,AAAI,the Association for the Advancement of Artificial Intelligence
Robust Stackelberg Equilibria in Extensive-Form Games and Extension to Limited Lookahead,2018,AAAI,the Association for the Advancement of Artificial Intelligence
The Conference Paper Assignment Problem: Using Order Weighted Averages to Assign Indivisible Goods,2018,AAAI,the Association for the Advancement of Artificial Intelligence
Incentivizing High Quality User Contributions: New Arm Generation in Bandit Learning,2018,AAAI,the Association for the Advancement of Artificial Intelligence
On the Approximation of Nash Equilibria in Sparse Win-Lose Games,2018,AAAI,the Association for the Advancement of Artificial Intelligence
Balancing Lexicographic Fairness and a Utilitarian Objective with Application to Kidney Exchange,2018,AAAI,the Association for the Advancement of Artificial Intelligence
Single-Peakedness and Total Unimodularity: New Polynomial-Time Algorithms for Multi-Winner Elections,2018,AAAI,the Association for the Advancement of Artificial Intelligence
Fair Rent Division on a Budget,2018,AAAI,the Association for the Advancement of Artificial Intelligence
Approximation-Variance Tradeoffs in Facility Location Games,2018,AAAI,the Association for the Advancement of Artificial Intelligence
MUDA: A Truthful Multi-Unit Double-Auction Mechanism,2018,AAAI,the Association for the Advancement of Artificial Intelligence
Traffic Optimization for a Mixture of Self-Interested and Compliant Agents,2018,AAAI,the Association for the Advancement of Artificial Intelligence
Coalition Manipulation of Gale-Shapley Algorithm,2018,AAAI,the Association for the Advancement of Artificial Intelligence
Axioms for Distance-Based Centralities,2018,AAAI,the Association for the Advancement of Artificial Intelligence
Non-Exploitable Protocols for Repeated Cake Cutting,2018,AAAI,the Association for the Advancement of Artificial Intelligence
Modelling Iterative Judgment Aggregation,2018,AAAI,the Association for the Advancement of Artificial Intelligence
Rich Coalitional Resource Games,2018,AAAI,the Association for the Advancement of Artificial Intelligence
It Takes (Only) Two: Adversarial Generator-Encoder Networks,2018,AAAI,the Association for the Advancement of Artificial Intelligence
An Axiomatization of the Eigenvector and Katz Centralities,2018,AAAI,the Association for the Advancement of Artificial Intelligence
A Regression Approach for Modeling Games with Many Symmetric Players,2018,AAAI,the Association for the Advancement of Artificial Intelligence
Equilibrium Computation and Robust Optimization in Zero Sum Games with Submodular Structure,2018,AAAI,the Association for the Advancement of Artificial Intelligence
Incentive-Compatible Forecasting Competitions,2018,AAAI,the Association for the Advancement of Artificial Intelligence
Strategic Coordination of Human Patrollers and Mobile Sensors with Signaling for Security Games,2018,AAAI,the Association for the Advancement of Artificial Intelligence
Average-Case Approximation Ratio of Scheduling without Payments,2018,AAAI,the Association for the Advancement of Artificial Intelligence
Avoiding Dead Ends in Real-Time Heuristic Search,2018,AAAI,the Association for the Advancement of Artificial Intelligence
Efficiently Monitoring Small Data Modification Effect for Large-Scale Learning in Changing Environment,2018,AAAI,the Association for the Advancement of Artificial Intelligence
A Recursive Scenario Decomposition Algorithm for Combinatorial Multistage Stochastic Optimisation Problems,2018,AAAI,the Association for the Advancement of Artificial Intelligence
Locality Preserving Projection Based on F-norm,2018,AAAI,the Association for the Advancement of Artificial Intelligence
A Two-Stage MaxSAT Reasoning Approach for the Maximum Weight Clique Problem,2018,AAAI,the Association for the Advancement of Artificial Intelligence
Revisiting Immediate Duplicate Detection in External Memory Search,2018,AAAI,the Association for the Advancement of Artificial Intelligence
Warmstarting of Model-Based Algorithm Configuration,2018,AAAI,the Association for the Advancement of Artificial Intelligence
On the Time and Space Complexity of Genetic Programming for Evolving Boolean Conjunctions,2018,AAAI,the Association for the Advancement of Artificial Intelligence
Proximal Alternating Direction Network: A Globally Converged Deep Unrolling Framework,2018,AAAI,the Association for the Advancement of Artificial Intelligence
Streaming Non-Monotone Submodular Maximization: Personalized Video Summarization on the Fly,2018,AAAI,the Association for the Advancement of Artificial Intelligence
Exact Clustering via Integer Programming and Maximum Satisfiability,2018,AAAI,the Association for the Advancement of Artificial Intelligence
On Multiset Selection with Size Constraints,2018,AAAI,the Association for the Advancement of Artificial Intelligence
Disjunctive Program Synthesis: A Robust Approach to Programming by Example,2018,AAAI,the Association for the Advancement of Artificial Intelligence
Accelerated Best-First Search with Upper-Bound Computation for Submodular Function Maximization,2018,AAAI,the Association for the Advancement of Artificial Intelligence
Submodular Function Maximization Over Graphs via Zero-Suppressed Binary Decision Diagrams,2018,AAAI,the Association for the Advancement of Artificial Intelligence
Counting Linear Extensions in Practice: MCMC Versus Exponential Monte Carlo,2018,AAAI,the Association for the Advancement of Artificial Intelligence
