title,year,conf,conf_long
Argument Mining for Improving the Automated Scoring of Persuasive Essays,2018,AAAI,the Association for the Advancement of Artificial Intelligence
Graph Convolutional Networks with Argument-Aware Pooling for Event Detection,2018,AAAI,the Association for the Advancement of Artificial Intelligence
Mention and Entity Description Co-Attention for Entity Disambiguation,2018,AAAI,the Association for the Advancement of Artificial Intelligence
Jointly Extracting Event Triggers and Arguments by Dependency-Bridge RNN and Tensor-Based Argument Interaction,2018,AAAI,the Association for the Advancement of Artificial Intelligence
Content and Context: Two-Pronged Bootstrapped Learning for Regex-Formatted Entity Extraction,2018,AAAI,the Association for the Advancement of Artificial Intelligence
Towards a Neural Conversation Model with Diversity Net Using Determinantal Point Processes,2018,AAAI,the Association for the Advancement of Artificial Intelligence
S-Net: From Answer Extraction to Answer Synthesis for Machine Reading Comprehension,2018,AAAI,the Association for the Advancement of Artificial Intelligence
SkipFlow: Incorporating Neural Coherence Features for End-to-End Automatic Text Scoring,2018,AAAI,the Association for the Advancement of Artificial Intelligence
Learning to Attend via Word-Aspect Associative Fusion for Aspect-Based Sentiment Analysis,2018,AAAI,the Association for the Advancement of Artificial Intelligence
Investigating Inner Properties of Multimodal Representation and Semantic Compositionality with Brain-Based Componential Semantics,2018,AAAI,the Association for the Advancement of Artificial Intelligence
Learning Multimodal Word Representation via Dynamic Fusion Methods,2018,AAAI,the Association for the Advancement of Artificial Intelligence
R,2018,AAAI,the Association for the Advancement of Artificial Intelligence
3,2018,AAAI,the Association for the Advancement of Artificial Intelligence
: Reinforced Ranker-Reader for Open-Domain Question Answering,2018,AAAI,the Association for the Advancement of Artificial Intelligence
Improving Review Representations with User Attention and Product Attention for Sentiment Classification,2018,AAAI,the Association for the Advancement of Artificial Intelligence
Improving Neural Fine-Grained Entity Typing with Knowledge Attention,2018,AAAI,the Association for the Advancement of Artificial Intelligence
Diagnosing and Improving Topic Models by Analyzing Posterior Variability,2018,AAAI,the Association for the Advancement of Artificial Intelligence
Dual Attention Network for Product Compatibility and Function Satisfiability Analysis,2018,AAAI,the Association for the Advancement of Artificial Intelligence
Assertion-Based QA with Question-Aware Open Information Extraction,2018,AAAI,the Association for the Advancement of Artificial Intelligence
"Multi-Entity Aspect-Based Sentiment Analysis with Context,  Entity and Aspect Memory",2018,AAAI,the Association for the Advancement of Artificial Intelligence
OTyper: A Neural Architecture for Open Named Entity Typing,2018,AAAI,the Association for the Advancement of Artificial Intelligence
Scale Up Event Extraction Learning via Automatic Training Data Generation,2018,AAAI,the Association for the Advancement of Artificial Intelligence
Learning Structured Representation for Text Classification via Reinforcement Learning,2018,AAAI,the Association for the Advancement of Artificial Intelligence
Duplicate Question Identification by Integrating FrameNet with Neural Networks,2018,AAAI,the Association for the Advancement of Artificial Intelligence
Variational Reasoning for Question Answering with Knowledge Graph,2018,AAAI,the Association for the Advancement of Artificial Intelligence
Hierarchical Attention Flow for Multiple-Choice Reading Comprehension,2018,AAAI,the Association for the Advancement of Artificial Intelligence
Resource-Constrained Scheduling for Maritime Traffic Management,2018,AAAI,the Association for the Advancement of Artificial Intelligence
Classical Planning in Deep Latent Space: Bridging the Subsymbolic-Symbolic Boundary,2018,AAAI,the Association for the Advancement of Artificial Intelligence
Planning with Pixels in (Almost) Real Time,2018,AAAI,the Association for the Advancement of Artificial Intelligence
totSAT - Totally-Ordered Hierarchical Planning Through SAT,2018,AAAI,the Association for the Advancement of Artificial Intelligence
Sublinear Search Spaces for Shortest Path Planning in Grid and Road Networks,2018,AAAI,the Association for the Advancement of Artificial Intelligence
Scheduling in Visual Fog Computing: NP-Completeness and Practical Efficient Solutions,2018,AAAI,the Association for the Advancement of Artificial Intelligence
Fat- and Heavy-Tailed Behavior in Satisficing Planning,2018,AAAI,the Association for the Advancement of Artificial Intelligence
Finite Sample Analyses for TD(0) with Function Approximation,2018,AAAI,the Association for the Advancement of Artificial Intelligence
Synthesis of Orchestrations of Transducers for Manufacturing,2018,AAAI,the Association for the Advancement of Artificial Intelligence
Meta-Search Through the Space of Representations and Heuristics on a Problem by Problem Basis,2018,AAAI,the Association for the Advancement of Artificial Intelligence
Expressive Real-Time Intersection Scheduling,2018,AAAI,the Association for the Advancement of Artificial Intelligence
Planning and Learning for Decentralized MDPs with Event Driven Rewards,2018,AAAI,the Association for the Advancement of Artificial Intelligence
A Recursive Algorithm to Generate Balanced Weekend Tournaments,2018,AAAI,the Association for the Advancement of Artificial Intelligence
Plan Recognition in Continuous Domains,2018,AAAI,the Association for the Advancement of Artificial Intelligence
Semi-Black Box: Rapid Development of Planning Based Solutions,2018,AAAI,the Association for the Advancement of Artificial Intelligence
Multiagent Simple Temporal Problem: The Arc-Consistency Approach,2018,AAAI,the Association for the Advancement of Artificial Intelligence
Load Scheduling of Simple Temporal Networks Under Dynamic Resource Pricing,2018,AAAI,the Association for the Advancement of Artificial Intelligence
On the Relationship Between State-Dependent Action Costs and Conditional Effects in Planning,2018,AAAI,the Association for the Advancement of Artificial Intelligence
Generalized Value Iteration Networks:Life Beyond Lattices,2018,AAAI,the Association for the Advancement of Artificial Intelligence
Linear and Integer Programming-Based Heuristics for Cost-Optimal Numeric Planning,2018,AAAI,the Association for the Advancement of Artificial Intelligence
Sensor-Based Activity Recognition via Learning From Distributions,2018,AAAI,the Association for the Advancement of Artificial Intelligence
Knowledge-Based Policies for Qualitative Decentralized POMDPs,2018,AAAI,the Association for the Advancement of Artificial Intelligence
Risk-Aware Proactive Scheduling via Conditional Value-at-Risk,2018,AAAI,the Association for the Advancement of Artificial Intelligence
Stackelberg Planning: Towards Effective Leader-Follower State Space Search,2018,AAAI,the Association for the Advancement of Artificial Intelligence
Action Schema Networks: Generalised Policies with Deep Learning,2018,AAAI,the Association for the Advancement of Artificial Intelligence
Learning Conditional Generative Models for Temporal Point Processes,2018,AAAI,the Association for the Advancement of Artificial Intelligence
Combining Experts’ Causal Judgments,2018,AAAI,the Association for the Advancement of Artificial Intelligence
An Experimental Study of Advice in Sequential Decision-Making Under Uncertainty,2018,AAAI,the Association for the Advancement of Artificial Intelligence
Optimal Approximation of Random Variables for Estimating the Probability of Meeting a Plan Deadline,2018,AAAI,the Association for the Advancement of Artificial Intelligence
Generalized Adjustment Under Confounding and Selection Biases,2018,AAAI,the Association for the Advancement of Artificial Intelligence
Armstrong's Axioms and Navigation Strategies,2018,AAAI,the Association for the Advancement of Artificial Intelligence
Lifted Generalized Dual Decomposition,2018,AAAI,the Association for the Advancement of Artificial Intelligence
Learning Mixtures of MLNs,2018,AAAI,the Association for the Advancement of Artificial Intelligence
RelNN: A Deep Neural Model for Relational Learning,2018,AAAI,the Association for the Advancement of Artificial Intelligence
Approximate Inference via Weighted Rademacher Complexity,2018,AAAI,the Association for the Advancement of Artificial Intelligence
Relational Marginal Problems: Theory and Estimation,2018,AAAI,the Association for the Advancement of Artificial Intelligence
Anytime Anyspace AND/OR Best-First Search for Bounding Marginal MAP,2018,AAAI,the Association for the Advancement of Artificial Intelligence
A Neural Stochastic Volatility Model,2018,AAAI,the Association for the Advancement of Artificial Intelligence
Learning Robust Options,2018,AAAI,the Association for the Advancement of Artificial Intelligence
Efficient-UCBV: An Almost Optimal Algorithm Using Variance Estimates,2018,AAAI,the Association for the Advancement of Artificial Intelligence
Hawkes Process Inference with Missing Data,2018,AAAI,the Association for the Advancement of Artificial Intelligence
Conditional PSDDs: Modeling and Learning with Modular Knowledge,2018,AAAI,the Association for the Advancement of Artificial Intelligence
Information Acquisition Under Resource Limitations in a Noisy Environment,2018,AAAI,the Association for the Advancement of Artificial Intelligence
Risk-Sensitive Submodular Optimization,2018,AAAI,the Association for the Advancement of Artificial Intelligence
Towards Training Probabilistic Topic Models on Neuromorphic Multi-Chip Systems,2018,AAAI,the Association for the Advancement of Artificial Intelligence
IONet: Learning to Cure the Curse of Drift in Inertial Odometry,2018,AAAI,the Association for the Advancement of Artificial Intelligence
Improved Results for Minimum Constraint Removal,2018,AAAI,the Association for the Advancement of Artificial Intelligence
Safe Reinforcement Learning via Formal Methods: Toward Safe Control Through Proof and Learning,2018,AAAI,the Association for the Advancement of Artificial Intelligence
Iterative Continuous Convolution for 3D Template Matching and Global Localization,2018,AAAI,the Association for the Advancement of Artificial Intelligence
Learning Integrated Holism-Landmark Representations for Long-Term Loop Closure Detection,2018,AAAI,the Association for the Advancement of Artificial Intelligence
Guiding Search in Continuous State-Action Spaces by Learning an Action Sampler From Off-Target Search Experience,2018,AAAI,the Association for the Advancement of Artificial Intelligence
Unsupervised Selection of Negative Examples for Grounded Language Learning,2018,AAAI,the Association for the Advancement of Artificial Intelligence
From Virtual Demonstration to Real-World Manipulation Using LSTM and MDN,2018,AAAI,the Association for the Advancement of Artificial Intelligence
Building Continuous Occupancy Maps with Moving Robots,2018,AAAI,the Association for the Advancement of Artificial Intelligence
Phase-Parametric Policies for Reinforcement Learning in Cyclic Environments,2018,AAAI,the Association for the Advancement of Artificial Intelligence
Safe Exploration and Optimization of Constrained MDPs Using Gaussian Processes,2018,AAAI,the Association for the Advancement of Artificial Intelligence
Sweep-Based Propagation for String Constraint Solving,2018,AAAI,the Association for the Advancement of Artificial Intelligence
MaxSAT Resolution with the Dual Rail Encoding,2018,AAAI,the Association for the Advancement of Artificial Intelligence
A SAT+CAS Method for Enumerating Williamson Matrices of Even Order,2018,AAAI,the Association for the Advancement of Artificial Intelligence
Exact MAP-Inference by Confining Combinatorial Search with LP Relaxation,2018,AAAI,the Association for the Advancement of Artificial Intelligence
Community-Based Trip Sharing for Urban Commuting,2018,AAAI,the Association for the Advancement of Artificial Intelligence
Schur Number Five,2018,AAAI,the Association for the Advancement of Artificial Intelligence
Towards Generalization in QBF Solving via Machine Learning,2018,AAAI,the Association for the Advancement of Artificial Intelligence
Verifying Properties of Binarized Deep Neural Networks,2018,AAAI,the Association for the Advancement of Artificial Intelligence
Parallel Algorithms for Operations on Multi-Valued Decision Diagrams,2018,AAAI,the Association for the Advancement of Artificial Intelligence
Premise Set Caching for Enumerating Minimal Correction Subsets,2018,AAAI,the Association for the Advancement of Artificial Intelligence
On Cryptographic Attacks Using Backdoors for SAT,2018,AAAI,the Association for the Advancement of Artificial Intelligence
Enhancing Constraint-Based Multi-Objective Combinatorial Optimization,2018,AAAI,the Association for the Advancement of Artificial Intelligence
Learning Robust Search Strategies Using a Bandit-Based Approach,2018,AAAI,the Association for the Advancement of Artificial Intelligence
Learning Spatio-Temporal Features with Partial Expression Sequences for On-the-Fly Prediction,2018,AAAI,the Association for the Advancement of Artificial Intelligence
SEE: Towards Semi-Supervised End-to-End Scene Text Recognition,2018,AAAI,the Association for the Advancement of Artificial Intelligence
Asymmetric Joint Learning for Heterogeneous Face Recognition,2018,AAAI,the Association for the Advancement of Artificial Intelligence
Lateral Inhibition-Inspired Convolutional Neural Network for Visual Attention and Saliency Detection,2018,AAAI,the Association for the Advancement of Artificial Intelligence
Transfer Adversarial Hashing for Hamming Space Retrieval,2018,AAAI,the Association for the Advancement of Artificial Intelligence
Temporal-Difference Learning with Sampling Baseline for Image Captioning,2018,AAAI,the Association for the Advancement of Artificial Intelligence
Order-Free RNN with Visual Attention for Multi-Label Classification,2018,AAAI,the Association for the Advancement of Artificial Intelligence
Learning a Wavelet-Like Auto-Encoder to Accelerate Deep Neural Networks,2018,AAAI,the Association for the Advancement of Artificial Intelligence
Recurrent Attentional Reinforcement Learning for Multi-Label Image Recognition,2018,AAAI,the Association for the Advancement of Artificial Intelligence
MixedPeds: Pedestrian Detection in Unannotated Videos Using Synthetically Generated Human-Agents for Training,2018,AAAI,the Association for the Advancement of Artificial Intelligence
Self-View Grounding Given a Narrated 360° Video,2018,AAAI,the Association for the Advancement of Artificial Intelligence
Using Syntax to Ground Referring Expressions in Natural Images,2018,AAAI,the Association for the Advancement of Artificial Intelligence
Acquiring Common Sense Spatial Knowledge Through Implicit Spatial Templates,2018,AAAI,the Association for the Advancement of Artificial Intelligence
PixelLink: Detecting Scene Text via Instance Segmentation,2018,AAAI,the Association for the Advancement of Artificial Intelligence
ExprGAN: Facial Expression Editing with Controllable Expression Intensity,2018,AAAI,the Association for the Advancement of Artificial Intelligence
A Deep Cascade Network for Unaligned Face Attribute Classification,2018,AAAI,the Association for the Advancement of Artificial Intelligence
Auto-Balanced Filter Pruning for Efficient Convolutional Neural Networks,2018,AAAI,the Association for the Advancement of Artificial Intelligence
Hierarchical Nonlinear Orthogonal Adaptive-Subspace Self-Organizing Map Based Feature Extraction for Human Action Recognition,2018,AAAI,the Association for the Advancement of Artificial Intelligence
Self-Reinforced Cascaded Regression for Face Alignment,2018,AAAI,the Association for the Advancement of Artificial Intelligence
Learning Pose Grammar to Encode Human Body Configuration for 3D Pose Estimation,2018,AAAI,the Association for the Advancement of Artificial Intelligence
Unravelling Robustness of Deep Learning Based Face Recognition Against Adversarial Attacks,2018,AAAI,the Association for the Advancement of Artificial Intelligence
Stack-Captioning: Coarse-to-Fine Learning for Image Captioning,2018,AAAI,the Association for the Advancement of Artificial Intelligence
Hierarchical LSTM for Sign Language Translation,2018,AAAI,the Association for the Advancement of Artificial Intelligence
Learning Coarse-to-Fine Structured Feature Embedding for Vehicle Re-Identification,2018,AAAI,the Association for the Advancement of Artificial Intelligence
Residual Encoder Decoder Network and Adaptive Prior for Face Parsing,2018,AAAI,the Association for the Advancement of Artificial Intelligence
Zero-Shot Learning with Attribute Selection,2018,AAAI,the Association for the Advancement of Artificial Intelligence
Doing the Best We Can with What We Have: Multi-Label Balancing with Selective Learning for Attribute Prediction,2018,AAAI,the Association for the Advancement of Artificial Intelligence
CMCGAN: A Uniform Framework for Cross-Modal Visual-Audio Mutual Generation,2018,AAAI,the Association for the Advancement of Artificial Intelligence
Integrating Both Visual and Audio Cues for Enhanced Video Caption,2018,AAAI,the Association for the Advancement of Artificial Intelligence
Merge or Not? Learning to Group Faces via Imitation Learning,2018,AAAI,the Association for the Advancement of Artificial Intelligence
Unsupervised Deep Learning of Mid-Level Video Representation for Action Recognition,2018,AAAI,the Association for the Advancement of Artificial Intelligence
Dual-Reference Face Retrieval,2018,AAAI,the Association for the Advancement of Artificial Intelligence
Facial Landmarks Detection by Self-Iterative Regression Based Landmarks-Attention Network,2018,AAAI,the Association for the Advancement of Artificial Intelligence
Learning Adaptive Hidden Layers for Mobile Gesture Recognition,2018,AAAI,the Association for the Advancement of Artificial Intelligence
Recurrently Aggregating Deep Features for Salient Object Detection,2018,AAAI,the Association for the Advancement of Artificial Intelligence
SAP: Self-Adaptive Proposal Model for Temporal Action Detection Based on Reinforcement Learning,2018,AAAI,the Association for the Advancement of Artificial Intelligence
Learning to Guide Decoding for Image Captioning,2018,AAAI,the Association for the Advancement of Artificial Intelligence
Deep Low-Resolution Person Re-Identification,2018,AAAI,the Association for the Advancement of Artificial Intelligence
Co-Domain Embedding Using Deep Quadruplet Networks for Unseen Traffic Sign Recognition,2018,AAAI,the Association for the Advancement of Artificial Intelligence
Multispectral Transfer Network: Unsupervised Depth Estimation for All-Day Vision,2018,AAAI,the Association for the Advancement of Artificial Intelligence
Generating Triples with Adversarial Networks for Scene Graph Construction,2018,AAAI,the Association for the Advancement of Artificial Intelligence
Action Prediction From Videos via Memorizing Hard-to-Predict Samples,2018,AAAI,the Association for the Advancement of Artificial Intelligence
Robust Collaborative Discriminative Learning for RGB-Infrared Tracking,2018,AAAI,the Association for the Advancement of Artificial Intelligence
End-to-End United Video Dehazing and Detection,2018,AAAI,the Association for the Advancement of Artificial Intelligence
Weakly Supervised Salient Object Detection Using Image Labels,2018,AAAI,the Association for the Advancement of Artificial Intelligence
"Brute-Force Facial Landmark Analysis with a 140, 000-Way Classifier",2018,AAAI,the Association for the Advancement of Artificial Intelligence
DF,2018,AAAI,the Association for the Advancement of Artificial Intelligence
2,2018,AAAI,the Association for the Advancement of Artificial Intelligence
Net: Discriminative Feature Learning and Fusion Network for RGB-D Indoor Scene Classification,2018,AAAI,the Association for the Advancement of Artificial Intelligence
Deep Semantic Structural Constraints for Zero-Shot Learning,2018,AAAI,the Association for the Advancement of Artificial Intelligence
Anti-Makeup: Learning A Bi-Level Adversarial Network for Makeup-Invariant Face Verification,2018,AAAI,the Association for the Advancement of Artificial Intelligence
Video Generation From Text,2018,AAAI,the Association for the Advancement of Artificial Intelligence
R-FCN++: Towards Accurate Region-Based Fully Convolutional Networks for Object Detection,2018,AAAI,the Association for the Advancement of Artificial Intelligence
Multi-Rate Gated Recurrent Convolutional Networks for Video-Based Pedestrian Re-Identification,2018,AAAI,the Association for the Advancement of Artificial Intelligence
Cross-View Person Identification by Matching Human Poses Estimated with Confidence on Each Body Joint,2018,AAAI,the Association for the Advancement of Artificial Intelligence
Visual Relationship Detection with Deep Structural Ranking,2018,AAAI,the Association for the Advancement of Artificial Intelligence
Tracking Occluded Objects and Recovering Incomplete Trajectories by Reasoning About Containment Relations and Human Actions,2018,AAAI,the Association for the Advancement of Artificial Intelligence
Learning Efficient Point Cloud Generation for Dense 3D Object Reconstruction,2018,AAAI,the Association for the Advancement of Artificial Intelligence
Multi-Scale Face Restoration with Sequential Gating Ensemble Network,2018,AAAI,the Association for the Advancement of Artificial Intelligence
Action Recognition with Coarse-to-Fine Deep Feature Integration and Asynchronous Fusion,2018,AAAI,the Association for the Advancement of Artificial Intelligence
T-C3D: Temporal Convolutional 3D Network for Real-Time Action Recognition,2018,AAAI,the Association for the Advancement of Artificial Intelligence
Cross-Domain Human Parsing via Adversarial Feature and Label Adaptation,2018,AAAI,the Association for the Advancement of Artificial Intelligence
Char-Net: A Character-Aware Neural Network for Distorted Scene Text Recognition,2018,AAAI,the Association for the Advancement of Artificial Intelligence
Semi-Supervised Bayesian Attribute Learning for Person Re-Identification,2018,AAAI,the Association for the Advancement of Artificial Intelligence
A Cascaded Inception of Inception Network with Attention Modulated Feature Fusion for Human Pose Estimation,2018,AAAI,the Association for the Advancement of Artificial Intelligence
Dictionary Learning Inspired Deep Network for Scene Recognition,2018,AAAI,the Association for the Advancement of Artificial Intelligence
PoseHD: Boosting Human Detectors Using Human Pose Information,2018,AAAI,the Association for the Advancement of Artificial Intelligence
SqueezedText: A Real-Time Scene Text Recognition by Binary Convolutional Encoder-Decoder Network,2018,AAAI,the Association for the Advancement of Artificial Intelligence
Multimodal Keyless Attention Fusion for Video Classification,2018,AAAI,the Association for the Advancement of Artificial Intelligence
Towards Affordable Semantic Searching: Zero-Shot Retrieval via Dominant Attributes,2018,AAAI,the Association for the Advancement of Artificial Intelligence
Co-Attending Free-Form Regions and Detections with Multi-Modal Multiplicative Feature Embedding for Visual Question Answering,2018,AAAI,the Association for the Advancement of Artificial Intelligence
Unsupervised Articulated Skeleton Extraction From Point Set Sequences Captured by a Single Depth Camera,2018,AAAI,the Association for the Advancement of Artificial Intelligence
Curve-Structure Segmentation From Depth Maps: A CNN-Based Approach and Its Application to Exploring Cultural Heritage Objects,2018,AAAI,the Association for the Advancement of Artificial Intelligence
Multi-Channel Pyramid Person Matching Network for Person Re-Identification,2018,AAAI,the Association for the Advancement of Artificial Intelligence
UnFlow: Unsupervised Learning of Optical Flow with a Bidirectional Census Loss,2018,AAAI,the Association for the Advancement of Artificial Intelligence
Weakly Supervised Collective Feature Learning From Curated Media,2018,AAAI,the Association for the Advancement of Artificial Intelligence
Asking Friendly Strangers: Non-Semantic Attribute Transfer,2018,AAAI,the Association for the Advancement of Artificial Intelligence
Spatial as Deep: Spatial CNN for Traffic Scene Understanding,2018,AAAI,the Association for the Advancement of Artificial Intelligence
Adaptive Feature Abstraction for Translating Video to Text,2018,AAAI,the Association for the Advancement of Artificial Intelligence
Scene-Centric Joint Parsing of Cross-View Videos,2018,AAAI,the Association for the Advancement of Artificial Intelligence
Exploring Human-Like Attention Supervision in Visual Question Answering,2018,AAAI,the Association for the Advancement of Artificial Intelligence
RAN4IQA: Restorative Adversarial Nets for No-Reference Image Quality Assessment,2018,AAAI,the Association for the Advancement of Artificial Intelligence
Extreme Low Resolution Activity Recognition with Multi-Siamese Embedding Learning,2018,AAAI,the Association for the Advancement of Artificial Intelligence
Top-Down Feedback for Crowd Counting Convolutional Neural Network,2018,AAAI,the Association for the Advancement of Artificial Intelligence
Game of Sketches: Deep Recurrent Models of Pictionary-Style Word Guessing,2018,AAAI,the Association for the Advancement of Artificial Intelligence
