title,year,conf,conf_long
Learning From Semi-Supervised Weak-Label Data,2018,AAAI,the Association for the Advancement of Artificial Intelligence
Decomposition Strategies for Constructive Preference Elicitation,2018,AAAI,the Association for the Advancement of Artificial Intelligence
Constructive Preference Elicitation Over Hybrid Combinatorial Spaces,2018,AAAI,the Association for the Advancement of Artificial Intelligence
Learning to Rank Based on Analogical Reasoning,2018,AAAI,the Association for the Advancement of Artificial Intelligence
Learning Lexicographic Preference Trees From Positive Examples,2018,AAAI,the Association for the Advancement of Artificial Intelligence
AutoEncoder by Forest,2018,AAAI,the Association for the Advancement of Artificial Intelligence
Counterfactual Multi-Agent Policy Gradients,2018,AAAI,the Association for the Advancement of Artificial Intelligence
Lagrangian Constrained Community Detection,2018,AAAI,the Association for the Advancement of Artificial Intelligence
DID: Distributed Incremental Block Coordinate Descent for Nonnegative Matrix Factorization,2018,AAAI,the Association for the Advancement of Artificial Intelligence
Incomplete Label Multi-Task Ordinal Regression for Spatial Event Scale Forecasting,2018,AAAI,the Association for the Advancement of Artificial Intelligence
Learning Combinatory Categorial Grammars for Plan Recognition,2018,AAAI,the Association for the Advancement of Artificial Intelligence
Characterization of the Convex Łukasiewicz Fragment for Learning From Constraints,2018,AAAI,the Association for the Advancement of Artificial Intelligence
Topic Modeling on Health Journals with Regularized Variational Inference,2018,AAAI,the Association for the Advancement of Artificial Intelligence
Non-Discriminatory Machine Learning Through Convex Fairness Criteria,2018,AAAI,the Association for the Advancement of Artificial Intelligence
Margin Based PU Learning,2018,AAAI,the Association for the Advancement of Artificial Intelligence
A Continuous Relaxation of Beam Search for End-to-End Training of Neural Sequence Models,2018,AAAI,the Association for the Advancement of Artificial Intelligence
Human Guided Linear Regression with Feature-Level Constraints,2018,AAAI,the Association for the Advancement of Artificial Intelligence
Learning Predictive State Representations From Non-Uniform Sampling,2018,AAAI,the Association for the Advancement of Artificial Intelligence
Flow-GAN: Combining Maximum Likelihood and Adversarial Learning in Generative Models,2018,AAAI,the Association for the Advancement of Artificial Intelligence
Boosted Generative Models,2018,AAAI,the Association for the Advancement of Artificial Intelligence
Asynchronous Doubly Stochastic Sparse Kernel Learning,2018,AAAI,the Association for the Advancement of Artificial Intelligence
Inexact Proximal Gradient Methods for Non-Convex and Non-Smooth Optimization,2018,AAAI,the Association for the Advancement of Artificial Intelligence
An Euclidean Distance Based on Tensor Product Graph Diffusion Related Attribute Value Embedding for Nominal Data Clustering,2018,AAAI,the Association for the Advancement of Artificial Intelligence
Who Said What: Modeling Individual Labelers Improves Classification,2018,AAAI,the Association for the Advancement of Artificial Intelligence
Nonparametric Stochastic Contextual Bandits,2018,AAAI,the Association for the Advancement of Artificial Intelligence
A General Formulation for Safely Exploiting Weakly Supervised Data,2018,AAAI,the Association for the Advancement of Artificial Intelligence
Double Forward Propagation for Memorized Batch Normalization,2018,AAAI,the Association for the Advancement of Artificial Intelligence
Learning Across Scales---Multiscale Methods for Convolution Neural Networks,2018,AAAI,the Association for the Advancement of Artificial Intelligence
A Framework for Multistream Regression with Direct Density Ratio Estimation,2018,AAAI,the Association for the Advancement of Artificial Intelligence
Approximate and Exact Enumeration of Rule Models,2018,AAAI,the Association for the Advancement of Artificial Intelligence
When Waiting Is Not an Option: Learning Options with a Deliberation Cost,2018,AAAI,the Association for the Advancement of Artificial Intelligence
Learning with Options That Terminate Off-Policy,2018,AAAI,the Association for the Advancement of Artificial Intelligence
Reinforced Multi-Label Image Classification by Exploring Curriculum,2018,AAAI,the Association for the Advancement of Artificial Intelligence
"An Efficient,  Expressive and Local Minima-Free Method for Learning Controlled Dynamical Systems",2018,AAAI,the Association for the Advancement of Artificial Intelligence
OptionGAN: Learning Joint Reward-Policy Options Using Generative Adversarial Inverse Reinforcement Learning,2018,AAAI,the Association for the Advancement of Artificial Intelligence
Deep Reinforcement Learning That Matters,2018,AAAI,the Association for the Advancement of Artificial Intelligence
Rainbow: Combining Improvements in Deep Reinforcement Learning,2018,AAAI,the Association for the Advancement of Artificial Intelligence
Deep Q-learning From Demonstrations,2018,AAAI,the Association for the Advancement of Artificial Intelligence
Decentralized High-Dimensional Bayesian Optimization with Factor Graphs,2018,AAAI,the Association for the Advancement of Artificial Intelligence
A Deep Model with Local Surrogate Loss for General Cost-Sensitive Multi-Label Learning,2018,AAAI,the Association for the Advancement of Artificial Intelligence
From Hashing to CNNs: Training Binary Weight Networks via Hashing,2018,AAAI,the Association for the Advancement of Artificial Intelligence
SNNN: Promoting Word Sentiment and Negation in Neural Sentiment Classification,2018,AAAI,the Association for the Advancement of Artificial Intelligence
On Convergence of Epanechnikov Mean Shift,2018,AAAI,the Association for the Advancement of Artificial Intelligence
Orthogonal Weight Normalization: Solution to Optimization Over Multiple Dependent Stiefel Manifolds in Deep Neural Networks,2018,AAAI,the Association for the Advancement of Artificial Intelligence
Building Deep Networks on Grassmann Manifolds,2018,AAAI,the Association for the Advancement of Artificial Intelligence
Accelerated Method for Stochastic Composition Optimization with Nonsmooth Regularization,2018,AAAI,the Association for the Advancement of Artificial Intelligence
Product Quantized Translation for Fast Nearest Neighbor Search,2018,AAAI,the Association for the Advancement of Artificial Intelligence
Selective Experience Replay for Lifelong Learning,2018,AAAI,the Association for the Advancement of Artificial Intelligence
Label Distribution Learning by Exploiting Label Correlations,2018,AAAI,the Association for the Advancement of Artificial Intelligence
Metric-Based Auto-Instructor for Learning Mixed Data Representation,2018,AAAI,the Association for the Advancement of Artificial Intelligence
Efficient Multi-Dimensional Tensor Sparse Coding Using t-Linear Combination,2018,AAAI,the Association for the Advancement of Artificial Intelligence
PAC Reinforcement Learning with an Imperfect Model,2018,AAAI,the Association for the Advancement of Artificial Intelligence
Asymmetric Deep Supervised Hashing,2018,AAAI,the Association for the Advancement of Artificial Intelligence
On Controlling the Size of Clusters in Probabilistic Clustering,2018,AAAI,the Association for the Advancement of Artificial Intelligence
Less-Forgetful Learning for Domain Expansion in Deep Neural Networks,2018,AAAI,the Association for the Advancement of Artificial Intelligence
Unified Spectral Clustering with Optimal Graph,2018,AAAI,the Association for the Advancement of Artificial Intelligence
Batchwise Patching of Classifiers,2018,AAAI,the Association for the Advancement of Artificial Intelligence
Deep Semi-Random Features for Nonlinear Function Approximation,2018,AAAI,the Association for the Advancement of Artificial Intelligence
Measuring Catastrophic Forgetting in Neural Networks,2018,AAAI,the Association for the Advancement of Artificial Intelligence
Approximate Vanishing Ideal via Data Knotting,2018,AAAI,the Association for the Advancement of Artificial Intelligence
Feature Engineering for Predictive Modeling Using Reinforcement Learning,2018,AAAI,the Association for the Advancement of Artificial Intelligence
Imitation Learning via Kernel Mean Embedding,2018,AAAI,the Association for the Advancement of Artificial Intelligence
On the Optimal Bit Complexity of Circulant Binary Embedding,2018,AAAI,the Association for the Advancement of Artificial Intelligence
Joint Dictionaries for Zero-Shot Learning,2018,AAAI,the Association for the Advancement of Artificial Intelligence
Dialogue Act Sequence Labeling Using Hierarchical Encoder with CRF,2018,AAAI,the Association for the Advancement of Artificial Intelligence
gOCCF: Graph-Theoretic One-Class Collaborative Filtering Based on Uninteresting Items,2018,AAAI,the Association for the Advancement of Artificial Intelligence
On Value Function Representation of Long Horizon Problems,2018,AAAI,the Association for the Advancement of Artificial Intelligence
Extremely Low Bit Neural Network: Squeeze the Last Bit Out with ADMM,2018,AAAI,the Association for the Advancement of Artificial Intelligence
Deterministic Policy Optimization by Combining Pathwise and Score Function Estimators for Discrete Action Spaces,2018,AAAI,the Association for the Advancement of Artificial Intelligence
Spatio-Temporal Graph Convolution for Skeleton Based Action Recognition,2018,AAAI,the Association for the Advancement of Artificial Intelligence
Learning to Generalize: Meta-Learning for Domain Generalization,2018,AAAI,the Association for the Advancement of Artificial Intelligence
A Probabilistic Hierarchical Model for Multi-View and Multi-Feature Classification,2018,AAAI,the Association for the Advancement of Artificial Intelligence
Predictive Coding Machine for Compressed Sensing and Image Denoising,2018,AAAI,the Association for the Advancement of Artificial Intelligence
Unsupervised Personalized Feature Selection,2018,AAAI,the Association for the Advancement of Artificial Intelligence
Latent Discriminant Subspace Representations for Multi-View Outlier Detection,2018,AAAI,the Association for the Advancement of Artificial Intelligence
Deep Learning for Case-Based Reasoning Through Prototypes: A Neural Network That Explains Its Predictions,2018,AAAI,the Association for the Advancement of Artificial Intelligence
Deeper Insights Into Graph Convolutional Networks for Semi-Supervised Learning,2018,AAAI,the Association for the Advancement of Artificial Intelligence
Adaptive Graph Convolutional Neural Networks,2018,AAAI,the Association for the Advancement of Artificial Intelligence
Online Clustering of Contextual Cascading Bandits,2018,AAAI,the Association for the Advancement of Artificial Intelligence
An Optimal Online Method of Selecting Source Policies for Reinforcement Learning,2018,AAAI,the Association for the Advancement of Artificial Intelligence
Statistical Inference Using SGD,2018,AAAI,the Association for the Advancement of Artificial Intelligence
Domain Generalization via Conditional Invariant Representations,2018,AAAI,the Association for the Advancement of Artificial Intelligence
Learning with Incomplete Labels,2018,AAAI,the Association for the Advancement of Artificial Intelligence
Balanced Clustering via Exclusive Lasso: A Pragmatic Approach,2018,AAAI,the Association for the Advancement of Artificial Intelligence
Robust Formulation for PCA: Avoiding Mean Calculation with L,2018,AAAI,the Association for the Advancement of Artificial Intelligence
"2, p",2018,AAAI,the Association for the Advancement of Artificial Intelligence
-norm Maximization,2018,AAAI,the Association for the Advancement of Artificial Intelligence
CoDiNMF: Co-Clustering of Directed Graphs via NMF,2018,AAAI,the Association for the Advancement of Artificial Intelligence
Transferable Contextual Bandit for Cross-Domain Recommendation,2018,AAAI,the Association for the Advancement of Artificial Intelligence
Riemannian Stein Variational Gradient Descent for Bayesian Inference,2018,AAAI,the Association for the Advancement of Artificial Intelligence
Dual Set Multi-Label Learning,2018,AAAI,the Association for the Advancement of Artificial Intelligence
Information Directed Sampling for Stochastic Bandits with Graph Feedback,2018,AAAI,the Association for the Advancement of Artificial Intelligence
A Change-Detection Based Framework for Piecewise-Stationary Multi-Armed Bandit Problem,2018,AAAI,the Association for the Advancement of Artificial Intelligence
Nonlinear Pairwise Layer and Its Training for Kernel Learning,2018,AAAI,the Association for the Advancement of Artificial Intelligence
A Batch Learning Framework for Scalable Personalized Ranking,2018,AAAI,the Association for the Advancement of Artificial Intelligence
Dynamic Deep Neural Networks: Optimizing Accuracy-Efficiency Trade-Offs by Selective Execution,2018,AAAI,the Association for the Advancement of Artificial Intelligence
Doubly Approximate Nearest Neighbor Classification,2018,AAAI,the Association for the Advancement of Artificial Intelligence
Euler Sparse Representation for Image Classification,2018,AAAI,the Association for the Advancement of Artificial Intelligence
Variational Probability Flow for Biologically Plausible Training of Deep Neural Networks,2018,AAAI,the Association for the Advancement of Artificial Intelligence
A Parallelizable Acceleration Framework for Packing Linear Programs,2018,AAAI,the Association for the Advancement of Artificial Intelligence
Nonconvex Sparse Spectral Clustering by Alternating Direction Method of Multipliers and Its Convergence Analysis,2018,AAAI,the Association for the Advancement of Artificial Intelligence
Matrix Variate Gaussian Mixture Distribution Steered Robust Metric Learning,2018,AAAI,the Association for the Advancement of Artificial Intelligence
Consistent and Specific Multi-View Subspace Clustering,2018,AAAI,the Association for the Advancement of Artificial Intelligence
Stochastic Non-Convex Ordinal Embedding with Stabilized Barzilai-Borwein Step Size,2018,AAAI,the Association for the Advancement of Artificial Intelligence
MDP-Based Cost Sensitive Classification Using Decision Trees,2018,AAAI,the Association for the Advancement of Artificial Intelligence
Data-Dependent Learning of Symmetric/Antisymmetric Relations for Knowledge Base Completion,2018,AAAI,the Association for the Advancement of Artificial Intelligence
Belief Reward Shaping in Reinforcement Learning,2018,AAAI,the Association for the Advancement of Artificial Intelligence
Learning Multi-Way Relations via Tensor Decomposition with Neural Networks,2018,AAAI,the Association for the Advancement of Artificial Intelligence
Subgraph Pattern Neural Networks for High-Order Graph Evolution Prediction,2018,AAAI,the Association for the Advancement of Artificial Intelligence
Exploiting Emotion on Reviews for Recommender Systems,2018,AAAI,the Association for the Advancement of Artificial Intelligence
Personalized Privacy-Preserving Social Recommendation,2018,AAAI,the Association for the Advancement of Artificial Intelligence
Proper Loss Functions for Nonlinear Hawkes Processes,2018,AAAI,the Association for the Advancement of Artificial Intelligence
Bernoulli Embeddings for Graphs,2018,AAAI,the Association for the Advancement of Artificial Intelligence
Core Dependency Networks,2018,AAAI,the Association for the Advancement of Artificial Intelligence
Mixed Sum-Product Networks: A Deep Architecture for Hybrid Domains,2018,AAAI,the Association for the Advancement of Artificial Intelligence
Alternating Circulant Random Features for Semigroup Kernels,2018,AAAI,the Association for the Advancement of Artificial Intelligence
Overlap-Robust Decision Boundary Learning for within-Network Classification,2018,AAAI,the Association for the Advancement of Artificial Intelligence
A Provable Approach for Double-Sparse Coding,2018,AAAI,the Association for the Advancement of Artificial Intelligence
Hierarchical Policy Search via Return-Weighted Density Estimation,2018,AAAI,the Association for the Advancement of Artificial Intelligence
Dynamic Determinantal Point Processes,2018,AAAI,the Association for the Advancement of Artificial Intelligence
Gaussian Process Decentralized Data Fusion Meets Transfer Learning in Large-Scale Distributed Cooperative Perception,2018,AAAI,the Association for the Advancement of Artificial Intelligence
Training CNNs with Normalized Kernels,2018,AAAI,the Association for the Advancement of Artificial Intelligence
Sparse Modeling-Based Sequential Ensemble Learning for Effective Outlier Detection in High-Dimensional Numeric Data,2018,AAAI,the Association for the Advancement of Artificial Intelligence
SAGA: A Submodular Greedy Algorithm for Group Recommendation,2018,AAAI,the Association for the Advancement of Artificial Intelligence
Quantized Memory-Augmented Neural Networks,2018,AAAI,the Association for the Advancement of Artificial Intelligence
Adversarial Dropout for Supervised and Semi-Supervised Learning,2018,AAAI,the Association for the Advancement of Artificial Intelligence
Alternating Optimisation and Quadrature for Robust Control,2018,AAAI,the Association for the Advancement of Artificial Intelligence
Multi-Adversarial Domain Adaptation,2018,AAAI,the Association for the Advancement of Artificial Intelligence
FiLM: Visual Reasoning with a General Conditioning Layer,2018,AAAI,the Association for the Advancement of Artificial Intelligence
Source Traces for Temporal Difference Learning,2018,AAAI,the Association for the Advancement of Artificial Intelligence
Randomized Clustered Nystrom for Large-Scale Kernel Machines,2018,AAAI,the Association for the Advancement of Artificial Intelligence
Joint Learning of Set Cardinality and State Distribution,2018,AAAI,the Association for the Advancement of Artificial Intelligence
Interpretable Graph-Based Semi-Supervised Learning via Flows,2018,AAAI,the Association for the Advancement of Artificial Intelligence
Hypergraph p-Laplacian: A Differential Geometry View,2018,AAAI,the Association for the Advancement of Artificial Intelligence
Word Co-Occurrence Regularized Non-Negative Matrix Tri-Factorization for Text Data Co-Clustering,2018,AAAI,the Association for the Advancement of Artificial Intelligence
Learning Vector Autoregressive Models with Latent Processes,2018,AAAI,the Association for the Advancement of Artificial Intelligence
Regularizing Deep Networks Using Efficient Layerwise Adversarial Training,2018,AAAI,the Association for the Advancement of Artificial Intelligence
From Monte Carlo to Las Vegas: Improving Restricted Boltzmann Machine Training Through Stopping Sets,2018,AAAI,the Association for the Advancement of Artificial Intelligence
On Data-Dependent Random Features for Improved Generalization in Supervised Learning,2018,AAAI,the Association for the Advancement of Artificial Intelligence
Labeled Memory Networks for Online Model Adaptation,2018,AAAI,the Association for the Advancement of Artificial Intelligence
No Modes Left Behind: Capturing the Data Distribution Effectively Using GANs,2018,AAAI,the Association for the Advancement of Artificial Intelligence
Reduced-Rank Linear Dynamical Systems,2018,AAAI,the Association for the Advancement of Artificial Intelligence
Wasserstein Distance Guided Representation Learning for Domain Adaptation,2018,AAAI,the Association for the Advancement of Artificial Intelligence
Compact Multi-Label Learning,2018,AAAI,the Association for the Advancement of Artificial Intelligence
Dynamic Optimization of Neural Network Structures Using Probabilistic Modeling,2018,AAAI,the Association for the Advancement of Artificial Intelligence
Learning to Interact with Learning Agents,2018,AAAI,the Association for the Advancement of Artificial Intelligence
Attend and Diagnose: Clinical Time Series Analysis Using Attention Models,2018,AAAI,the Association for the Advancement of Artificial Intelligence
Reinforcement Learning in POMDPs with Memoryless Options and Option-Observation Initiation Sets,2018,AAAI,the Association for the Advancement of Artificial Intelligence
"Active Lifelong Learning with ""Watchdog""",2018,AAAI,the Association for the Advancement of Artificial Intelligence
Leaf-Smoothed Hierarchical Softmax for Ordinal Prediction,2018,AAAI,the Association for the Advancement of Artificial Intelligence
Reliable Multi-View Clustering,2018,AAAI,the Association for the Advancement of Artificial Intelligence
Action Branching Architectures for Deep Reinforcement Learning,2018,AAAI,the Association for the Advancement of Artificial Intelligence
Detecting Adversarial Examples Through Image Transformation,2018,AAAI,the Association for the Advancement of Artificial Intelligence
Selective Verification Strategy for Learning From Crowds,2018,AAAI,the Association for the Advancement of Artificial Intelligence
Fourier Feature Approximations for Periodic Kernels in Time-Series Modelling,2018,AAAI,the Association for the Advancement of Artificial Intelligence
Sum-Product Autoencoding: Encoding and Decoding Representations Using Sum-Product Networks,2018,AAAI,the Association for the Advancement of Artificial Intelligence
Bayesian Functional Optimization,2018,AAAI,the Association for the Advancement of Artificial Intelligence
Kernel Cross-Correlator,2018,AAAI,the Association for the Advancement of Artificial Intelligence
Efficient Test-Time Predictor Learning with Group-Based Budget,2018,AAAI,the Association for the Advancement of Artificial Intelligence
Learning Transferable Subspace for Human Motion Segmentation,2018,AAAI,the Association for the Advancement of Artificial Intelligence
Information-Theoretic Domain Adaptation Under Severe Noise Conditions,2018,AAAI,the Association for the Advancement of Artificial Intelligence
Zero-Shot Learning via Class-Conditioned Deep Generative Models,2018,AAAI,the Association for the Advancement of Artificial Intelligence
Sparse Gaussian Conditional Random Fields on Top of Recurrent Neural Networks,2018,AAAI,the Association for the Advancement of Artificial Intelligence
On Multi-Relational Link Prediction with Bilinear Models,2018,AAAI,the Association for the Advancement of Artificial Intelligence
Towards Ultra-High Performance and Energy Efficiency of Deep Learning Systems: An Algorithm-Hardware Co-Optimization Framework,2018,AAAI,the Association for the Advancement of Artificial Intelligence
On the ERM Principle with Networked Data,2018,AAAI,the Association for the Advancement of Artificial Intelligence
High Rank Matrix Completion with Side Information,2018,AAAI,the Association for the Advancement of Artificial Intelligence
Adversarial Learning of Portable Student Networks,2018,AAAI,the Association for the Advancement of Artificial Intelligence
Orthant-Wise Passive Descent Algorithms for Training L,2018,AAAI,the Association for the Advancement of Artificial Intelligence
1,2018,AAAI,the Association for the Advancement of Artificial Intelligence
-Regularized Models,2018,AAAI,the Association for the Advancement of Artificial Intelligence
MERCS: Multi-Directional Ensembles of Regression and Classification Trees,2018,AAAI,the Association for the Advancement of Artificial Intelligence
Decoupled Convolutions for CNNs,2018,AAAI,the Association for the Advancement of Artificial Intelligence
Cooperative Learning of Energy-Based Model and Latent Variable Model via MCMC Teaching,2018,AAAI,the Association for the Advancement of Artificial Intelligence
Partial Multi-Label Learning,2018,AAAI,the Association for the Advancement of Artificial Intelligence
Semi-Supervised AUC Optimization without Guessing Labels of Unlabeled Data,2018,AAAI,the Association for the Advancement of Artificial Intelligence
Perception Coordination Network: A Framework for Online Multi-Modal Concept Acquisition and Binding,2018,AAAI,the Association for the Advancement of Artificial Intelligence
HodgeRank with Information Maximization for Crowdsourced Pairwise Ranking Aggregation,2018,AAAI,the Association for the Advancement of Artificial Intelligence
Deep Neural Network Compression with Single and Multiple Level Quantization,2018,AAAI,the Association for the Advancement of Artificial Intelligence
Informed Non-Convex Robust Principal Component Analysis with Features,2018,AAAI,the Association for the Advancement of Artificial Intelligence
Dictionary Learning in Optimal Metric Space,2018,AAAI,the Association for the Advancement of Artificial Intelligence
Automatic Model Selection in Subspace Clustering via Triplet Relationships,2018,AAAI,the Association for the Advancement of Artificial Intelligence
A Poisson Gamma Probabilistic Model for Latent Node-Group Memberships in Dynamic Networks,2018,AAAI,the Association for the Advancement of Artificial Intelligence
New l,2018,AAAI,the Association for the Advancement of Artificial Intelligence
"2, 1",2018,AAAI,the Association for the Advancement of Artificial Intelligence
-Norm Relaxation of Multi-Way Graph Cut for Clustering,2018,AAAI,the Association for the Advancement of Artificial Intelligence
Efficient K-Shot Learning with Regularized Deep Networks,2018,AAAI,the Association for the Advancement of Artificial Intelligence
Learning with Single-Teacher Multi-Student,2018,AAAI,the Association for the Advancement of Artificial Intelligence
Tau-FPL: Tolerance-Constrained Learning in Linear Time,2018,AAAI,the Association for the Advancement of Artificial Intelligence
Multi-Layer Multi-View Classification for Alzheimer’s Disease Diagnosis,2018,AAAI,the Association for the Advancement of Artificial Intelligence
