title,year,conf,conf_long
MultiSumm: Towards a Unified Model for Multi-Lingual Abstractive Summarization,2020,AAAI,the Association for the Advancement of Artificial Intelligence
Efficient Heterogeneous Collaborative Filtering without Negative Sampling for Recommendation,2020,AAAI,the Association for the Advancement of Artificial Intelligence
Revisiting Graph Based Collaborative Filtering: A Linear Residual Graph Convolutional Network Approach,2020,AAAI,the Association for the Advancement of Artificial Intelligence
Question-Driven Purchasing Propensity Analysis for Recommendation,2020,AAAI,the Association for the Advancement of Artificial Intelligence
Gradient Method for Continuous Influence Maximization with Budget-Saving Considerations,2020,AAAI,the Association for the Advancement of Artificial Intelligence
Norm-Explicit Quantization: Improving Vector Quantization for Maximum Inner Product Search,2020,AAAI,the Association for the Advancement of Artificial Intelligence
Modeling Fluency and Faithfulness for Diverse Neural Machine Translation,2020,AAAI,the Association for the Advancement of Artificial Intelligence
Leveraging Title-Abstract Attentive Semantics for Paper Recommendation,2020,AAAI,the Association for the Advancement of Artificial Intelligence
Preserving Ordinal Consensus: Towards Feature Selection for Unlabeled Data,2020,AAAI,the Association for the Advancement of Artificial Intelligence
An Attentional Recurrent Neural Network for Personalized Next Location Recommendation,2020,AAAI,the Association for the Advancement of Artificial Intelligence
Re-Attention for Visual Question Answering,2020,AAAI,the Association for the Advancement of Artificial Intelligence
Semi-Supervised Multi-Modal Learning with Balanced Spectral Decomposition,2020,AAAI,the Association for the Advancement of Artificial Intelligence
MuMod: A Micro-Unit Connection Approach for Hybrid-Order Community Detection,2020,AAAI,the Association for the Advancement of Artificial Intelligence
Cross-Lingual Pre-Training Based Transfer for Zero-Shot Neural Machine Translation,2020,AAAI,the Association for the Advancement of Artificial Intelligence
Functionality Discovery and Prediction of Physical Objects,2020,AAAI,the Association for the Advancement of Artificial Intelligence
True Nonlinear Dynamics from Incomplete Networks,2020,AAAI,the Association for the Advancement of Artificial Intelligence
Understanding and Improving Proximity Graph Based Maximum Inner Product Search,2020,AAAI,the Association for the Advancement of Artificial Intelligence
Type-Aware Anchor Link Prediction across Heterogeneous Networks Based on Graph Attention Network,2020,AAAI,the Association for the Advancement of Artificial Intelligence
Deep Match to Rank Model for Personalized Click-Through Rate Prediction,2020,AAAI,the Association for the Advancement of Artificial Intelligence
Modality to Modality Translation: An Adversarial Representation Learning and Graph Fusion Network for Multimodal Fusion,2020,AAAI,the Association for the Advancement of Artificial Intelligence
A Variational Point Process Model for Social Event Sequences,2020,AAAI,the Association for the Advancement of Artificial Intelligence
Incremental Fairness in Two-Sided Market Platforms: On Smoothly Updating Recommendations,2020,AAAI,the Association for the Advancement of Artificial Intelligence
Towards Comprehensive Recommender Systems: Time-Aware Unified Recommendations Based on Listwise Ranking of Implicit Cross-Network Data,2020,AAAI,the Association for the Advancement of Artificial Intelligence
Minimizing the Bag-of-Ngrams Difference for Non-Autoregressive Neural Machine Translation,2020,AAAI,the Association for the Advancement of Artificial Intelligence
PEIA: Personality and Emotion Integrated Attentive Model for Music Recommendation on Social Media Platforms,2020,AAAI,the Association for the Advancement of Artificial Intelligence
Where to Go Next: Modeling Long- and Short-Term User Preferences for Point-of-Interest Recommendation,2020,AAAI,the Association for the Advancement of Artificial Intelligence
Knowledge Graph Alignment Network with Gated Multi-Hop Neighborhood Aggregation,2020,AAAI,the Association for the Advancement of Artificial Intelligence
Learning with Unsure Responses,2020,AAAI,the Association for the Advancement of Artificial Intelligence
Author Name Disambiguation on Heterogeneous Information Network with Adversarial Representation Learning,2020,AAAI,the Association for the Advancement of Artificial Intelligence
Social Influence Does Matter: User Action Prediction for In-Feed Advertising,2020,AAAI,the Association for the Advancement of Artificial Intelligence
A Spherical Convolution Approach for Learning Long Term Viewport Prediction in 360 Immersive Video,2020,AAAI,the Association for the Advancement of Artificial Intelligence
Mining Unfollow Behavior in Large-Scale Online Social Networks via Spatial-Temporal Interaction,2020,AAAI,the Association for the Advancement of Artificial Intelligence
Who Likes What? -- SplitLBI in Exploring Preferential Diversity of Ratings,2020,AAAI,the Association for the Advancement of Artificial Intelligence
Multi-Feature Discrete Collaborative Filtering for Fast Cold-Start Recommendation,2020,AAAI,the Association for the Advancement of Artificial Intelligence
Cross-Modal Attention Network for Temporal Inconsistent Audio-Visual Event Localization,2020,AAAI,the Association for the Advancement of Artificial Intelligence
Learning to Match on Graph for Fashion Compatibility Modeling,2020,AAAI,the Association for the Advancement of Artificial Intelligence
D2D-LSTM: LSTM-Based Path Prediction of Content Diffusion Tree in Device-to-Device Social Networks,2020,AAAI,the Association for the Advancement of Artificial Intelligence
An End-to-End Visual-Audio Attention Network for Emotion Recognition in User-Generated Videos,2020,AAAI,the Association for the Advancement of Artificial Intelligence
Multi-Channel Reverse Dictionary Model,2020,AAAI,the Association for the Advancement of Artificial Intelligence
Table2Analysis: Modeling and Recommendation of Common Analysis Patterns for Multi-Dimensional Data,2020,AAAI,the Association for the Advancement of Artificial Intelligence
A Recurrent Model for Collective Entity Linking with Adaptive Features,2020,AAAI,the Association for the Advancement of Artificial Intelligence
FairyTED: A Fair Rating Predictor for TED Talk Data,2020,AAAI,the Association for the Advancement of Artificial Intelligence
"Crisis-DIAS: Towards Multimodal Damage Analysis - Deployment, Challenges and Assessment",2020,AAAI,the Association for the Advancement of Artificial Intelligence
Unsupervised Detection of Sub-Events in Large Scale Disasters,2020,AAAI,the Association for the Advancement of Artificial Intelligence
Spatio-Temporal Attention-Based Neural Network for Credit Card Fraud Detection,2020,AAAI,the Association for the Advancement of Artificial Intelligence
Tracking Disaster Footprints with Social Streaming Data,2020,AAAI,the Association for the Advancement of Artificial Intelligence
Detecting and Tracking Communal Bird Roosts in Weather Radar Data,2020,AAAI,the Association for the Advancement of Artificial Intelligence
"Hindi-English Hate Speech Detection: Author Profiling, Debiasing, and Practical Perspectives",2020,AAAI,the Association for the Advancement of Artificial Intelligence
Inferring Nighttime Satellite Imagery from Human Mobility,2020,AAAI,the Association for the Advancement of Artificial Intelligence
A Distributed Multi-Sensor Machine Learning Approach to Earthquake Early Warning,2020,AAAI,the Association for the Advancement of Artificial Intelligence
Faking Fairness via Stealthily Biased Sampling,2020,AAAI,the Association for the Advancement of Artificial Intelligence
Discriminating Cognitive Disequilibrium and Flow in Problem Solving: A Semi-Supervised Approach Using Involuntary Dynamic Behavioral Signals,2020,AAAI,the Association for the Advancement of Artificial Intelligence
Lightweight and Robust Representation of Economic Scales from Satellite Imagery,2020,AAAI,the Association for the Advancement of Artificial Intelligence
The Unreasonable Effectiveness of Inverse Reinforcement Learning in Advancing Cancer Research,2020,AAAI,the Association for the Advancement of Artificial Intelligence
Linguistic Fingerprints of Internet Censorship: The Case of Sina Weibo,2020,AAAI,the Association for the Advancement of Artificial Intelligence
Voice for the Voiceless: Active Sampling to Detect Comments Supporting the Rohingyas,2020,AAAI,the Association for the Advancement of Artificial Intelligence
Guided Weak Supervision for Action Recognition with Scarce Data to Assess Skills of Children with Autism,2020,AAAI,the Association for the Advancement of Artificial Intelligence
The Stanford Acuity Test: A Precise Vision Test Using Bayesian Techniques and a Discovery in Human Visual Response,2020,AAAI,the Association for the Advancement of Artificial Intelligence
Automatically Neutralizing Subjective Bias in Text,2020,AAAI,the Association for the Advancement of Artificial Intelligence
Capturing the Style of Fake News,2020,AAAI,the Association for the Advancement of Artificial Intelligence
On Identifying Hashtags in Disaster Twitter Data,2020,AAAI,the Association for the Advancement of Artificial Intelligence
Neural Approximate Dynamic Programming for On-Demand Ride-Pooling,2020,AAAI,the Association for the Advancement of Artificial Intelligence
Weak Supervision for Fake News Detection via Reinforcement Learning,2020,AAAI,the Association for the Advancement of Artificial Intelligence
Protecting Geolocation Privacy of Photo Collections,2020,AAAI,the Association for the Advancement of Artificial Intelligence
Weakly-Supervised Fine-Grained Event Recognition on Social Media Texts for Disaster Management,2020,AAAI,the Association for the Advancement of Artificial Intelligence
Interactive Learning with Proactive Cognition Enhancement for Crowd Workers,2020,AAAI,the Association for the Advancement of Artificial Intelligence
Rumor Detection on Social Media with Bi-Directional Graph Convolutional Networks,2020,AAAI,the Association for the Advancement of Artificial Intelligence
Doctor2Vec: Dynamic Doctor Representation Learning for Clinical Trial Recruitment,2020,AAAI,the Association for the Advancement of Artificial Intelligence
TrueLearn: A Family of Bayesian Algorithms to Match Lifelong Learners to Open Educational Resources,2020,AAAI,the Association for the Advancement of Artificial Intelligence
Real-Time Route Search by Locations,2020,AAAI,the Association for the Advancement of Artificial Intelligence
Pay Your Trip for Traffic Congestion: Dynamic Pricing in Traffic-Aware Road Networks,2020,AAAI,the Association for the Advancement of Artificial Intelligence
Adaptive Greedy versus Non-Adaptive Greedy for Influence Maximization,2020,AAAI,the Association for the Advancement of Artificial Intelligence
DeepVar: An End-to-End Deep Learning Approach for Genomic Variant Recognition in Biomedical Literature,2020,AAAI,the Association for the Advancement of Artificial Intelligence
Learning the Graphical Structure of Electronic Health Records with Graph Convolutional Transformer,2020,AAAI,the Association for the Advancement of Artificial Intelligence
CONAN: Complementary Pattern Augmentation for Rare Disease Detection,2020,AAAI,the Association for the Advancement of Artificial Intelligence
Differentially Private and Fair Classification via Calibrated Functional Mechanism,2020,AAAI,the Association for the Advancement of Artificial Intelligence
Predicting AC Optimal Power Flows: Combining Deep Learning and Lagrangian Dual Methods,2020,AAAI,the Association for the Advancement of Artificial Intelligence
CORE: Automatic Molecule Optimization Using Copy & Refine Strategy,2020,AAAI,the Association for the Advancement of Artificial Intelligence
GAN-Based Unpaired Chinese Character Image Translation via Skeleton Transformation and Stroke Rendering,2020,AAAI,the Association for the Advancement of Artificial Intelligence
Predictive Student Modeling in Educational Games with Multi-Task Learning,2020,AAAI,the Association for the Advancement of Artificial Intelligence
Enhancing Personalized Trip Recommendation with Attractive Routes,2020,AAAI,the Association for the Advancement of Artificial Intelligence
Graduate Employment Prediction with Bias,2020,AAAI,the Association for the Advancement of Artificial Intelligence
Multi-Scale Anomaly Detection on Attributed Networks,2020,AAAI,the Association for the Advancement of Artificial Intelligence
Accurate Structured-Text Spotting for Arithmetical Exercise Correction,2020,AAAI,the Association for the Advancement of Artificial Intelligence
Pairwise Learning with Differential Privacy Guarantees,2020,AAAI,the Association for the Advancement of Artificial Intelligence
CASTER: Predicting Drug Interactions with Chemical Substructure Representation,2020,AAAI,the Association for the Advancement of Artificial Intelligence
RL-Duet: Online Music Accompaniment Generation Using Deep Reinforcement Learning,2020,AAAI,the Association for the Advancement of Artificial Intelligence
A Graph Auto-Encoder for Haplotype Assembly and Viral Quasispecies Reconstruction,2020,AAAI,the Association for the Advancement of Artificial Intelligence
Generating Realistic Stock Market Order Streams,2020,AAAI,the Association for the Advancement of Artificial Intelligence
SynSig2Vec: Learning Representations from Synthetic Dynamic Signatures for Real-World Verification,2020,AAAI,the Association for the Advancement of Artificial Intelligence
DeepAlerts: Deep Learning Based Multi-Horizon Alerts for Clinical Deterioration on Oncology Hospital Wards,2020,AAAI,the Association for the Advancement of Artificial Intelligence
Region Focus Network for Joint Optic Disc and Cup Segmentation,2020,AAAI,the Association for the Advancement of Artificial Intelligence
Pose-Assisted Multi-Camera Collaboration for Active Object Tracking,2020,AAAI,the Association for the Advancement of Artificial Intelligence
Robust Low-Rank Discovery of Data-Driven Partial Differential Equations,2020,AAAI,the Association for the Advancement of Artificial Intelligence
Towards Cross-Modality Medical Image Segmentation with Online Mutual Knowledge Distillation,2020,AAAI,the Association for the Advancement of Artificial Intelligence
Privacy-Preserving Gradient Boosting Decision Trees,2020,AAAI,the Association for the Advancement of Artificial Intelligence
MRI Reconstruction with Interpretable Pixel-Wise Operations Using Reinforcement Learning,2020,AAAI,the Association for the Advancement of Artificial Intelligence
PSENet: Psoriasis Severity Evaluation Network,2020,AAAI,the Association for the Advancement of Artificial Intelligence
Learning Geo-Contextual Embeddings for Commuting Flow Prediction,2020,AAAI,the Association for the Advancement of Artificial Intelligence
Learning Multi-Modal Biomarker Representations via Globally Aligned Longitudinal Enrichments,2020,AAAI,the Association for the Advancement of Artificial Intelligence
AdaCare: Explainable Clinical Health Status Representation Learning via Scale-Adaptive Feature Extraction and Recalibration,2020,AAAI,the Association for the Advancement of Artificial Intelligence
ConCare: Personalized Clinical Feature Embedding via Capturing the Healthcare Context,2020,AAAI,the Association for the Advancement of Artificial Intelligence
Bursting the Filter Bubble: Fairness-Aware Network Link Prediction,2020,AAAI,the Association for the Advancement of Artificial Intelligence
Gait Recognition for Co-Existing Multiple People Using Millimeter Wave Sensing,2020,AAAI,the Association for the Advancement of Artificial Intelligence
Generalizable Resource Allocation in Stream Processing via Deep Reinforcement Learning,2020,AAAI,the Association for the Advancement of Artificial Intelligence
ActiveThief: Model Extraction Using Active Learning and Unannotated Public Data,2020,AAAI,the Association for the Advancement of Artificial Intelligence
Chemically Interpretable Graph Interaction Network for Prediction of Pharmacokinetic Properties of Drug-Like Molecules,2020,AAAI,the Association for the Advancement of Artificial Intelligence
FuzzE: Fuzzy Fairness Evaluation of Offensive Language Classifiers on African-American English,2020,AAAI,the Association for the Advancement of Artificial Intelligence
Learning to Generate Maps from Trajectories,2020,AAAI,the Association for the Advancement of Artificial Intelligence
Spatial Classification with Limited Observations Based on Physics-Aware Structural Constraint,2020,AAAI,the Association for the Advancement of Artificial Intelligence
Effective Decoding in Graph Auto-Encoder Using Triadic Closure,2020,AAAI,the Association for the Advancement of Artificial Intelligence
Spatial-Temporal Synchronous Graph Convolutional Networks: A New Framework for Spatial-Temporal Network Data Forecasting,2020,AAAI,the Association for the Advancement of Artificial Intelligence
Continuous Multiagent Control Using Collective Behavior Entropy for Large-Scale Home Energy Management,2020,AAAI,the Association for the Advancement of Artificial Intelligence
DATA-GRU: Dual-Attention Time-Aware Gated Recurrent Unit for Irregular Multivariate Time Series,2020,AAAI,the Association for the Advancement of Artificial Intelligence
Finding Minimum-Weight Link-Disjoint Paths with a Few Common Nodes,2020,AAAI,the Association for the Advancement of Artificial Intelligence
Finding Needles in a Moving Haystack: Prioritizing Alerts with Adversarial Reinforcement Learning,2020,AAAI,the Association for the Advancement of Artificial Intelligence
Robust Adversarial Objects against Deep Learning Models,2020,AAAI,the Association for the Advancement of Artificial Intelligence
OMuLeT: Online Multi-Lead Time Location Prediction for Hurricane Trajectory Forecasting,2020,AAAI,the Association for the Advancement of Artificial Intelligence
Incorporating Expert-Based Investment Opinion Signals in Stock Prediction: A Deep Learning Framework,2020,AAAI,the Association for the Advancement of Artificial Intelligence
Graph-Driven Generative Models for Heterogeneous Multi-Task Learning,2020,AAAI,the Association for the Advancement of Artificial Intelligence
Topic Enhanced Sentiment Spreading Model in Social Networks Considering User Interest,2020,AAAI,the Association for the Advancement of Artificial Intelligence
HDK: Toward High-Performance Deep-Learning-Based Kirchhoff Analysis,2020,AAAI,the Association for the Advancement of Artificial Intelligence
Actor Critic Deep Reinforcement Learning for Neural Malware Control,2020,AAAI,the Association for the Advancement of Artificial Intelligence
Urban2Vec: Incorporating Street View Imagery and POIs for Multi-Modal Urban Neighborhood Embedding,2020,AAAI,the Association for the Advancement of Artificial Intelligence
Hiding in Multilayer Networks,2020,AAAI,the Association for the Advancement of Artificial Intelligence
A Deep Neural Network Model of Particle Thermal Radiation in Packed Bed,2020,AAAI,the Association for the Advancement of Artificial Intelligence
DeepDualMapper: A Gated Fusion Network for Automatic Map Extraction Using Aerial Images and Trajectories,2020,AAAI,the Association for the Advancement of Artificial Intelligence
Accelerating and Improving AlphaZero Using Population Based Training,2020,AAAI,the Association for the Advancement of Artificial Intelligence
Graph Convolutional Networks with Markov Random Field Reasoning for Social Spammer Detection,2020,AAAI,the Association for the Advancement of Artificial Intelligence
Generative Adversarial Regularized Mutual Information Policy Gradient Framework for Automatic Diagnosis,2020,AAAI,the Association for the Advancement of Artificial Intelligence
Generate (Non-Software) Bugs to Fool Classifiers,2020,AAAI,the Association for the Advancement of Artificial Intelligence
Fairness-Aware Demand Prediction for New Mobility,2020,AAAI,the Association for the Advancement of Artificial Intelligence
Beyond Digital Domain: Fooling Deep Learning Based Recognition System in Physical World,2020,AAAI,the Association for the Advancement of Artificial Intelligence
Scalable and Generalizable Social Bot Detection through Data Selection,2020,AAAI,the Association for the Advancement of Artificial Intelligence
Instance-Wise Dynamic Sensor Selection for Human Activity Recognition,2020,AAAI,the Association for the Advancement of Artificial Intelligence
Reinforcement-Learning Based Portfolio Management with Augmented Asset Movement Prediction States,2020,AAAI,the Association for the Advancement of Artificial Intelligence
Attention Based Data Hiding with Generative Adversarial Networks,2020,AAAI,the Association for the Advancement of Artificial Intelligence
AirNet: A Calibration Model for Low-Cost Air Monitoring Sensors Using Dual Sequence Encoder Networks,2020,AAAI,the Association for the Advancement of Artificial Intelligence
Towards Hands-Free Visual Dialog Interactive Recommendation,2020,AAAI,the Association for the Advancement of Artificial Intelligence
Order Matters: Semantic-Aware Neural Networks for Binary Code Similarity Detection,2020,AAAI,the Association for the Advancement of Artificial Intelligence
MetaLight: Value-Based Meta-Reinforcement Learning for Traffic Signal Control,2020,AAAI,the Association for the Advancement of Artificial Intelligence
Geometry-Constrained Car Recognition Using a 3D Perspective Network,2020,AAAI,the Association for the Advancement of Artificial Intelligence
Generating Adversarial Examples for Holding Robustness of Source Code Processing Models,2020,AAAI,the Association for the Advancement of Artificial Intelligence
Spatio-Temporal Graph Structure Learning for Traffic Forecasting,2020,AAAI,the Association for the Advancement of Artificial Intelligence
Semi-Supervised Hierarchical Recurrent Graph Neural Network for City-Wide Parking Availability Prediction,2020,AAAI,the Association for the Advancement of Artificial Intelligence
Shoreline: Data-Driven Threshold Estimation of Online Reserves of Cryptocurrency Trading Platforms,2020,AAAI,the Association for the Advancement of Artificial Intelligence
A Novel Learning Framework for Sampling-Based Motion Planning in Autonomous Driving,2020,AAAI,the Association for the Advancement of Artificial Intelligence
Dynamic Malware Analysis with Feature Engineering and Feature Learning,2020,AAAI,the Association for the Advancement of Artificial Intelligence
"OF-MSRN: Optical Flow-Auxiliary Multi-Task Regression Network for Direct Quantitative Measurement, Segmentation and Motion Estimation",2020,AAAI,the Association for the Advancement of Artificial Intelligence
MaskGEC: Improving Neural Grammatical Error Correction via Dynamic Masking,2020,AAAI,the Association for the Advancement of Artificial Intelligence
GMAN: A Graph Multi-Attention Network for Traffic Prediction,2020,AAAI,the Association for the Advancement of Artificial Intelligence
Index Tracking with Cardinality Constraints: A Stochastic Neural Networks Approach,2020,AAAI,the Association for the Advancement of Artificial Intelligence
Iteratively Questioning and Answering for Interpretable Legal Judgment Prediction,2020,AAAI,the Association for the Advancement of Artificial Intelligence
RiskOracle: A Minute-Level Citywide Traffic Accident Forecasting Framework,2020,AAAI,the Association for the Advancement of Artificial Intelligence
Deep Reservoir Computing Meets 5G MIMO-OFDM Systems in Symbol Detection,2020,AAAI,the Association for the Advancement of Artificial Intelligence
MixedAD: A Scalable Algorithm for Detecting Mixed Anomalies in Attributed Graphs,2020,AAAI,the Association for the Advancement of Artificial Intelligence
Theory-Based Causal Transfer:Integrating Instance-Level Induction and Abstract-Level Structure Learning,2020,AAAI,the Association for the Advancement of Artificial Intelligence
Deep Spiking Delayed Feedback Reservoirs and Its Application in Spectrum Sensing of MIMO-OFDM Dynamic Spectrum Sharing,2020,AAAI,the Association for the Advancement of Artificial Intelligence
"People Do Not Just Plan,They Plan to Plan",2020,AAAI,the Association for the Advancement of Artificial Intelligence
Effective AER Object Classification Using Segmented Probability-Maximization Learning in Spiking Neural Networks,2020,AAAI,the Association for the Advancement of Artificial Intelligence
Biologically Plausible Sequence Learning with Spiking Neural Networks,2020,AAAI,the Association for the Advancement of Artificial Intelligence
Transfer Reinforcement Learning Using Output-Gated Working Memory,2020,AAAI,the Association for the Advancement of Artificial Intelligence
Machine Number Sense: A Dataset of Visual Arithmetic Problems for Abstract and Relational Reasoning,2020,AAAI,the Association for the Advancement of Artificial Intelligence
STEP: Spatial Temporal Graph Convolutional Networks for Emotion Perception from Gaits,2020,AAAI,the Association for the Advancement of Artificial Intelligence
Synch-Graph: Multisensory Emotion Recognition Through Neural Synchrony via Graph Convolutional Networks,2020,AAAI,the Association for the Advancement of Artificial Intelligence
"M3ER: Multiplicative Multimodal Emotion Recognition using Facial, Textual, and Speech Cues",2020,AAAI,the Association for the Advancement of Artificial Intelligence
To Signal or Not To Signal: Exploiting Uncertain Real-Time Information in Signaling Games for Security and Sustainability,2020,AAAI,the Association for the Advancement of Artificial Intelligence
End-to-End Game-Focused Learning of Adversary Behavior in Security Games,2020,AAAI,the Association for the Advancement of Artificial Intelligence
